id,nomor_rekening,nama_lengkap,tanggal_transaksi,jumlah_kredit,keterangan
464,3529134921113927,Tallou Hof,9/2/2024,606102.11,"Savory pizza filled with pepperoni and cheese, ready to microwave."
465,560225555689595903,Rodi Perin,2/23/2025,72126.56,Durable bag for carrying your yoga mat and accessories.
466,374288900540872,Bartholomeo Saville,7/22/2024,949813.91,"Quick oatmeal packets infused with apple and cinnamon, perfect for breakfast."
467,3579107707450662,Mirabella Byfield,2/10/2025,491505.04,"Soft and pillowy gnocchi made from cauliflower, perfect with sauce."
468,372301690264298,Jackqueline Diamant,1/5/2025,601019.61,Crunchy granola with chocolate and hazelnuts for breakfast.
469,3545596859714977,Nona Vinton,12/28/2024,896660.97,Toy drone that flies with gestures and is easy to control.
470,30269676441939,Ado Frostdicke,11/13/2024,352733.9,"Crisp and sweet Honeycrisp apples, freshly picked."
471,3589445023826118,Ryley Branford,7/1/2024,588471.34,Challenging 1000-piece jigsaw puzzle for all ages.
472,4844314238334137,Chastity Jacobsz,2/22/2025,392970.41,"Soft pretzel bites, perfect for dipping in mustard or cheese sauce."
473,201954133264668,Ethelind Deinert,11/22/2024,427833.85,Delicious ravioli filled with creamy ricotta and fresh spinach.
474,30537251387218,Lorain Klimashevich,9/23/2024,870635.02,Comfortable gaming chair for long hours of play.
475,3569613245166076,Hollis Pasticznyk,9/12/2024,68708.35,Crunchy and flavorful mix of oats and honey.
476,3589010125657637,Mervin Bagehot,12/12/2024,122783.93,Easy-to-use tiebacks for curtains or drapes.
477,5542264528289339,Mollie Cotilard,1/19/2025,694594.46,Crispy breadsticks seasoned with herbs and garlic.
478,5431341197067628,Mechelle Ixor,7/1/2024,885356.53,Cute dispenser for bathrooms or kitchens featuring paw prints.
479,5602215415877203,Brooks Faughnan,2/12/2025,508167.98,Oatmeal made with savory spices and vegetables.
480,67594282891208279,Rhys Woodburne,10/13/2024,191947.1,Essential survival gear kit for emergencies.
481,3580100696693126,Netty McGlashan,11/19/2024,267193.72,Pulled jackfruit in a smoky BBQ sauce for a tasty vegan dish.
482,4175006758891160,Sydel Taysbil,3/8/2025,77086.68,Stackable measuring cups made from stainless steel.
483,676217780631842179,Lucho Dudgeon,5/23/2024,117260.71,Inspiring cookbook with healthy recipes.
484,3542826561428563,Deny Sueter,11/13/2024,55185.57,"Nutty flavored chia seeds, packed with nutrients."
485,3559257152857566,Elaine Horbath,3/16/2025,566959.59,HD streaming device for accessing popular services.
486,3563589654045124,Benedick Cleeve,6/7/2024,959913.83,Handy belt for carrying garden tools while working.
487,3571131242528376,Antonetta Gheeraert,5/12/2024,171504.38,"Shrimp marinated in a honey garlic sauce, ready to cook."
488,3567930439722668,Brent Gliddon,1/8/2025,543681.8,"Lean and versatile ground turkey, perfect for various dishes."
489,67066764780200342,Sander Trusdale,12/18/2024,25766.66,Adjustable stand for smartphones and tablets.
490,3564952731965228,Dionysus Klimpke,2/8/2025,492127.1,Compact Bluetooth speaker with rich sound quality.
491,3575389265175006,Fons Powling,6/17/2024,853336.65,Battery-operated motion sensor light for safety.
492,3536948605410189,Lamond Swallow,5/9/2025,136284.31,Space-saving rack to store and organize spices conveniently.
493,3571556863970624,Laurene Tearney,12/15/2024,31608.57,BPA-free sports bottle with flip-top lid.
494,3547531452617200,Rollie Furley,7/10/2024,261529.83,Handheld sprayer designed for washing pets easily.
495,4175008704581838,Rosmunda Voak,3/16/2025,43796.67,"Freshly baked whole wheat bread, rich in fiber."
496,4175007964428557,Morten Callander,1/19/2025,503772.95,Creamy mayonnaise made with avocado oil for a healthier twist.
497,4041597848581607,Bianka Bedding,9/14/2024,835203.28,"Delicious and fully cooked sliced ham, ready to eat."
498,6706717205942710,Marena Ledgeway,2/7/2025,238017.55,Rich and flavorful pasta sauce made with ripe tomatoes and basil.
499,5602214937236217918,Trefor Diemer,1/14/2025,473057.37,"Blend of cheddar and mozzarella cheese, great for recipes."
500,5108759467935384,Gracia Cuncarr,12/5/2024,227021.52,Cordless electric screwdriver for home projects.
501,5010126627495542,Palm Feaviour,6/10/2024,780489.06,UV-blocking clothing for outdoor activities.
502,3547068130345938,Kimball Freeman,4/8/2025,329688.42,Savory sauce perfect for pasta or dipping.
503,5376648764687589,Josie Ruggles,12/28/2024,942191.25,Peel and stick wallpaper for easy home decor changes.
504,564182823976864389,Cleve Harvett,12/28/2024,276658.85,Versatile folding table great for events or outdoor activities.
505,5010126248464737,Susie Rudolf,6/12/2024,448425.73,Chic wrap jumpsuit that flatters the body and is perfect for any occasion.
506,374622723308010,Katharina Rawne,9/2/2024,208485.5,"Soft and fluffy whole wheat pita bread, great for wraps."
507,4508059576895473,Shanie Mabe,10/5/2024,749875.71,Space-saving solution to store shoes and keep them organized.
508,3544441391465500,Massimiliano Vere,12/10/2024,863419.42,DIY projector that magnifies your smartphone screen for movie nights.
509,6762513697159963547,Jarvis Lipprose,5/23/2024,439318.54,Bluetooth scale that tracks body composition through an app.
510,6333170052829104,Cristi Downes,7/26/2024,590504.78,"Crispy baked radish chips, a healthy snack alternative."
511,3552594612118743,Arch Queen,3/30/2025,127275.96,"Tangy goat cheese infused with herbs, perfect for snacking."
512,6304718329207416,Rorke Kingscote,3/24/2025,423310.5,Add a smoky flavor to your dishes.
513,3583514972817281,Iseabal Vanyutin,1/23/2025,500324.56,Functional leggings designed for maximum comfort during workouts.
514,374622180066135,Thadeus Athelstan,11/19/2024,876955.16,"Quick-cooking couscous, great as a side or base."
515,30377422526653,Vale Clewlow,10/17/2024,210041.93,Compact sterilizer for disinfecting small items.
516,346277136008296,Glen Sandeford,4/6/2025,402214.92,Nutty-scented oil for stir-fry and marinades.
517,5509965626615628,Scarlett Giblett,9/4/2024,852557.96,"A delightful mix of nuts, fruit, and chocolate."
518,3545955783986046,Kaila Sinson,1/7/2025,206081.17,Spice blend for creating flavorful vegan taco filling.
519,3586176521184501,Rickie Kibby,12/26/2024,602845.16,A pack of assorted nut and protein bars for a quick energy boost.
520,3578815941052265,Natalya Robertsson,4/7/2025,337758.27,Juicy raisins coated in rich dark chocolate.
521,6706370768641396288,Ealasaid Tomsa,5/24/2024,224066.17,Spicy buffalo sauce ideal for wings or dipping.
522,30417924062425,Kellia Reinhardt,7/20/2024,772495.57,Unique coffee brewing method for a flavorful experience.
523,3576116660337702,Pryce Newey,12/8/2024,258530.84,"Tender riblets coated in a honey barbecue glaze, perfect for grilling or baking."
524,3546541628932186,Ole Pikesley,9/8/2024,409572.28,Classic fit blue jeans with a slight stretch for comfort and durability.
525,30589154435412,Norby Rignoldes,3/30/2025,545893.63,"Elegant midi skirt with a wrap design, great for both formal and casual events."
526,5610498428070079,Demetri Angliss,10/26/2024,299289.39,Nutritious bars packed with protein for energy
527,6334278617422939036,Elston Dolling,3/25/2025,53623.93,Durable yoga strap for deeper stretches.
528,3576824466088490,Brnaba Storres,12/29/2024,417195.47,Corn on the cob seasoned with chili and lime for a spicy kick.
529,3550833973289962,Jeannine Perrot,3/20/2025,450457.99,Eco-friendly bamboo cutting board for food prep.
530,30130784319070,Allie Lipscombe,12/21/2024,754040.78,A zero-calorie coconut oil spray for cooking and baking.
531,340412176620009,Corly Waltering,4/10/2025,388716.38,Portable case to organize and protect jewelry on trips.
532,4017952870244,Rriocard Raikes,7/1/2024,3938.21,Stylish case with magnetic closure for smartphones.
533,5100170026992908,Marcile Buckenham,10/2/2024,831584.99,Healthy snack bars packed with oats and fruit.
534,30018761447446,Donella Gartenfeld,1/12/2025,871668.92,"Ready-to-eat salad with quinoa and kale, drizzled with vinaigrette."
535,3536338084612325,Marika Jorin,10/6/2024,807642.84,Eco-friendly reusable bags for snacks.
536,5048378454035588,Heall Antecki,2/4/2025,315589.75,A comfortable sweatshirt featuring a bold graphic print.
537,5602244532516940,Malinda Crackel,11/14/2024,368851.89,Spacious duffle bag for weekend getaways.
538,3568350487935014,Alfonso Kybert,2/3/2025,108950.4,A stunning lace dress perfect for special occasions.
539,3569962995462262,Wayland Perillo,12/12/2024,526597.44,"A delicious creamy dip featuring spinach and artichokes, perfect for parties."
540,30391799058612,Onfroi Catling,8/10/2024,394194.46,Warm oatmeal flavored with apple and cinnamon.
541,67597817186490863,Neal Godbold,7/19/2024,266018.33,Automatically cooks eggs to your desired level.
542,30306090975868,Gus Richings,2/13/2025,44829.75,Stay dry with these stylish waterproof rain boots.
543,5038134907787651,Vlad Macartney,9/20/2024,149607.44,Complete grooming kit for dogs and cats.
544,374622320378911,Valene Campbell,12/15/2024,152654.86,Crunchy granola mixed with coconut flakes.
545,5602244014152835653,Timmie Simpson,7/28/2024,623367.65,Durable toy designed for heavy chewers.
546,3574837475605601,Brent Dechelette,12/15/2024,583540.2,Fresh walnut halves for baking or snacking.
547,372301337691416,Annmaria Martensen,9/25/2024,198369.62,Set of soothing scented candles for relaxation and ambiance.
548,3534165116958786,Essy Burress,12/26/2024,833612.34,"Hearty beef chili, ready to heat and eat."
549,3556256816466049,Salaidh Cund,11/6/2024,802770.59,Colorful building blocks for creative play.
550,201455529241849,Mallissa Montel,11/4/2024,924765.38,Fresh kale with Caesar dressing and croutons.
551,5602239278850918056,Glynis Leyre,8/23/2024,477469.64,Special attachment for vacuum cleaners to remove pet hair easily.
552,30561062293811,Demetris Sherwill,10/28/2024,326849.25,A colorful printed maxi skirt for a bohemian look.
553,3559767867338843,Julianna Nuton,1/14/2025,77108.05,A rich pesto made with sun-dried tomatoes and pine nuts.
554,3549163660324029,Winnah Wagstaff,2/15/2025,978680.04,"Easy-to-prepare rice with cilantro and lime flavors, great as a side."
555,3574326306786384,Elmira Rosengarten,6/8/2024,916212.11,"Crispy sweet potato bites, delicious as a side or snack."
556,5602235171203547017,Hedvig Boldero,5/13/2024,82782.76,Rich cocoa powder for baking and chocolate recipes.
557,4911958193709553837,Costanza Everist,6/30/2024,251376.61,Stabilizing gimbal for smooth video recording.
558,3537881956733025,Cymbre Dove,8/2/2024,228162.64,"Crispy on the outside, tender on the inside, perfect for stir-fries or salads."
559,3533249981562492,Kahaleel Riping,4/19/2025,451458.75,Handy dispenser for quick access to safety pins.
560,3584081050542040,Harrietta Patey,4/19/2025,248324.23,Tender carrots glazed with a sweet maple sauce.
561,3562305605394052,Web Dhenin,9/27/2024,357667.51,Instant oatmeal cups with blueberries for an easy breakfast.
562,6379407875877752,Ax Rudall,11/10/2024,134723.72,Fun book filled with puzzles and games for kids.
563,3574306548795922,Paxton Acres,6/28/2024,224736.29,Easy-to-make pancake mix with pumpkin spice flavor.
564,63047242739518679,Ethelbert Jenicke,9/12/2024,339357.76,Sweet mixture of cinnamon and sugar for sprinkling.
565,30020631067933,Allx Strond,7/30/2024,207502.88,"Deliciously smoked salmon, great for bagels."
566,3574058089803629,Norine Hanratty,1/16/2025,29630.93,Regulate water temperature for safe and comfortable showers.
567,3551829186583422,Kikelia Ingyon,1/28/2025,187634.62,"Canned diced tomatoes, great base for sauces and soups."
568,3584487840004755,Trisha Percifull,6/8/2024,875771.74,Digital scale to avoid overweight baggage fees.
569,30481946415755,Christal Degenhardt,7/16/2024,856999.32,"Deliciously creamy spinach dip, perfect for parties."
570,5163010987806073,Alyse Guilaem,10/16/2024,322615.99,"All-in-one tool for measuring soil moisture, light, and pH."
571,3542627384223557,Niall Tirrell,5/20/2024,642632.52,Rich cocoa powder for baking and chocolate recipes.
572,4917129578214679,Lonnie Dorgon,5/1/2025,423810.15,Durable tarp for outdoor camping and protection.
573,3553613757763151,Vernor Barrowcliff,8/4/2024,516098.47,Wide pasta sheets for making lasagna.
574,491151368292450011,Levon Klempke,10/16/2024,828682.71,Instant-read thermometer for precise cooking temperatures.
575,3551341067803374,Carie McGinnis,8/26/2024,685858.22,"Frozen green peas, a great addition to meals."
576,5100137074864602,Carly Faithorn,12/4/2024,93214.57,Cute dispenser for bathrooms or kitchens featuring paw prints.
577,201575772879175,Jodie Stancliffe,6/6/2024,401005.88,Soft cotton pajama set for cozy nights in.
578,30593761092202,Paquito Wyman,3/22/2025,45739.75,"Deliciously creamy almond milk, perfect for smoothies."
579,4041379475437,Kinny Docket,5/1/2025,1056.6,Nostalgic clock that adds charm to any room.
580,3555511450607220,Ophelia Rodway,9/4/2024,167784.08,Sturdy mobile workbench with storage options.
581,4175005589385897,Cassandry Kildahl,7/18/2024,693827.44,A classic white button-up shirt for a polished appearance.
582,5108750975772914,Tanney Jessup,1/15/2025,918356.01,Energy-efficient window air conditioner for cooling.
583,5602218657827848402,Cherise Killwick,10/27/2024,991980.82,Passive noise reduction headphones for focus.
584,3570506563214279,Dewitt Schermick,9/3/2024,981772.94,Sturdy mobile workbench with storage options.
585,36934748405550,Audi Crutchfield,4/28/2025,512382.7,Set of resistance bands for versatile strength training workouts.
586,4911539563618161807,Adam Corhard,2/23/2025,174205.6,Timeless black trousers for a smart and sophisticated look.
587,3571371369933013,Gay Gledstane,12/28/2024,753094.32,"Creamy chickpea dip, perfect for veggies or pita."
588,5048370459804399,Brit Flucks,7/27/2024,905865.6,Crispy chickpeas roasted with honey for a sweet and satisfying snack.
589,560222037163532382,Fleming Bortoli,11/10/2024,834728.18,"Chickpeas served with olives, feta, and hummus, a healthy meal."
590,56022480988512604,Elliot McGlew,10/16/2024,788737.54,"Roasted pistachios, a healthy and tasty snack."
591,4041590821209189,Venita Chatburn,5/13/2024,455259.3,Multi-angle stand for easy viewing of devices.
592,201919716799687,Sabina Crush,1/6/2025,235518.79,Nutty-scented oil for stir-fry and marinades.
593,3551512678634560,Alyson Ebsworth,1/29/2025,100873.39,Eco-friendly bamboo cutting board for food prep.
594,4903440641026909,Barnard Hext,10/15/2024,560913.12,Compact coffee grinder for fresh ground coffee beans.
595,633474074289479073,Veda Windows,2/27/2025,481036.67,Nutty-scented oil for stir-fry and marinades.
596,372301786284960,Jacquenette Neeve,8/6/2024,280816.73,Multi-angle stand for easy viewing of devices.
597,3560186746845174,Merle Spawforth,12/8/2024,97466.91,Short-grain sushi rice for perfect rolls.
598,6333485282730122972,Mariejeanne Ander,4/1/2025,81538.23,Bluetooth scale that tracks body composition through an app.
599,3568035888617408,Joey Bowsher,7/19/2024,829571.92,Delicious cookies made with almond flour for a gluten-free treat.
600,5100133346386441,Phil Murty,1/31/2025,793012.56,"Low-carb pizza crust made from almond flour, gluten-free."
601,5602245278999610269,Kamilah Possell,7/28/2024,897104.42,Unsweetened frozen acai purée for smoothies and bowls.
602,201789838601586,Prisca De Benedetti,5/15/2024,988213.17,"Creamy mashed sweet potatoes, ready to heat and serve."
603,3531015307821512,Stormie Ropcke,9/25/2024,906155.63,Elegant glass decanter for aerating wine.
604,3547507168279717,Filmore Beenham,6/19/2024,671357.25,Essential kit for taking care of your pets' health emergencies.
605,4640024725336570,Gertrude Deplacido,7/3/2024,150035.93,STEM-based kit for kids featuring cool science experiments.
606,3565897211488689,Tannie Carrier,2/11/2025,131018.16,Comfortable eye mask that includes noise-canceling ear plugs.
607,3538260923224203,Kingsley Maier,8/13/2024,9680.9,"Seasoned and roasted to perfection, ready to eat."
608,675902671925862696,Minette Housiaux,6/19/2024,106001.9,"Crunchy granola bars made with almond butter, oats, and honey, perfect for on-the-go snacking."
609,5108752572846091,Isadore Naire,8/30/2024,989719.03,"Stylish leather ankle boots with a block heel, perfect for fall styling."
610,4175005966210023,Devland Puttrell,9/29/2024,270479.42,Essential tools for outdoor barbecues including tongs and spatula.
611,201733684545885,Dun Morat,7/11/2024,535557.45,Windshield sunshade for car interior protection.
612,5048372789694730,Peder Shawe,12/16/2024,390572.77,Multi-functional tool for emergency situations in the car.
613,30105518348900,Ariela Kunkler,8/30/2024,952138.97,Set of decorative pillow covers to enhance your home decor.
614,5602227400303335,Chet Kareman,5/20/2024,477867.65,Absorbent training pads for puppies and kittens.
615,3587617986904429,Duke Children,8/13/2024,343369.42,Comfortable over-ear headphones with deep bass.
616,3529956419667810,Caryl Edgerly,12/28/2024,608605.81,"Compact, waterproof blanket for picnics and events."
617,5108757097623214,Bekki Petroulis,2/11/2025,808705.48,Automated litter box that cleans itself after each use.
618,5002355596538863,Dewie Kingsman,5/17/2024,864744.9,Spicy cauliflower bites for a vegetarian snack.
619,346878642387551,Eleonore Denny,3/10/2025,207008.17,"Oven-roasted sliced turkey, perfect for sandwiches."
620,560225343710061223,Angelique Terram,11/26/2024,662131.15,Durable skipping rope with adjustable length for workouts.
621,3570022324905676,Sawyere Sleaford,10/28/2024,830860.31,"Fresh seedless red grapes, perfect for snacking."
622,675979264954040364,Evie Roantree,2/27/2025,903195.86,Low-carb vegetable for pasta alternatives.
623,5453144000033438,Gayleen Mountford,10/3/2024,282582.88,Creamy yogurt blended with fresh pineapple and coconut pieces.
624,36682632285709,Jennette Sponer,12/5/2024,590686.03,Freshly baked artisan bread with a crisp crust and soft center.
625,4508355290910816,Olympie Huckabe,11/18/2024,477038.09,Durable 50-foot garden hose with nozzle.
626,3567454362576819,Merrily Jorger,2/14/2025,341169.32,Complete set of cooking utensils made from bamboo.
627,5602248176025448281,Constanta Carlet,8/20/2024,999039.66,Handheld vacuum cleaner for quick and easy cleaning.
628,5100145220012711,Antoine Duplain,7/22/2024,93461.1,"Trendy leggings with a unique graphic print, versatile for workouts and casual wear."
629,3535920673772304,Barnabe De Paepe,11/6/2024,953392.78,Bright safety vest for outdoor visibility during any activity.
630,4017956316368,Vanya Fetherstan,2/10/2025,980271.99,Space-saving colander for rinsing fruits and vegetables.
631,341493893080403,Germana Heynen,2/4/2025,379605.5,Warmer for heating baby bottles and food jars.
632,5007662790315500,Kirsti Buckel,6/25/2024,490616.1,"Layers of pasta, veggies, and cheese baked to perfection."
633,633450828816147489,Mallory Jaray,4/18/2025,620239.43,Eco-friendly bamboo cutting board for food prep.
634,6384000282743585,Eula Screaton,3/15/2025,241413.99,"A delightful mix of nuts, fruit, and chocolate."
635,337941385772438,Marcelo Truman,12/17/2024,45263.05,Eco-friendly utensil set made from natural wood.
636,3568948082223254,Clementina Dumbar,8/13/2024,681908.11,Foldable chair equipped with a cooler pouch.
637,3559373895626752,Valma Simmill,11/16/2024,212160.66,"Homemade jam made with blueberries and chia seeds, no added sugar."
638,3533751675149171,Lucias Woolcocks,8/23/2024,837465.58,"Fresh and organic sweet potatoes, ideal for roasting."
639,201451348746118,Sheffie Pimlock,12/2/2024,377702.6,Quick and easy way to remove wrinkles from clothes.
640,6304896853960662665,Flem Fevier,5/3/2025,578943.2,"Refreshing tea with honey and lemon flavor, perfect for a warm drink."
641,3586792546483668,Phaidra Sallans,12/28/2024,494063.15,Device that tracks soil moisture and provides care tips.
642,36480988219046,Rodd Kingsworth,12/25/2024,704299.51,USB hub for expanding ports on computers and laptops.
643,3551030051649089,Aleda Currao,4/24/2025,755203.38,Portable folding table for outdoor events.
644,344063507569757,Arlena Bendson,11/19/2024,302788.54,"Fresh baby spinach leaves, great for salads and smoothies."
645,3528133950591418,Noellyn Myring,2/21/2025,374729.78,Frozen mango chunks for smoothies or snacking.
646,3578820953320626,Adelaide O'Heffernan,9/9/2024,606162.22,Track your meals and nutrition with this handy food journal.
647,3547320026183315,Garwood Lentsch,1/3/2025,523686.04,A bright and zesty dressing perfect for salads and tacos.
648,6304060715515913887,Jarvis Eisold,8/30/2024,657195.92,"A spicy glaze made with sriracha and honey, perfect for meats."
649,3550146892932186,Chev Fannon,6/17/2024,527372.07,A staple v-neck t-shirt that pairs well with anything.
650,4913968256425261,Reine Burkitt,1/17/2025,94945.97,Eco-friendly sealer for protecting concrete surfaces.
651,589322657386752109,Lucienne Gricks,7/11/2024,650672.42,Hearty lentil soup for a quick meal.
652,36987048843029,Adriana Carlaw,2/6/2025,642588.23,Durable speaker designed for outdoor use with water resistance.
653,3553969017333270,Stephana Di Gregorio,5/22/2024,831587.68,A quick and easy fried rice mix with colorful veggies and savory seasoning.
654,5002352372457160,Gaylene Adne,6/18/2024,430382.95,Compact hand mixer for easy baking.
655,3580913625001470,Wanids Vigars,5/31/2024,455452.48,A trendy cropped sweater perfect for a casual look.
656,630410587813355892,Deva Thecham,2/17/2025,826947.86,Quick and easy rice pilaf mix for side dishes.
657,5010127630430153,Crawford Le Pruvost,11/19/2024,830336.18,Rich and sweet paprika spice for seasoning.
658,5048376791801894,Hillier Hutchin,10/5/2024,643868.79,Moist and flavorful muffins packed with fall spices and pumpkin puree.
659,676177311155348142,Adelaide Persicke,5/17/2024,302308.65,Water-resistant activity tracker and smartwatch features.
660,3565395756614025,Nady Feehely,12/27/2024,694607.01,Fun gardening tools designed specifically for kids.
661,560222732538511091,Nils Ledger,4/30/2025,434398.13,Stream HD video wirelessly to your TV.
662,3569170643973314,Fredrick Felton,8/25/2024,544523.81,Soft and chewy bar packed with protein and cinnamon flavors.
663,5602258117490845749,Tabatha Gocke,12/22/2024,470737.99,Bluetooth thermometer that alerts you when your meat is done.
664,3580709941378893,Kaitlin Dowyer,4/7/2025,556181.98,Creamy mashed potatoes infused with roasted garlic flavor.
665,201543746175831,Rafe Garden,9/7/2024,657774.48,"Soft, cuddly toy that interacts with children."
666,3565100418720172,Ethel Ogborne,5/15/2024,371641.33,Stylish cap to complete your athletic look.
667,30512811892437,Evey Penton,8/12/2024,589788.12,Non-stick surface for easy cooking and cleaning.
668,4917478038106649,Rice Rumble,7/22/2024,929304.98,Fresh organic cucumber perfect for salads or snacking.
669,060400303726181074,Chance Mulbry,3/5/2025,966623.18,Battery-operated blender for smoothies on the go.
670,6763624853074990339,Patrica O'Kinedy,2/6/2025,811674.58,Lightweight and portable folding table for camping or picnics.
671,5342316270452093,Chariot Willisch,2/2/2025,600484.14,Comprehensive first aid kit for home or travel emergencies.
672,4913881893879677,Cazzie Blune,4/27/2025,231359.45,Creamy yogurt made with coconut milk
673,676728672950776884,Alfreda Linggood,11/25/2024,143441.98,Lightweight and portable swing hammock for relaxing outdoors.
674,6331109547922091627,Waldo Lowater,7/17/2024,773077.52,"Ready-to-eat beet salad with dressing, great side dish."
675,3554154726550964,Ade De Paepe,11/22/2024,200446.85,Convenient belt with pockets for easy access to tools while gardening.
676,3569412859213971,Maribeth Castle,3/2/2025,316043.42,Refreshing sorbet with a zesty lemon flavor.
677,675971396127512768,Morley Hatherleigh,8/12/2024,356817.98,Therapeutic weighted blanket for better sleep.
678,5602225268879917,Torin Pawlick,8/18/2024,519240.37,Adjustable laptop stand for better ergonomics.
679,633374931622077412,Bertrand Pavlov,12/19/2024,925975.75,Healthy granola made with oats and honey.
680,3560173217670620,Penrod Gilligan,4/14/2025,739969.69,"Chickpeas served with olives, feta, and hummus, a healthy meal."
681,5602243194783152,Felicle Fortun,3/8/2025,598874.94,Marinated chicken grilled with lemon and herbs.
682,6333758473971875,Vania Goulder,4/2/2025,437847.57,"Gluten-free pasta made from lentils, high in protein."
683,3536011734537446,Shelbi Lease,11/27/2024,884726.07,Light and crunchy rice cakes made from organic brown rice.
684,67714955069422807,Shandeigh Polendine,5/6/2025,87901.81,Eco-friendly power bank that charges via sunlight.
685,3579177144415255,Loree Sharpus,9/3/2024,510434.94,Non-contact thermometer for quick and easy temperature readings.
686,4017959651902,Tessi Slowgrove,12/3/2024,513284.77,Rich chocolate syrup for ice cream or beverages.
687,3579987693501002,Ferdie Casley,8/15/2024,6772.47,Stability ball for Pilates and yoga workouts.
688,3548607304550762,Fifi Pullan,10/5/2024,398170.61,Charcoal kettle grill perfect for backyard barbecues.
689,3544580949013807,Oberon Losel,10/5/2024,795143.83,Everything you need for a fresh and delicious Caesar salad.
690,3533172793815355,Kimmy Wallenger,7/13/2024,912130.94,Freshly roasted coffee beans with rich flavor.
691,5100140672226125,Honoria Goodlud,7/22/2024,957604.97,Portable projector with 1080p resolution for movies.
692,6762620917214737276,Wynn Eplett,9/17/2024,748871.76,STEM-based kit for kids featuring cool science experiments.
693,5533735339572402,Devondra Alsopp,3/4/2025,929263.11,"Crunchy tortilla chips with a hint of sea salt, great with dips."
694,4175005847391026,Jobye Whinney,2/7/2025,613031.21,"Fresh basil pesto, perfect for pasta or as a sandwich spread."
695,36006570779061,Clarabelle Geharke,5/4/2025,414453.69,Essential oil blends for a soothing atmosphere in your home.
696,4405542444517035,Tamara Happer,4/3/2025,559465.23,Water bottle designed to infuse flavors from fruits.
