id,nomor_rekening,nama_lengkap,tanggal_transaksi,jumlah_debit,keterangan
466,6706137289444883178,Patrice Epdell,2/25/2025,320723.48,"Cold-pressed coconut oil, perfect for cooking, baking, or skin care."
467,3534442671064551,Isaac Ellyatt,4/13/2025,224731.34,Fun light that creates a disco atmosphere for parties.
468,372301232541534,Marin Dunkersley,4/22/2025,955203.19,Non-stick surface for easy cooking and cleaning.
469,374622913708706,Tadeo Rosborough,3/13/2025,48404.71,Sharp tailored blazer perfect for office wear and professional events.
470,4917411188239217,Shayla Loudiane,5/30/2024,172335.67,Durable backpack with ample storage for outdoor adventures.
471,5602219461700715,Inglis Lydiatt,3/10/2025,141594.69,"Tangy green salsa made with tomatillos, perfect for tacos."
472,67099906279115769,Finley Dispencer,12/17/2024,485174.9,"Creamy hummus with a kick of spice, great for dipping."
473,201966145654397,Filip Yardy,5/13/2024,612430.67,Fun decorations for Halloween to set a spooky atmosphere.
474,372301797104843,Agosto Featherstonhalgh,1/21/2025,665654.89,Small fridge designed to keep skincare products cool and fresh.
475,30214718535702,Brigitte Wilber,10/9/2024,465983.04,Classic ranch dressing for salads and dipping.
476,3565353635302189,Waite Neilly,8/7/2024,613876.62,Non-stick utensils for safe and easy cooking.
477,4026079717474890,Hailee Domini,1/21/2025,67846.13,Deliciously rich brownies made with almond flour.
478,3561453988518433,Gabrielle Cortes,4/24/2025,981366.76,Delicious veggie burgers loaded with grilled vegetables.
479,3557935390665139,Vicki Dougal,10/7/2024,244825.63,Spicy and smoky sausage great for grilling.
480,3586638655142142,Urbanus Oxton,12/12/2024,542613.75,A quick and easy fried rice mix with colorful veggies and savory seasoning.
481,3543739048122270,Maryl Maides,12/18/2024,883048.08,Organize your board games with this storage bin.
482,3543363953767167,Jean Clapham,10/27/2024,180418.84,Lightweight tennis racket for beginners and advanced players.
483,5602253892421807,Dave Mangan,7/21/2024,144552.13,Ergonomic footrest for easier pedicure treatment.
484,560221545970921862,Parnell Jenoure,4/9/2025,465287.23,"Juicy peach slices in syrup, perfect for desserts."
485,491191083789815723,Novelia Robertson,8/2/2024,908105.23,Crunchy granola with almonds and coconut.
486,6399734647489004,Olivia Leggate,5/6/2025,127116.08,Everything you need to make your own candles.
487,30233749323425,Jennica Crass,8/1/2024,887367.01,Ideal for creating custom designs on t-shirts and fabrics.
488,5243997793830632,Eleanore Tejero,11/16/2024,143777.99,Natural honey sourced from wildflowers.
489,3550375092907736,Shena Barnes,11/10/2024,602854.1,"Cold-pressed coconut oil, perfect for cooking, baking, or skin care."
490,30416880375862,Ichabod Newhouse,1/9/2025,833103.35,Variety pack of craft supplies for kids' projects.
491,3584728386302107,Mace Tethacot,8/4/2024,614856.57,Compact USB fan for personal cooling.
492,3533044970972152,Rikki Kleinstub,1/16/2025,314888.33,Rich chocolate syrup for ice cream or beverages.
493,56022371621747915,Camellia Haspineall,10/7/2024,717311.76,Warm oatmeal flavored with apple and cinnamon.
494,50389025656823138,Freedman Gladbach,7/14/2024,283081.58,All ingredients included for delicious chicken fajitas.
495,3535181743405967,Sharai Cheston,5/10/2025,796419.91,Thermos that tracks your water intake and temperature.
496,4405237806601168,Cookie Grigori,11/21/2024,700351.73,All ingredients needed to make your own sushi
497,3588817971186060,Lou Blackman,12/6/2024,330101.76,Compact pocket tool with various built-in functions.
498,201423543109848,Putnem Ducket,11/15/2024,74362.77,Fun tabletop air hockey for home or office.
499,30207884868154,Giles McWhirter,1/9/2025,965116.96,Durable and insulated water bottle to keep beverages cold.
500,3547534032675102,Nye Duval,2/6/2025,561872.75,Rugged phone case for drop protection.
501,5100178732318201,Ansell Smales,10/16/2024,750116.3,Elevated planter box for growing herbs or small plants easily.
502,4041372068720867,Inga Bromehed,8/16/2024,26417.55,Fun decorations for Halloween to set a spooky atmosphere.
503,5038670527248897007,Lindsey Cowden,8/28/2024,625618.38,Custom keychain with engraved text.
504,4903642735458993,Zolly D'Emanuele,11/5/2024,35089.31,Connect your phone to the car's audio system via Bluetooth.
505,4041597952617270,Bud Dawbery,8/25/2024,611352.65,Spicy salsa with chipotle and lime for a zesty kick.
506,3562125876266999,Annabela Jermin,5/31/2024,710579.38,Marinated beef strips in teriyaki sauce for easy grilling.
507,561039756796843988,Shannen Keepe,11/21/2024,375141.01,"Sweet and chewy taffy flavored like caramel apples, great for fall."
508,3574674947171833,Clemmy Alleburton,10/28/2024,645621.65,Refreshing sparkling water with lemon and lime flavor
509,5100148733530583,Dosi Heinschke,5/3/2025,762532.43,Leak-proof cooler bag ideal for picnics and camping.
510,201565070204259,Curtice Boydell,3/10/2025,790072.15,Challenging 1000-piece jigsaw puzzle for all ages.
511,3547436310802616,Sydel Simper,4/17/2025,864973.23,Reusable gel ice pack for injuries and cooling.
512,4787251618161673,Bridie Garraway,2/10/2025,962117.97,Spicy chili sauce for an extra kick in your meals.
513,3585832864083947,Cammi Spira,3/14/2025,14556.07,Set of resistance bands for strength training at home.
514,3529854685472157,Drugi Hilland,7/9/2024,615121.12,Delicious mini donuts dusted with cinnamon sugar.
515,30521588047372,Wini Gwyer,9/20/2024,940231.75,Lightweight and portable swing hammock for relaxing outdoors.
516,3556146986077041,Ingar Bazell,7/22/2024,237079.03,Ergonomic wireless mouse with adjustable DPI.
517,3532650940337861,Camella Kinforth,5/5/2025,392663.73,Essential ingredient for baking and cooking.
518,201704786923593,Nil Semerad,12/5/2024,614944.05,"Durable, unbreakable wine glasses for outdoor use."
519,6396995301905303,Penelope Furst,8/30/2024,996767.28,Sweet mixture of cinnamon and sugar for sprinkling.
520,3575508265156225,Hailey Weadick,4/25/2025,797802.95,Track your meals and nutrition with this handy food journal.
521,675963051590448368,Melodie Benini,10/31/2024,553766.22,Hearty tomato soup made from organic ingredients.
522,50206422392351444,Howard Grosier,4/28/2025,230396.41,"Tender jackfruit cooked in BBQ sauce, a delicious plant-based alternative."
523,4508956468285871,Emylee Daveren,10/24/2024,996159.78,High-quality leather wallet with multiple compartments.
524,3570361332275718,Sadye Arnald,12/17/2024,590756.95,"Tender riblets coated in a honey barbecue glaze, perfect for grilling or baking."
525,201572768726445,Abbot Doogood,2/3/2025,908896.87,"A zesty salad with black beans, corn, and chipotle dressing."
526,5108759393819421,Tonye Pernell,6/11/2024,947150.45,Refreshing sorbet with a zesty lemon flavor.
527,6767087251857949,Justis Wontner,11/1/2024,73746.04,Snooze function and LED display for easy reading.
528,3560378388883049,Gerome Gallally,12/17/2024,247152.36,"A hearty salad with lentils, veggies, and curry dressing."
529,6759702163764153,Decca McKew,7/6/2024,934256.91,Golden crispy chicken tenders coated with honey mustard flavor.
530,3585424799867212,Aloysia Bloxsome,10/30/2024,556109.1,Fresh eggs from free-range chickens.
531,6767833209962336192,Trixi Gittins,8/1/2024,264032.08,Creamy yogurt blended with fresh pineapple and coconut pieces.
532,3589424890531523,Clevie Ivanyushkin,2/20/2025,515339.08,"Decadent brownies made without gluten, rich and chocolatey."
533,6771734177435458,Darryl Rheubottom,5/3/2025,714901.01,Compact pump ideal for inflating sports equipment or rafts.
534,4041591288345,Mellisent Riba,12/28/2024,151138.42,HD streaming device for accessing popular services.
535,3541082492407851,Westleigh Penley,2/12/2025,647383.96,"A comfortable crew neck sweater, great for all seasons."
536,3560969359157262,Von Regelous,7/27/2024,33913.29,"Tender and juicy pork chops, perfect on the grill."
537,6333910024917531,Gerty Pilbeam,7/5/2024,758688.04,Frozen mix for quick berry smoothies.
538,3574695599324941,Ashleigh Dagnall,10/5/2024,620426.2,Frozen mini meatballs that are great as a snack or in pasta dishes.
539,3583103599719540,Judas Macro,4/3/2025,3163.65,"Rich and creamy dressing with garlic flavor, perfect for salads."
540,5602249371294152,Isobel Henrique,2/5/2025,355277.73,Wireless trackpad for enhanced laptop navigation.
541,3536764800665026,Idalia Whitrod,6/17/2024,121751.38,Rich sauce for desserts and ice cream.
542,374739021176269,Seana Foxon,10/25/2024,270654.81,High-density foam roller for muscle recovery.
543,5007666998779623,Fidole Paolotto,9/17/2024,126396.25,All ingredients needed to make your own sushi
544,4041372552249746,Griffie O'Logan,5/27/2024,661879.27,Delicious cookies made with almond flour for a gluten-free treat.
545,3572701700277085,Gaspard Galliford,1/9/2025,380812.83,Creamy honey mustard sauce for dipping or dressing.
546,3571480713581178,Kinsley Livzey,11/1/2024,270562.35,"Crispy chicken bites, perfect for dipping."
547,4041377983370805,Finley Najera,8/18/2024,353146.97,Powerful hand blender for soups and smoothies.
548,3546259266740064,Cyndie Enderlein,8/10/2024,722457.78,Smart speaker with Alexa and music streaming features.
549,30395839711965,Cooper Bunting,2/28/2025,802998.53,Spicy sauce perfect for chicken wings and dipping.
550,3571232476329505,Tasia MacFarlane,9/23/2024,931354.85,Creamy Greek yogurt packed with protein and probiotics.
551,5010128719401594,Rae Hele,5/29/2024,691510.95,1080p HD video camera with night vision.
552,3556210123917905,Ema O'Doherty,10/1/2024,197886.82,Space-saving broom holder for organized cleaning supplies.
553,3530806637720387,Torrance Dollimore,6/13/2024,633569.18,"A spicy, flavorful cheese stick great for snacks or lunchboxes."
554,3541084157534086,Ivy Knellen,10/23/2024,387701.47,Stream HD video wirelessly to your TV.
555,3530201120206088,Klara Dmych,1/27/2025,493009.12,Control home appliances remotely using your smartphone app.
556,3564112133495585,Waldemar Noseworthy,4/3/2025,772276.0,"Tender jackfruit cooked in BBQ sauce, a delicious plant-based alternative."
557,56022373113622606,Durant Gadault,7/27/2024,253189.18,Notepad made from recycled paper for sustainable note-taking.
558,3557325961331990,Kelbee Charville,12/18/2024,202374.52,A cozy long cardigan designed for layering in any season.
559,50203798694510370,Annabela Duckett,9/4/2024,228940.11,Compact air purifier to improve indoor air quality.
560,5520979599698417,Cammy Lydiate,7/24/2024,620536.1,Hard-shell case for protecting sunglasses.
561,3551545366239219,Joshuah Albro,10/11/2024,382363.84,Fun and colorful gardening tools designed for children.
562,6761662129324011,Tobias Ponnsett,12/19/2024,25753.44,Set of decorative ceramic planters for indoor plants.
563,501894030680353649,Randi Nurden,3/6/2025,554753.1,Learning tablet with kid-friendly educational apps.
564,374288410279193,Madella Brideoke,4/15/2025,999226.34,Refreshing basil-infused lemonade for a cool drink.
565,6709626622007253,Kippy De Bernardi,3/3/2025,552887.22,Durable and non-stick ceramic cookware for healthy cooking.
566,36284832317554,Brynne Humbie,5/6/2025,695579.93,A flavorful sauce for stir-frying vegetables and meats.
567,56022332873870714,Abbey Seifenmacher,3/1/2025,757788.0,"Gluten-free pasta made from red lentils, packed with protein."
568,3579550177612990,Gaylord Flag,4/24/2025,232805.39,A classic white button-up shirt for a polished appearance.
569,3553381338089815,Barth Grace,11/17/2024,158061.63,Compact campfire for grilling and warmth during camping trips.
570,337941225155687,Noby Chatell,4/2/2025,774402.41,A sweet and spicy sauce ideal for spring rolls or chicken nuggets.
571,6331106863148419,Layton Revie,8/3/2024,625779.29,Delicious pasta shells filled with spinach and cheese
572,3542771056868032,Barbra Bresland,1/1/2025,871391.65,A light and breezy top ideal for warm days.
573,3552097019948589,Woodie Wernham,2/15/2025,613268.68,A high-quality protein powder perfect for smoothies and baking.
574,201640757817168,Missy Nazair,10/10/2024,838769.49,Set of five reusable fabric face masks.
575,3581937585943990,Tracie Shale,7/11/2024,469520.24,Organize coffee capsules with this stylish dispenser.
576,3576082625723321,Danika Spiers,1/31/2025,560310.31,Complete sculpting tools for artists.
577,4844790211697089,Cheryl Oakhill,8/2/2024,94329.68,"Mix for homemade cornbread, just add water and bake for a delicious side."
578,3533550052348509,Annemarie Mepham,9/24/2024,607071.94,1080p wireless security camera with night vision.
579,3559836788553812,Sonnnie Scala,10/25/2024,384405.32,Stylish wall art to enhance home decor.
580,3575807251350911,Shannon Skelly,1/30/2025,479808.25,Low-calorie rice cake for snacks.
581,374283079894044,Daphna Daniells,4/12/2025,808661.09,"Light and crispy rice cakes, a perfect low-calorie snack."
582,67614483792299641,Witty Ilewicz,10/11/2024,143940.87,"A blend of nuts, seeds, and spices for a healthy snack."
583,3581059912539951,Kissie Deboick,4/16/2025,176302.62,"Crispy chips made from taro root, a wonderful snack."
584,3577398563282032,Emlynn Inman,7/23/2024,122661.09,Elegant glass decanter for aerating wine.
585,3569049314846829,Valentino Starrs,3/31/2025,743082.61,Heavy-duty grill pan for indoor grilling.
586,3540212395184569,Elly Roome,2/28/2025,805279.87,Collapsible dish rack for kitchen countertop use.
587,3562756676462683,Mil Viste,10/21/2024,564132.33,Elegant glass decanter for aerating wine.
588,374622240719111,Kaela Werner,12/21/2024,599966.58,"A mix of nuts roasted with spicy seasonings, perfect for snacking."
589,30064316422625,Tierney Fealty,6/2/2024,320488.63,Assorted indoor plants for home decor.
590,4913613619201898,Simone Gagie,10/28/2024,459922.2,Leak-proof cooler bag ideal for picnics and camping.
591,374622479835000,Abbe Owens,3/9/2025,611150.42,Portable car vacuum cleaner with strong suction.
592,5541143447249320,Editha Kenewell,5/10/2025,643993.52,"Concentrated tomato paste, great for sauces."
593,6759087002963813313,Pattie Spratt,3/14/2025,380753.82,High-quality olive oil infused with fresh lemon zest.
594,5007667422114353,Monti Slesser,6/30/2024,813427.62,"A zesty marinade made with lemon juice and garlic, ideal for chicken or fish."
595,676784723271384410,Virgie Benoy,2/28/2025,321650.53,Beginner-friendly acoustic guitar with natural finish.
596,5417823163851372,Dory Hardwich,3/5/2025,284887.24,"Crispy baked radish chips, a healthy snack alternative."
597,3539509318950288,Joannes Pollins,6/9/2024,555971.72,Plant-based protein powder for post-workout recovery.
598,30151336386482,Rosetta Soans,1/23/2025,355868.64,Oven-roasted potatoes tossed in garlic and parmesan cheese seasoning.
599,6761654223983176668,Gerrard Corneck,6/6/2024,70540.94,Nutty and wholesome brown rice.
600,58931497002232445,Corina Basezzi,8/8/2024,701327.08,Healthy pizza crust made from cauliflower
601,5602244192625932,Zaccaria De Meis,3/31/2025,198629.77,Manual blender for smoothies and mixing ingredients on the go.
602,374288187178727,Allison Furney,7/14/2024,302708.69,"Floral and refreshing herbal tea, great hot or iced."
603,3555398140830788,Catarina Scothron,3/28/2025,344148.64,Complete outdoor kit for camping and hiking.
604,337941405079459,Jolyn Forte,5/4/2025,849155.35,Retro instant camera for capturing and printing photos instantly.
605,3537004348198563,Wilt Abotson,7/31/2024,466780.52,"Creamy hummus with a kick of spice, great for dipping."
606,3558886945918458,Megan Bullion,11/15/2024,302943.05,Hearty tomato soup made from organic ingredients.
607,374283625309414,Ker Faulo,6/16/2024,427924.42,"Spicy and flavorful soup made with black beans, perfect as a meal or starter."
608,347605404037101,Creighton Waldera,4/26/2025,902635.73,A pack of assorted nut and protein bars for a quick energy boost.
609,490351789641637489,Ardenia Gianilli,12/18/2024,195729.28,"Sweet and chewy taffy flavored like caramel apples, great for fall."
610,5602226008083703,Flo Shird,1/30/2025,613512.55,"Light and fluffy cream cheese, perfect for bagels or cooking."
611,4913279079807986,Brittany Bigland,5/7/2025,986339.29,Soft and breathable pillowcase for body pillows.
612,337941218071610,Daphne Leverton,10/15/2024,537620.12,"Deliciously smoked salmon, great for bagels."
613,5048371203994627,Jacquetta Mechic,12/5/2024,527094.78,Compact knife with safety lock for everyday use.
614,30185640792373,Lilla Molan,5/15/2024,4696.77,Portable desk that can be adjusted for sitting or standing.
615,3571126000585865,Dante Mileham,5/2/2025,533030.46,Handheld frother for creating frothed milk for coffee.
616,677193773563783335,Barde Proughten,4/19/2025,398307.36,Smart robotic vacuum for automatic cleaning.
617,5602239196228501,Roxanna Trusler,9/4/2024,286088.99,"A zesty salad with black beans, corn, and chipotle dressing."
618,3579397041958369,Giulia Curreen,12/7/2024,242662.78,Maintain freshness and dispense cereal easily.
619,3538710791325102,Noah Seabert,2/3/2025,512989.06,Savory potato chips with a hint of maple sweetness and crispy bacon flavor.
620,3569520652924469,Allene Ricket,4/15/2025,177605.36,Nutritious chia seeds great for smoothies
621,6333761969621451339,Tierney Darko,3/29/2025,396910.34,Tender ribs smothered in a honey barbecue sauce.
622,3540322496881912,Leigh Yoskowitz,7/12/2024,760441.65,Prepped vegetables and sauces for a quick Asian stir-fry meal.
623,675950769198621806,Tiffany Yanshin,9/25/2024,935137.07,Set of baking sheets for effortless baking.
624,5010125440047951,Kippar Cornick,9/8/2024,236626.3,Jump rope that counts your jumps for tracking workouts.
625,4405750112251288,Gunar Pearn,5/21/2024,551577.12,Fairy lights perfect for decorating patios and backyards.
626,676296489859873924,Cristobal Borne,7/28/2024,615817.83,"Lean and versatile ground turkey, perfect for various dishes."
627,5602246111679452,Booth Parradice,7/19/2024,921413.08,Essential tools for on-the-go bike maintenance.
628,3535680044928189,Garvey Barbour,2/9/2025,87962.14,Silicone oven mitts for safe handling of hot cookware.
629,201926723201441,Beverly Kupper,11/2/2024,999151.54,Savory quiche loaded with spinach and cheese.
630,4017959446569709,Ketti Tomadoni,9/20/2024,944622.06,Herbal tea blend with ginger and turmeric for a soothing drink.
631,3576110179954669,Marlo Baden,12/18/2024,107312.49,Portable desk that can be adjusted for sitting or standing.
632,3535642318203020,Gisella Hartfleet,5/17/2024,428175.39,"Fruits dipped in rich chocolate, perfect for desserts."
633,30265423073843,Joey Woolerton,8/23/2024,797663.4,"Instant oats with a savory twist, such as herbs and spices."
634,3582839449974667,Linet Fernao,4/7/2025,448495.17,A soothing herbal tea made from ginger root.
635,5377872895400246,Alick Mussolini,1/8/2025,759301.32,Complete outdoor kit for camping and hiking.
636,5002356151736512,Con Oxteby,12/9/2024,704126.05,Ergonomic mouse designed for gamers with high DPI.
637,3575421992481223,Frasier Fronek,3/22/2025,672844.17,Wi-Fi-enabled digital frame for displaying photos.
638,4041376467444003,Clementina Lidgett,10/9/2024,758483.57,Compact digital camera with 20MP resolution.
639,3560909571222981,Prentiss Hynson,5/2/2025,497228.93,"Savory, roasted nuts seasoned with garlic and parmesan."
640,3529142894075320,Antons Golde,9/7/2024,28925.53,Trendy belt bag for hands-free carrying.
641,3579747904704609,Kalindi Gudger,2/1/2025,204335.75,A blend of peach and mango for a tropical smoothie.
642,3539720144374896,Biddie Extill,12/28/2024,489099.53,"Reusable wraps for food storage, replacing plastic wraps."
643,4026352527318106,Kellia Coggan,1/14/2025,828271.32,"A mix of grilled vegetables, ready to heat for quick side dishes."
644,4911013514832726920,Salli Etuck,4/20/2025,705029.32,Plant-based mayonnaise for a creamy taste.
645,5602219573137921,Cheston Shearme,3/15/2025,87028.77,Easy meal kit for creamy fettuccine Alfredo.
646,3559878113564874,Gretal Jeanel,9/16/2024,277693.35,Creamy hummus made with sweet peas and tahini.
647,3581157544400871,Lonny Van Leeuwen,11/1/2024,577459.09,Chic wrap jumpsuit that flatters the body and is perfect for any occasion.
648,3582789207591817,Mikaela Antonacci,3/19/2025,289884.05,Set of ceramic knives for precision slicing.
649,675997052776158706,Ophelia Taylder,4/26/2025,74164.8,Multiple USB ports for charging devices simultaneously.
650,3572013136134561,Siusan Floch,12/23/2024,518235.49,"Delicious and hearty black beans, great for soups or salads."
651,3574411444815764,Edin Saffran,10/13/2024,291651.17,Warm oatmeal flavored with apple and cinnamon.
652,3578684813793418,Caroline Challenor,7/27/2024,16421.51,"Shredded potatoes, perfect for breakfasts."
653,4017953849169217,Derk Coping,10/8/2024,858772.62,A fragrant blend of Italian herbs for pasta sauces and marinades.
654,30571924214228,Niels McAneny,1/23/2025,135936.69,"Colorful veggie chips made from beets, carrots, and sweet potatoes."
655,3530303495226509,Kennan Thorburn,9/24/2024,839598.6,Wireless trackpad for enhanced laptop navigation.
656,3536528893221645,Jilleen Figura,7/2/2024,395009.77,Classic cereal made with whole grains and honey.
657,3535129713797632,Petronella Lutzmann,1/21/2025,112608.13,Soft throw blanket for cozy home decor.
658,30010466190074,Moe Adamo,2/4/2025,79793.0,"A blend of roasted red peppers and spices, perfect for dipping."
659,3568577415714927,Kata Crecy,6/29/2024,84508.24,"Raw brown sugar, perfect for baking or sweetening drinks."
660,5002350203219197,Adela Beston,4/21/2025,378548.9,Cozy cable knit cardigan to layer during chilly evenings.
661,5018265992475184,Mitzi Sibary,5/9/2025,838196.76,"Shredded potatoes, perfect for breakfasts."
662,3555659010559199,Alverta Petrovsky,2/17/2025,519854.32,High-quality olive oil infused with fresh lemon zest.
663,3576775383677288,Dagny Cardenas,1/13/2025,157436.31,Set of stylish watch bands to customize your look.
664,3541723565091938,Nina Starmore,7/6/2024,780559.99,Complete meal kit with everything needed to make beef stroganoff in under 30 minutes.
665,3586479724301538,Lynea Potes,6/10/2024,197478.9,Spicy cauliflower bites for a vegetarian snack.
666,30192458369062,Rod Leverage,1/11/2025,755221.27,Silicone tea infuser for brewing loose leaf tea.
667,3534221879724004,Kikelia Calverley,10/11/2024,216603.52,Practical organizer for keeping your home tidy and clutter-free.
668,3586341837143209,Madalyn Filshin,1/7/2025,763110.26,"A hearty salad with grains, dried fruits, and nuts."
669,4917742083657099,Nollie Schapiro,3/16/2025,259868.18,A spicy marinade perfect for chicken and fish.
670,5038666507528803,Noe Gotecliffe,1/2/2025,13984.71,"Savory pancakes made with chickpea flour, high in protein."
671,6771085296423531,Cynthie Rowles,4/8/2025,457857.12,"Creamy risotto made with mushrooms and herbs, perfect as a side dish or main course."
672,5010122708838478,Cchaddie Cleveland,7/14/2024,462573.65,Stylish bar stools with adjustable height and swivel features.
673,6304027336341766,Mireielle Kirkwood,1/25/2025,932264.23,Versatile organic coconut oil for cooking and baking.
674,3532793371386641,Vincenty Meynell,12/9/2024,209379.16,Durable and versatile backpack for outdoor and travel use.
675,3573149151368814,Noble Sprackling,4/28/2025,247495.1,Portable case to organize and protect jewelry on trips.
676,676246880142254925,Hamel Allchorne,1/8/2025,935264.42,Herbal tea bags made from dried hibiscus flowers.
677,3585643977153836,Rouvin Wateridge,2/28/2025,135991.57,Compact electric pot for hot pot dining at home.
678,491195496221275908,Abraham Twidale,7/13/2024,538454.66,Savory popcorn flavored with maple syrup and bacon bits.
679,6761209680988154,Tobie Spofforth,12/15/2024,604461.28,"Nutrient-rich broccoli, easy to add to any meal."
680,560221719807778288,Leisha Lardiner,4/7/2025,861765.56,"Extra virgin olive oil, ideal for cooking and salads."
681,201961487158404,Andriette Toland,11/11/2024,735936.81,"Lightweight, expandable hoses for easy handling."
682,3575634647313274,Elana Becke,2/7/2025,631247.45,Plant-based sausage links with spices and herbs.
683,201874041431110,Briant Geere,12/22/2024,651742.01,Lightweight and portable folding table for camping or picnics.
684,3569982400565988,Vanda MacCallister,7/23/2024,193248.75,Stylish black leather jacket featuring a zip-up front and multiple pockets.
685,3575525755106924,Marabel Milburn,7/28/2024,553458.41,A stunning lace dress perfect for special occasions.
686,564182226873486829,Natal Loughan,7/20/2024,519287.53,"Fresh artisan bread, perfect for sandwiches"
687,6331102876612384621,Nance Frango,6/12/2024,533902.6,Comfortable over-ear headphones with deep bass.
688,3528196884967996,Giacobo Fitzroy,4/6/2025,5439.95,Peel and stick wallpaper for easy home decor changes.
689,670604919807983458,Armstrong Moorerud,5/27/2024,833769.33,Crispy and delicious biscotti flavored with cranberry and almond.
690,4405669463269725,Terri Mingey,9/7/2024,744300.47,"Creamy vegan dressing made with cashews, perfect for salads."
691,5449873446837369,Ignacio Margeram,4/25/2025,145540.58,A refreshing sparkling beverage with a bold blood orange flavor.
692,0604103640789436,Blanca Gilfoyle,1/1/2025,460429.48,Chocolate-covered candy bars with coconut and almonds.
693,3543720496274631,Roma Saket,9/3/2024,369058.58,"Freshly baked bagels, perfect for breakfast or snacks."
694,3570956025372498,Gerald Caras,8/25/2024,194278.16,Compact electric scooter for commuting and short trips.
695,5251403964878533,Hilario Albery,3/3/2025,619366.89,Compact laundry bag for travel use.
696,3568364721490017,Vachel Fenimore,9/9/2024,181766.41,Fun tabletop air hockey for home or office.
697,58932274068818030,Otto Menendes,11/23/2024,989597.16,Complete grooming kit for dogs and cats.
698,3584437119105858,Wilfrid Amort,8/5/2024,350485.48,High-quality leather wallet with multiple compartments.
699,6759149917210242,Witty Judkin,8/30/2024,388931.51,"Frozen zucchini slices coated in parmesan cheese, perfect for baking or frying."
