id,nomor_rekening,nama_lengkap,tanggal_transaksi,jumlah_debit,keterangan
234,374288290988269,Bennie Adamoli,12/31/2024,656542.65,Soft foam blocks perfect for building and imaginative play.
235,5602226104130937,Ginelle Matthaus,2/16/2025,633961.62,"A blend of nuts, seeds, and dried fruits for snacking."
236,6334588397477399494,Alberta Keatley,11/16/2024,308113.36,"Synthetic crab meat sticks, great for salads and sushi."
237,4936667936705435451,Pat Choffin,5/29/2024,134160.2,"Rich tart filled with chocolate and raspberry, a gourmet dessert."
238,4041590788280157,Yankee Sebley,6/23/2024,2979.98,Marinated chicken grilled with lemon and herbs.
239,5602249892975073,Rafaela Edlestone,3/16/2025,342630.95,Classic leather photo album for keepsakes.
240,3557460731153216,Guillemette Pickavance,10/13/2024,143632.69,"Rich and creamy ice cream, available in various flavors."
241,345585334681750,Kerri Yacobsohn,4/4/2025,643255.14,Stay hydrated with refreshing flavored water.
242,560225645241891377,Forster Keoghan,12/10/2024,769675.31,Essential oil blends for a soothing atmosphere in your home.
243,3588893465892844,Ethelbert Dufton,11/3/2024,48391.3,"Freshly baked artisan bread, perfect for sandwiches or toasting."
244,56022515398677354,Pattie Matzl,6/23/2024,16983.72,Twisted pasta perfect for salads and pasta dishes.
245,378526076149614,Barnie Hourigan,2/1/2025,572518.4,Stylish and modern holder for storing wine bottles on walls.
246,4844240342396912,Sander Masdin,9/2/2024,757369.72,Hand-poured candles made of natural soy wax.
247,5007666454296146,Nowell Warner,7/28/2024,696128.71,Durable 50-foot garden hose with nozzle.
248,348064236800337,Celene Robberts,6/9/2024,187521.79,Gluten-free bread mix made with almond flour.
249,5007667778275279,Grissel Boorn,9/22/2024,809535.05,Reusable microfiber cloths for environmentally friendly cleaning.
250,3546485870491873,Conni Spinige,9/3/2024,743622.43,Electric rice cooker with multiple cooking settings for perfect rice.
251,3530301267718265,Arther Grcic,12/15/2024,92661.25,Stylish case with magnetic closure for smartphones.
252,3572659528692382,Rosie Bedingfield,4/2/2025,435739.43,Laundry bags perfect for delicates and organizing clothes.
253,3581380785781102,Ardath Gianolo,2/27/2025,754292.43,"Creamy yogurt made from coconut milk, dairy-free and delicious."
254,3570559310154298,Mordecai Farrey,8/18/2024,832621.46,Stylish markers for labeling your indoor garden plants.
255,3585100337045772,Tiebout Speare,5/25/2024,998174.19,Compact scooper for easy waste clean-up during walks.
256,3568815532025763,Isis Moores,12/8/2024,51129.78,Sweet and tangy raspberry lime beverage
257,3570016810335927,Brittney Worswick,4/4/2025,567215.59,Automatic watering devices for potted plants.
258,3573359385699880,Wilie Thornton,10/12/2024,239083.94,Tablet for digital drawing and illustration work.
259,5108758944562654,Joeann Bottelstone,7/26/2024,19575.36,Stylish tote to keep wine bottles chilled while traveling.
260,5433702008682699,Darya Akitt,5/26/2024,361105.51,Plant-based mix for a rich chocolate cake.
261,3585830609728651,Yoko Press,7/4/2024,700417.38,Foldable chair equipped with a cooler pouch.
262,201538414416061,Linea Loncaster,10/21/2024,378248.76,Compact waffle maker for perfect small waffles.
263,5525580740636218,Katharine Schule,8/14/2024,261158.7,"A delicious salad with quinoa, nuts, and cranberries."
264,5602246525458535,Drusy Fernan,2/9/2025,972708.15,A rich coconut curry sauce perfect for simmering vegetables or meats.
265,5100134708316323,Ellis Gut,9/10/2024,349060.38,"Customizable RGB LED light strip, perfect for mood lighting."
266,341479069610206,Damita Outram,6/19/2024,709930.47,"Fresh pomegranate juice, rich in antioxidants."
267,5506188253897160,Fionna McDonand,1/7/2025,738525.61,"Savory, roasted nuts seasoned with garlic and parmesan."
268,3572418521497111,Rhoda Hickford,5/5/2025,439544.6,"Soft and pillowy gnocchi made from cauliflower, perfect with sauce."
269,3589291590192892,Lincoln Carlo,10/2/2024,49792.83,Tool to check car engine codes and performance issues.
270,5010127764692578,Ladonna Horbath,4/27/2025,310614.97,"Fresh zucchini, versatile for grilling or sautéing."
271,3578491004849870,Simmonds Snaddin,9/5/2024,417216.58,Eco-friendly bamboo cutting boards in various sizes.
272,5602252045459474,Rees St. Quentin,6/1/2024,623961.64,Cozy throw blanket perfect for adding warmth to your home.
273,3580187593559211,Carmita Clerc,7/8/2024,399532.64,Soft and breathable pillowcase for body pillows.
274,5602252241244175,Madlin Beddows,12/10/2024,196577.29,Light and breezy dress perfect for summer outings with a vibrant floral pattern.
275,5602259284690123,Tabb Gyford,8/31/2024,476738.21,Automated litter box that cleans itself after each use.
276,3589271088857479,Jyoti Trenholme,5/28/2024,717132.93,Infuser for brewing loose-leaf herbal teas easily.
277,6387529321140657,Essy Lillecrap,11/16/2024,424583.06,Natural sweetener for baking and cooking.
278,5048375417671624,Adelbert Karpushkin,5/2/2025,742132.77,Ziti pasta baked with marinara and parmesan cheese
279,3551908880592275,Debera Ben,10/5/2024,52565.76,Compact wireless printer for home use.
280,5007662189629602,Werner Overton,3/31/2025,389905.73,Soft and cozy bathrobe perfect for relaxing at home.
281,560221756751451579,Charmine McIlvenna,4/19/2025,48004.11,"Stylish ripped boyfriend jeans for a relaxed, effortlessly cool vibe."
282,5602228514918265,Quillan Pauly,8/1/2024,844890.22,Rich chocolate protein powder for smoothies and baking.
283,346539634279251,Forest Seyfart,3/16/2025,755082.48,"Chopped and frozen spinach, ideal for cooking and smoothies."
284,3559799582024382,Cecily Christoforou,8/25/2024,509205.47,"Freshly baked bagels, perfect for breakfast or snacks."
285,4911192327376302,Umeko Downe,8/5/2024,356527.81,Portable coffee maker for rich brews on the go.
286,3543537251154406,Adam Leffek,8/9/2024,965920.28,"A fresh, flavorful basil pesto for pasta and more"
287,5007668275775423,Boy Krier,3/31/2025,115978.26,"A delicious salad with quinoa, nuts, and cranberries."
288,3568547013691199,Margaux Buttriss,11/18/2024,343813.71,Rotating spice rack with 20 spice jars.
289,30256039770419,Langsdon Tiltman,11/14/2024,876114.95,Durable baking sheet coated for easy food release.
290,3540242932855447,Dilly Bertolaccini,12/2/2024,916365.2,"Salmon fillets seasoned with lemon and dill, perfect for grilling."
291,5010120426785187,Tabor McKibbin,10/21/2024,725455.02,Colorful tapestry to add charm to any room.
292,5007660631883264,Tierney Balf,10/31/2024,5547.8,Hand-poured candles made of natural soy wax.
293,3568726735016030,Barbabra Sobtka,7/6/2024,99372.06,"Healthy salad made with chickpeas, vegetables, and a lemon dressing."
294,4041370636342,Catharine Ayre,10/19/2024,848942.35,Natural air purifiers to absorb odors and moisture.
295,5100146185389607,Merrill Fehners,7/9/2024,104704.8,Stainless steel measuring spoons set for cooking.
296,201939988940017,Vinnie McSparran,9/9/2024,201547.06,Eco-friendly bamboo holder for toothbrushes.
297,3563178287724816,Gill Crinion,7/13/2024,420174.74,"Crunchy cacao nibs, great for adding to smoothies or baking."
298,3559410050692730,Towney Sikora,3/3/2025,805028.96,"Sweet, chewy dried apricots, great for snacking or baking."
299,3553938308760251,Olympe Cogger,5/6/2025,97840.9,Crunchy seeds perfect for toppings and baking.
300,633330440846865100,Shoshanna Dinjes,12/11/2024,234653.19,Filters allergens and pollutants from the air for a healthier home.
301,3550464615903743,Mariya Stoeckle,2/10/2025,160245.63,"Thin and crispy flatbreads, perfect for dips."
302,3542347122013190,Cordie Byars,6/17/2024,281519.73,High-performance mechanical keyboard with customizable RGB.
303,5290246056913269,Jan Kilbane,6/12/2024,497888.56,Gentle brush for removing loose fur from pets.
304,3573246489315093,Vilma Trengove,6/8/2024,811102.58,Eco-friendly soy candles with a variety of scents.
305,3581664151742610,Batsheva Korneluk,6/22/2024,304994.66,Adjustable LED desk light with brightness settings.
306,5539543422918530,Meredith Muat,7/2/2024,545477.86,"Savory pancakes made with chickpea flour, high in protein."
307,4913753528813688,Matilde Gunthorp,5/5/2025,986230.01,Compact knife with safety lock for everyday use.
308,3562825244869644,Margot Bussy,8/19/2024,457871.92,Interactive kitchen set for imaginative play.
309,5209114079989783,Lennard Casaletto,6/28/2024,391522.61,"Dairy-free ice cream made with coconut milk, creamy and delicious."
310,3551993758485141,Fowler Shee,6/16/2024,838365.35,Secure digital wireless security camera system.
311,3569653473667676,Benyamin Pulman,5/22/2024,97133.23,Charming frame to showcase your favorite photos.
312,5010120716553196,Donelle Spohr,8/23/2024,979905.43,"Refreshing green tea infused with peach, perfect for a hot day."
313,4917767198470815,Rhody Gallon,2/25/2025,941191.39,Marinated grilled chicken breasts seasoned with garlic and herbs.
314,67094422971281250,Blinnie Quarry,1/24/2025,831432.16,Spicy and smoky sausage great for grilling.
315,4026465305721885,Alfonse Bristoe,4/28/2025,932449.43,Easy-to-make pancake mix with chocolate chips included.
316,3560678720731743,Devin Gallen,1/16/2025,226185.11,Classic marinara sauce for all pasta dishes.
317,3550283630771152,Alex Gerardet,10/9/2024,416105.73,Refreshing dessert bars made with pineapple and coconut.
318,5602246306222241,Sylvan Beveridge,12/20/2024,12304.46,A casual striped long sleeve shirt that's perfect for layering.
319,30054418890332,Jason Warrier,6/2/2024,775000.0,Complete outdoor kit for camping and hiking.
320,6331104400512543943,Alyss Liddy,11/10/2024,139157.98,"Concentrated tomato paste, great for sauces."
321,4405793167370306,Orelie Coleby,5/1/2025,176888.28,Wheeled cooler for transporting drinks and snacks.
322,3546277852276616,Doralia Yakuntzov,6/19/2024,309081.84,Stabilizer for smooth video recording with smartphones.
323,5602218137235288,Sindee Beagley,11/26/2024,867594.67,Boost your Wi-Fi signal for better coverage.
324,675957518756526474,Jewel Catcherside,10/26/2024,305383.44,Blender designed for smoothies and shakes on the go.
325,4405276734577801,Raynell Spinney,4/29/2025,448879.52,Stylish holder for organizing cooking utensils.
326,3543617921781141,Arleyne Tunna,9/2/2024,675065.26,"Freshly baked artisan bread, perfect for sandwiches or toasting."
327,4175009534136736,Reider Anfosso,3/24/2025,694369.75,High-quality leather wallet with multiple compartments.
328,3569027007555956,Ruddy Moralis,12/21/2024,894974.5,A crunchy collection of flavored kettle chips in a convenient pack.
329,3550914944682673,Morris Frodsam,4/23/2025,835790.88,Refreshing sorbet with a zesty lemon flavor.
330,30029908771986,Baldwin Plumptre,7/9/2024,289544.64,"Crispy and juicy chicken tenders, perfect for dipping."
331,3586256176300915,Brnaby Finlry,7/21/2024,609681.46,Chocolate coconut protein bars inspired by the classic candy bar.
332,3576267052665786,Hedvige Skelhorn,4/22/2025,70881.85,Rechargeable LED lantern ideal for camping and outdoor activities.
333,3529275765081223,Blair Pinnick,6/5/2024,702420.62,Sweet and tangy mango chutney for a flavorful dip.
334,201591811956940,Dag Gurry,5/22/2024,862268.66,"Fresh and tart organic green apples, great for snacking or baking."
335,5007664584004241,Cara Prestedge,8/25/2024,339452.23,A warm knitted scarf to keep you cozy in winter.
336,4017952583160267,Mikaela Worvell,10/25/2024,378290.51,Easy-to-make falafel mix for a tasty vegetarian meal.
337,5108756562024049,Jacquette Sealey,2/25/2025,433137.95,Stylish stand to hold your recipes while cooking.
338,560222405672929763,Cleopatra Broadwell,12/25/2024,635851.98,Quality scissors designed for easy pet grooming.
339,5511971576929221,Den Akister,10/7/2024,364765.27,Natural air purifiers to absorb odors and moisture.
340,3586695260584266,Nikkie Lipgens,3/16/2025,952756.25,Artichoke hearts marinated in herbs and oil.
341,3586358244270284,Dorthea Sheers,5/27/2024,884692.36,Oven-roasted potatoes tossed in garlic and parmesan cheese seasoning.
342,3554294440645276,Frants Formie,5/17/2024,875586.39,Finely ground almonds for baking or cooking
343,5602257319147945,Raul Smitten,4/27/2025,496407.35,Compact ice maker for creating ice at home or in offices.
344,5007663948350654,Rosetta Sheekey,11/3/2024,343116.82,Essential oil blends for a soothing atmosphere in your home.
345,5602212646369498,Sadye Kopmann,9/17/2024,723565.4,Canned beans cooked in a savory chili sauce
346,3539969923077648,Benedetto Catmull,7/6/2024,545125.14,Therapeutic weighted blanket for better sleep.
347,3567786116609564,Dorian Sparhawk,3/2/2025,835348.7,"Sweet relish made from cucumbers, perfect for sandwiches."
348,5602239136592224672,Mayne Butterfill,1/2/2025,856012.83,"Sweet and nutritious potatoes, great for roasting."
349,3585764841437773,Moyna O'Doghesty,4/18/2025,455572.02,Sweetened powder for refreshing lemonade.
350,4017955862743,Floria Wolfer,2/27/2025,589652.99,"Blend of cheddar and mozzarella cheese, great for recipes."
351,3574369475850631,Allis Jelks,7/22/2024,224826.42,Safe and fun trampoline for children.
352,6333582803332198,Dix Foxten,12/13/2024,471259.11,Set of elegant wine glasses for special occasions.
353,3573819919872865,Nancy Boas,3/9/2025,875264.38,"Creamy cottage cheese, perfect for healthy snacking."
354,4508016389851531,Petronia Tagg,7/30/2024,246278.81,Eco-friendly bags for storing food without plastic waste.
355,6762930043127278038,Nanice Tranter,1/15/2025,574248.81,A hearty mix of beans in a flavorful tomato broth.
356,3539245356454384,Meggi Allnutt,3/19/2025,90496.03,"Rich and creamy dip made with real avocado, great for chips."
357,6390268105102220,Alisander Beveredge,1/5/2025,642067.47,Wi-Fi enabled doorbell with HD camera and two-way audio.
358,3569147292359961,Rodi McKune,3/17/2025,80403.12,"Classic A-line skirt that flatters every figure, perfect for work or play."
359,3566920443663066,Lauraine Raikes,12/25/2024,65247.93,Colorful and child-friendly gardening tools for little hands.
360,5602259765839939935,Kriste Lathwood,2/8/2025,92254.13,A convenient meal kit for making a delicious beef taco skillet at home.
361,337941573858114,Guthrey Hindrick,11/9/2024,812326.08,Non-slip yoga mat for optimal grip and comfort.
362,3567672503833878,Saxon Wigin,11/16/2024,636492.73,UV sanitizer that kills germs on your smartphone.
363,3587358099236504,Willem Willeson,1/1/2025,341654.98,Fresh greens and veggies for a quick Asian-inspired salad.
364,3568980818662299,Carroll Brise,12/12/2024,804511.67,A rich curry paste for making authentic Thai green curry at home.
365,30090790528090,Darell Coughlin,8/28/2024,987448.53,Reusable tote bags for shopping and eco-friendly living.
366,3535034232631850,Lolly Stanwix,10/6/2024,699904.92,Reusable gel ice pack for injuries and cooling.
367,3529012037435758,Tripp Busfield,3/26/2025,448682.41,"Rich tart filled with chocolate and raspberry, a gourmet dessert."
368,670600530372848036,Wyn MacKill,11/11/2024,457103.78,Compact coffee grinder for fresh ground coffee beans.
369,5602212115707905,Hershel Pearcehouse,11/19/2024,432542.37,Compact blender that comes with travel cups for smoothies.
370,201572702914917,Cherri Tabourin,2/14/2025,992632.95,Trendy high-top canvas sneakers for a stylish streetwear look.
371,5602221109751126,Alix Trood,8/22/2024,172425.12,Fairy lights perfect for decorating patios and backyards.
372,5100173519283900,Agnesse Barkshire,8/31/2024,391526.72,Handheld sprayer designed for washing pets easily.
373,3541975146840478,Maybelle Montgomery,7/7/2024,202077.6,Lightweight and portable swing hammock for relaxing outdoors.
374,4913397082856871,Toiboid Martusewicz,2/3/2025,641059.95,Frozen smoothie pack with strawberries and bananas.
375,30432368190301,Adolf Berthelet,6/26/2024,927787.36,"Marinated shrimp in a garlic and lemon sauce, perfect for grilling."
376,3578401522075932,Zacharia Trevarthen,8/17/2024,961131.81,Seat belt attachment to keep dogs safe during car rides.
377,5100147311503681,Malinde Shone,5/26/2024,656037.27,"A comfortable henley shirt made of soft cotton, perfect for casual outings."
378,3556801621453284,Floria Nassau,11/13/2024,842167.08,Comfortable and stretchy legging pants perfect for workouts or daily wear.
379,6759377859219844,Violet Eastmead,6/16/2024,297211.37,Adjustable shower head for a luxurious shower experience.
380,5893367113872222,Kristi Denver,5/6/2025,99038.91,High-quality matcha powder for smoothies and baking.
381,5602226310460362139,Francine Dows,2/14/2025,886631.29,"Canned diced tomatoes, great base for sauces and soups."
382,372301870331644,Annadiana Speed,4/11/2025,584226.38,Microwaveable heating pad for muscle pain relief and relaxation.
383,30187163640369,Marlee Ayllett,5/26/2024,305591.79,"Sweet and spiced apple filling, perfect for pies."
384,3572090578275300,Kaila Gier,2/23/2025,51046.59,Rapid boil electric kettle with temperature control.
385,3565384499053949,Claire Costley,2/24/2025,474813.69,"Versatile air fryer that also roasts, bakes, and broils."
386,3548813292686317,Beatrisa Oswick,10/28/2024,191435.32,Set of flexible molds for baking cakes and pastries.
387,3570285042751462,Euphemia Francescuzzi,4/21/2025,255147.06,Quote wall art to inspire and motivate.
388,3580505901429472,Hester Tomaszewicz,2/4/2025,192605.23,Quality scissors designed for easy pet grooming.
389,3551204978487663,Benjie O' Scallan,4/18/2025,973601.9,DIY kit to make your own lip balms in various flavors.
390,3530898009291261,Karl Trassler,2/12/2025,855207.12,Qi-certified wireless charger for fast charging.
391,30523054726125,Broddy O'Hartnedy,4/11/2025,344552.88,Essential ingredient for baking and cooking.
392,5641820882047052548,Kare Foggarty,7/1/2024,707642.04,Wi-Fi-enabled digital frame for displaying photos.
393,3560405942415545,Maureene Ames,3/13/2025,104400.31,Easy-to-use tiebacks for curtains or drapes.
394,6759382313779698,Darrelle Scales,7/15/2024,813905.25,Colorful tapestry to add charm to any room.
395,4041598233522230,Berni Zebedee,3/8/2025,908120.84,A tangy sauce that combines lemon zest and basil for a refreshing flavor.
396,374283035886399,Mano Capin,7/26/2024,797057.31,Wide pasta sheets for making lasagna.
397,5602235741562666168,Rodrigo Deyes,12/8/2024,928119.39,Healthy granola made with oats and honey.
398,3547001339443378,Dori Titterell,9/4/2024,935505.28,"Light and crispy rice cakes, a perfect low-calorie snack."
399,4917017229532286,Tracie Baggett,2/13/2025,433971.28,"A zesty salsa made from ripe avocados, tomatoes, onions, and jalapeños, great for dipping or topping."
400,374288828850486,Betsy Lucey,11/26/2024,867810.62,"Soft flannel shirt with a timeless plaid pattern, perfect for layering."
401,5100149977286643,Piotr Hanshaw,1/21/2025,751250.8,Oats and honey bars with a chewy texture and nutty flavor.
402,4041374008100,Phil Sked,1/19/2025,970947.74,Seat belt attachment to keep dogs safe during car rides.
403,3558040475318727,Tiffanie Jahner,8/9/2024,791398.65,Set of decorative pillow covers to enhance your home decor.
404,3549629549120770,Wally Swadden,3/4/2025,35232.81,Durable backpack with ample storage for outdoor adventures.
405,3565813067045861,Loy Quakley,4/29/2025,603580.26,Tangy vinaigrette with orange and ginger flavors.
406,3569345518844895,Allard De Giorgi,6/15/2024,551897.15,"A smoky barbecue sauce, ideal for grilling and dipping."
407,3581280633644173,Joelle Houldcroft,5/22/2024,340429.79,Fresh organic cucumber perfect for salads or snacking.
408,3549633442096186,Obed Duddan,12/23/2024,362183.29,Stream music from your device to any speaker wirelessly.
409,3536623705731996,Wynne Kneeland,4/27/2025,801453.42,Electric rice cooker with multiple cooking settings for perfect rice.
410,3543811038751895,Winfield Oakley,6/17/2024,582424.86,Stylish ankle strap heels for a classy look at any event.
411,3572833882033257,Ches Freestone,9/13/2024,127622.67,"Pizza topped with barbecue chicken, cheese, and red onions."
412,5602239209306112,Mercy Wiltshire,8/20/2024,719926.32,Connect your phone to the car's audio system via Bluetooth.
413,4026990820835803,Izak Kniveton,2/12/2025,882418.81,Frozen smoothie blend with berries for a quick and healthy breakfast.
414,3540655002093716,Daron Randell,5/8/2025,226356.26,"Juicy peach slices in syrup, perfect for desserts."
415,6759928210795615,Jania Dukesbury,7/14/2024,942521.34,A fragrant blend of Italian herbs for pasta sauces and marinades.
416,676143792909096510,Delphinia Desesquelle,8/18/2024,775600.06,Ultrasonic essential oil diffuser with LED lights.
417,3576833451187530,Rolando Bonnier,11/16/2024,728383.37,A blend of peach and mango for a tropical smoothie.
418,30129992678681,Janel Grimbaldeston,4/3/2025,694152.41,Double-sided art easel for painting and drawing.
419,676150587178099330,Che Remer,1/16/2025,715643.77,Roasted Brussels sprouts drizzled with balsamic glaze.
420,5602217400509973,Obadias Logsdale,1/17/2025,318516.97,"Thin rice noodles, ideal for stir-fries and soups."
421,201568568925534,Ella Finnes,2/14/2025,9585.04,Wearable diffuser for scenting your space and body.
422,5177782926165993,Aylmar Clipsham,1/26/2025,917048.13,"Crispy sweet potato bites, delicious as a side or snack."
423,633345731357827346,April Danielski,2/12/2025,631199.19,Customizable window cover for light control and privacy.
424,4911522109527873683,Waylan Kirrage,5/22/2024,753078.68,"A complete meal kit containing breaded chicken breast, marinara sauce, and pasta, perfect for a quick dinner."
425,3570498866764251,Cosetta Manuely,11/9/2024,954553.58,A rich sauce perfect for pasta or drizzling over vegetables.
426,3563469527032429,Nickolaus Rowlstone,5/7/2025,628254.06,Breathable tank top perfect for workouts or casual wear.
427,6390640014504854,Ilyssa Habben,1/27/2025,849560.76,Quality scissors designed for easy pet grooming.
428,3540358178576982,Cynthia Milthorpe,6/4/2024,698159.62,Stabilizer for smooth video recording with smartphones.
429,30460791520307,Bernardine Trewartha,2/5/2025,437866.3,"Fresh salad with pears, gorgonzola cheese, and nuts, perfect for lunch."
430,5602250457870729107,Terza Peyto,11/19/2024,748524.11,Durable and versatile backpack for outdoor and travel use.
431,5503652008767294,Maryanna Comins,11/27/2024,879853.5,Bluetooth scale that tracks body composition through an app.
432,3536913095998234,Ariel Rizzi,3/6/2025,889861.08,Creamy vegetable curry enriched with spices.
433,3536220413910283,Esther Noseworthy,8/25/2024,441549.65,"Sweet and salty kettle corn, perfect for snacking."
434,3574018554062648,Skipp Bunnell,9/29/2024,915770.22,"A zesty salad with black beans, corn, and chipotle dressing."
435,3577648137076702,Ugo Southerell,10/19/2024,834622.91,Reusable mat that prevents food from sticking to the grill.
436,36542683686181,Alisander Shacklady,8/2/2024,127374.0,Handy belt for carrying garden tools while working.
437,3546150201206552,Demetris Armin,11/16/2024,684012.21,"Tangy green salsa made with tomatillos, perfect for tacos."
438,36730816755219,Morna Cuberley,4/10/2025,651863.31,A sweet and spicy sauce for dipping or cooking.
439,3576464234154306,Herold Stanley,7/22/2024,573713.37,Durable and soft frisbee designed for dogs to play with.
440,4136208249423,Berkeley Harwin,10/13/2024,566716.21,Comprehensive first aid kit for home and travel.
441,63049091635062557,Uriah Gosse,9/22/2024,722463.42,"Frozen chicken bites coated in a honey sriracha glaze, spicy and sweet."
442,670652702227655505,Sherlocke Bearne,12/31/2024,613645.95,Complete outdoor kit for camping and hiking.
443,30203508917212,Devinne Larcombe,8/3/2024,962935.85,Organize coffee capsules with this stylish dispenser.
444,5556912477579083,Lyndell Potten,1/31/2025,324055.51,Durable ceramic bakeware for casseroles and desserts.
445,3550478707598203,Lanny Gaddesby,4/5/2025,430721.56,Creamy tahini made from ground sesame seeds.
446,589329560652129452,Tybi McRonald,1/15/2025,402536.47,Interactive kitchen set for imaginative play.
447,676103714964503378,Toma Budibent,1/17/2025,772927.36,Versatile chair that easily folds up for carrying.
448,201410991327428,Lorna Carthy,1/5/2025,807469.21,Convenient charging pad for wireless charging in vehicles.
449,3582155402072740,Jen Ferraro,1/31/2025,49596.37,"Nutty and chewy black rice, high in antioxidants."
450,3536658817389390,Riley Maskell,2/16/2025,2003.91,Space-saving crates for easy organization at home or while traveling.
451,4017954158401688,Daphna McCurdy,12/24/2024,912042.44,Stylish and functional backpack for school or trips.
452,5641825424740565,Tracie Farrier,3/1/2025,813804.29,"Essential cotton tank top, perfect for layering."
453,3544445777407697,Dicky Hoffman,8/23/2024,150025.23,Silicone oven mitts for safe handling of hot cookware.
454,675949006211994017,Rhianna Rennebach,5/24/2024,803214.03,Nutty granola bars for healthy snacking.
455,201521123313977,Nataniel Glynne,6/18/2024,814633.42,True wireless earbuds with touch control.
456,3548106032842922,Janean Brocket,4/16/2025,853398.87,Powerful blender for smoothies and soups.
457,06043173488982654,Rycca Atyea,9/28/2024,65153.73,Vegetable spiralizer for healthy meals.
458,5602258371873014,Nissie Pittel,4/1/2025,233019.66,A warming blend of ginger and turmeric for lattes.
459,675968619551724095,Kellen Sherwood,12/8/2024,760879.21,Set of magnetic jars for convenient spice organization.
460,3584759196766728,Elaina Chalfain,9/26/2024,18172.54,Delicious apple sauce with a hint of cinnamon
461,30053037161943,Trevar Jeschner,2/10/2025,23057.77,Water bottle that tracks hydration levels and adds electrolytes.
462,36964437523397,Noble Simkovich,5/18/2024,866613.74,Essential tools for bike maintenance and repair.
463,5100176538824463,Antonius Renwick,7/14/2024,549635.94,Fun instruments to introduce kids to music.
464,3537699842192192,Kile Flaubert,8/24/2024,744451.85,Creamy risotto infused with wild mushrooms.
465,4175000574738754,Veradis Mapstone,8/4/2024,157951.18,"Rich dark chocolate bars, perfect for a sweet treat."
