id,nomor_rekening,nama_lengkap,tanggal_transaksi,jumlah_kredit,keterangan
694,201437058980302,Gordon Stemson,1/4/2025,391853.4,Eco-friendly bags for picking up after your pet.
695,3554413346453755,Dillie Iwanicki,3/2/2025,845201.15,"Nutritious blend of wild rice and quinoa, perfect as a side dish."
696,5153690168485300,Darin Hynd,2/7/2025,886014.12,Fresh sliced strawberries for toppings or snacking
697,675933611655220585,Tania Dreinan,8/28/2024,85001.37,Delicious veggie burger patties for grilling or frying.
698,3583012961675844,Krista Gianolini,9/8/2024,977461.02,Compact sterilizer for disinfecting small items.
699,3576462689962751,Domingo Crafter,10/23/2024,101067.87,DIY kit to make your own lip balms in various flavors.
700,56022393995647323,Ida Denson,3/3/2025,91832.88,"Creamy cheese with a spicy kick, perfect for sandwiches."
701,3558464040052860,Amabel Ducket,1/24/2025,14516.43,A hearty vegetable curry for a quick and satisfying meal.
702,5020237153890020709,Mersey Landsman,11/3/2024,57880.66,Countertop dishwasher for small kitchens.
703,5473476559284210,Germain Tresler,8/9/2024,266866.93,"Sweet peach halves packed in juice, great for desserts."
704,5602231261802583,Nicolle Somerset,5/10/2025,225566.86,"Refreshing dressing made with avocado and lime, perfect for salads."
705,3562842279896160,Gabrila Aleksic,7/3/2024,501411.92,Crispy breadsticks seasoned with herbs and garlic.
706,3551516085677773,Yulma Duckitt,2/6/2025,123358.22,"Fine semolina flour, perfect for pasta and desserts."
707,6759217590517173,Amelina Downie,4/2/2025,720522.47,Large wall planner for organizing schedules.
708,6763396281641031617,Blanch Vlahos,5/14/2024,737304.26,"A tangy marinade for meats and veggies, packed with garlic flavor."
709,3541203782633390,Claiborn Kilcullen,1/19/2025,361593.7,"A zesty marinade made with lemon juice and garlic, ideal for chicken or fish."
710,5602222349345505888,Judy Guerrero,8/10/2024,630250.34,Classic leather photo album for keepsakes.
711,3571430394071734,Mikey Lexa,12/6/2024,248159.13,A warm knitted scarf to keep you cozy in winter.
712,3542115777601837,Jessie Scripture,8/4/2024,35958.47,Smart tracker to locate keys or other items via app.
713,5610540817725199033,Petronilla Barsby,3/29/2025,871970.8,Natural fruit spread bursting with real strawberry flavor.
714,675932876441400434,Dosi Egentan,12/1/2024,4031.82,"A trendy fanny pack, perfect for hands-free outings."
715,3529756870966739,Shela MacMichael,2/21/2025,413227.28,Non-slip yoga mat for optimal grip and comfort.
716,337941863370127,Germain Sire,12/22/2024,324371.78,"Sweet peach halves packed in juice, great for desserts."
717,4017958636360556,Kittie Judge,8/19/2024,135690.08,Training tool for reinforcing commands and behavior in dogs.
718,3570377812291306,Palm Snawden,12/18/2024,598400.2,Charge multiple devices with this sleek charging station.
719,30519755981449,Abraham Siemianowicz,6/25/2024,114259.2,Adjustable stand for smartphones and tablets.
720,3533293237548863,Corbet Delacourt,5/13/2024,648373.7,Stylish black leather jacket featuring a zip-up front and multiple pockets.
721,201545710666349,Shurwood Seckington,11/1/2024,931729.16,Refreshing juice blend made with various fresh fruits.
722,374283898987698,Virgie Hulle,8/1/2024,581966.67,Chewy granola bars with maple and cinnamon flavor.
723,3535662476038992,Olivia Tumioto,8/16/2024,21178.84,Durable and soft frisbee designed for dogs to play with.
724,490553810390500599,Adler Dionisetti,2/20/2025,477544.56,Non-stick baking mat for easy cooking and cleanup.
725,4041598545010,Faina Poltun,6/7/2024,520345.52,Compact air conditioner for personal cooling.
726,3582564603223301,Augustina MacEveley,9/5/2024,598782.91,Complete meal kit with everything needed to make beef stroganoff in under 30 minutes.
727,3581634845838777,Mervin Levis,9/26/2024,773436.77,Qi-certified wireless charger for fast charging.
728,3528155202446950,Clemence Addinall,11/12/2024,937786.29,Crispy chickpeas roasted with honey for a sweet and satisfying snack.
729,3532995262264403,Tedra Stormouth,11/24/2024,587808.56,Safe and fun trampoline for children.
730,3560860253463148,Emelen Scay,9/5/2024,424687.06,"Chewy cookies made with coconut, perfect for sweet cravings."
731,6334326086728881,Rene Volage,4/13/2025,185758.8,Indoor putting green for practicing your putting skills.
732,3578386254668683,Daryl Bossons,5/18/2024,849959.47,"Fresh, creamy avocados ideal for salads and guacamole."
733,3551313318544305,Wye Mongeot,9/23/2024,994588.63,Monthly subscription for freshly roasted coffee delivered to your door.
734,4405768782936400,Caitlin Darrigrand,5/3/2025,94633.29,Refreshing cranberry juice with no added sugar.
735,3570104073376349,Paulie Gligorijevic,10/27/2024,463111.63,"A fresh, flavorful basil pesto for pasta and more"
736,3567010611292259,Thedric Rossi,12/8/2024,737457.77,"Creamy yogurt made with coconut and cashews, dairy-free."
737,201537532463013,Sherrie Girvan,6/14/2024,302673.17,A rich coconut curry sauce perfect for simmering vegetables or meats.
738,3580163319611271,Merna Bickerton,12/2/2024,745479.87,Stainless steel travel mug that keeps drinks hot or cold.
739,3586352072516900,Koren Huxley,4/7/2025,945997.71,Complete watercolor set with paints and brushes.
740,4911475609371632,Ada Alennikov,8/15/2024,901287.0,Compact and portable projector for watching videos anywhere.
741,6706126660619936368,Chucho Kyteley,1/5/2025,729313.34,"Hearty beef stew with vegetables, ready to heat and serve."
742,3582363749598001,Marcille Pressdee,1/9/2025,281681.88,Organize coffee capsules with this stylish dispenser.
743,3530234533679385,Townsend Worge,4/30/2025,545756.0,Spice blend for creating flavorful vegan taco filling.
744,3528718913710319,Grannie O'Carrol,2/2/2025,233713.23,"Refreshing dressing made with avocado and lime, perfect for salads."
745,3562025329442595,Kaspar Kaveney,7/27/2024,723106.55,Eco-friendly phone case designed to decompose safely.
746,3572214103538012,Lowe Corbally,3/25/2025,486769.61,Rechargeable screwdriver with multiple bits for DIY projects.
747,3537129816406444,Elysia Doumenc,2/26/2025,2453.17,Eco-friendly cutting board that is safe for dishwashers.
748,490314521898148035,Amelia Wilcock,5/1/2025,95062.0,"Creamy yogurt made from almond milk, vegan-friendly."
749,3578266040246483,Tallie Priestman,8/4/2024,61460.78,64GB SD memory card for cameras and devices.
750,4936826665792924,Antoni Darree,3/6/2025,316288.42,Spicy cornbread infused with jalapeños for a kick of flavor at your next meal.
751,3556440934572322,Ancell Pulver,4/11/2025,758753.95,Laundry bags perfect for delicates and organizing clothes.
752,3587729778468446,Karie Goodsell,3/19/2025,645694.41,Non-slip yoga mat for optimal grip and comfort.
753,5038735265897989,Karna Layburn,4/24/2025,237983.81,Set of decorative pillow covers to enhance your home decor.
754,3583778108485095,Eldin Coleby,12/23/2024,455347.36,Multi-angle stand for easy viewing of devices.
755,5335277148079261,Darrell Adamides,12/10/2024,297545.63,"Flavorful lentil soup, perfect for a quick meal."
756,3559355898634008,Bogart Henric,12/22/2024,162332.95,"Tangy goat cheese infused with herbs, perfect for snacking."
757,3575213648760161,Nina Grinvalds,7/12/2024,252288.54,A sweet and spicy sauce ideal for spring rolls or chicken nuggets.
758,201944738592415,Locke MacGorman,12/8/2024,172068.12,Bold combat boots that make a statement with any outfit.
759,6370527452437578,Dominique Vermer,5/10/2025,333552.68,"Creamy cheddar cheese slices, perfect for sandwiches and snacks."
760,5530356282201874,Kirby Odlin,1/15/2025,805728.18,Energy-efficient LED bulbs that can be controlled via smartphone.
761,3561104237386276,Ced Bedell,5/28/2024,133340.11,Training tool for reinforcing commands and behavior in dogs.
762,3589343955484081,Gussy Creeboe,6/13/2024,298442.11,Convenient feeder that adjusts to your pet's height.
763,3571585429230033,Constantina Broszkiewicz,6/29/2024,474381.07,"Whole wheat wraps filled with spinach, feta, and herbs."
764,4508095514167716,Suellen Brant,6/5/2024,122967.46,Spicy ginger cookies that are crunchy and delicious.
765,5048377290496715,Sibeal Brodway,7/2/2024,56799.25,Durable and non-stick ceramic cookware for healthy cooking.
766,3539306504395869,Basile Potebury,2/28/2025,785974.19,Tangy and crunchy dill pickles.
767,3575248026698674,Gaylor Beartup,7/14/2024,752759.64,Savory soup made with leeks and potatoes.
768,4041375119419,Ive Mixworthy,9/4/2024,582921.54,Spicy seasoning mix for all your favorite dishes.
769,4175006089208332,Claudine Ackland,8/24/2024,754869.49,Foldable chair equipped with a cooler pouch.
770,5100144796343980,Rickie Arrundale,6/5/2024,448594.9,"Rich coconut milk, great for cooking and baking."
771,5602235838768714,Matti Longfield,7/21/2024,519880.53,Delicious pasta shells filled with spinach and cheese
772,4508527786817107,Geoff Moro,11/28/2024,283668.79,Plant-based mix for a rich chocolate cake.
773,4917403812674851,Eziechiele Culpin,3/8/2025,427846.93,"Savory sausage with a blend of spices, perfect for pasta dishes."
774,3588641129266685,Mabel Cheston,7/10/2024,847440.88,Lightweight yoga mat for practicing on the go.
775,3567784053117626,Anneliese Mayte,10/23/2024,172272.38,Smooth and creamy smoothie made with peanut butter and banana.
776,3562536654788998,Gillian McClements,5/6/2025,94075.9,Ready-to-bake cinnamon roll dough for easy breakfasts.
777,3555949622239847,Murdoch Sinnocke,7/24/2024,390656.75,Nutty and wholesome brown rice.
778,3588944211224178,Pattie Longworth,6/19/2024,758731.27,Instant hot water dispenser for tea and cooking.
779,3546852882673188,Katrine Triplow,10/10/2024,944691.9,"Pitted black olives, perfect for salads and pizzas."
780,5602247033358217,Cris Dreng,4/13/2025,986470.79,Crispy cauliflower bites tossed in spicy buffalo sauce.
781,3535186663659691,Briny Fincke,6/26/2024,730049.8,Portable chess set with magnetic pieces for travel.
782,3534065529528772,Marcellus Clemmett,5/18/2024,947994.46,Frozen mix for quick berry smoothies.
783,5610209042987337,Abramo Bryde,6/11/2024,854984.54,Planters with a self-watering feature for easy care.
784,3548332106714389,Hoyt Wasson,4/12/2025,663104.92,Affordable fitness tracker with heart rate monitor.
785,3573413235196579,Edward Von Der Empten,12/5/2024,88040.9,Modern desk lamp that features a built-in USB charging port.
786,3588101492615752,Melloney Alexis,11/3/2024,734332.32,"Freshly sliced cucumbers, great for salads or snacking."
787,5610618625678784,Monah Browncey,8/17/2024,364384.55,Adjustable dog collar with personalized tags.
788,30027954339294,Clementia Halesworth,4/27/2025,260991.0,A mix of frozen berries for smoothies or desserts
789,3573223246755044,Barth Garron,1/30/2025,433129.1,"Artisan bread topped with olives, feta, and herbs, perfect for sharing."
790,060438450255084512,Colette Baldini,9/30/2024,53631.22,Crispy and sweet dried apple slices
791,3588090361297299,Jaynell Houlden,8/12/2024,662516.5,Delicious cookies flavored with pumpkin and spices.
792,4041592119489598,Mead Chillingsworth,9/5/2024,882777.69,Lightweight hammock with a sturdy stand for relaxation anywhere.
793,5490955012323458,Kellen Herculeson,2/15/2025,39200.37,Rechargeable massage gun for relieving muscle soreness.
794,561055535924874696,Deonne Stivers,1/19/2025,293707.69,"A blend of nuts, seeds, and spices for a healthy snack."
795,5100140349930182,Dion Birrane,1/21/2025,41715.13,"Fresh and tart organic green apples, great for snacking or baking."
796,3551897096394057,Alaster Goudard,10/5/2024,312213.47,Non-contact thermometer for checking temperatures instantly.
797,3557329451258473,Dulcia Milne,8/4/2024,457109.07,Comfortable and breathable backpack for carrying small pets.
798,3555639606216941,Peyter Gartrell,8/8/2024,357331.85,Stylish wall art to enhance home decor.
799,30237935818502,Tessa Ballsdon,10/21/2024,653925.39,"Crispy sweet potato bites, delicious as a side or snack."
800,3542133616808950,Suzann Deaton,6/28/2024,35278.37,Space-saving solution to store shoes and keep them organized.
801,3540357290547046,Tonya Pender,7/17/2024,496452.99,Set of decorative ceramic planters for indoor plants.
802,3582449038625587,Amery Hallwell,6/16/2024,370610.99,Ergonomic memory foam pillow for better sleep.
803,3571206928162607,Claudie MacIan,8/15/2024,449848.9,Stackable measuring cups made from stainless steel.
804,67631080376798615,Dita Wingatt,4/28/2025,882231.54,Compact waffle maker for perfect small waffles.
805,3564256968695023,Bartholomeus Rubinsaft,6/18/2024,362892.87,Marinated chicken thighs with smoked paprika for a smoky flavor.
806,4041595924381413,Rosamund Casellas,11/20/2024,59187.02,Just add water for a quick pasta sauce.
807,3580231077216193,Jacenta Corgenvin,8/1/2024,507728.92,"A mix of grilled vegetables, ready to heat for quick side dishes."
808,4026995511418967,Loydie Ducker,11/15/2024,400689.42,"Refreshing green tea infused with peach, perfect for a hot day."
809,376919683451212,Ronnica Laughnan,5/14/2024,544030.85,Fun and colorful gardening tools designed for children.
810,3541385949984418,Bertie Bache,6/12/2024,299495.28,Abstract canvas print to enhance home decor.
811,3569408120109428,Archibald Haliday,6/3/2024,615161.21,"Sweet and chewy taffy flavored like caramel apples, great for fall."
812,6389674426861746,Sallie Pearmine,10/4/2024,34340.18,Thick and durable mat for workouts and yoga.
813,6380222923983941,Creigh Reddish,2/23/2025,131993.07,Make delicious waffles with this user-friendly device.
814,630460859580416424,Mildrid Paggitt,12/14/2024,676732.01,Delicious recipes focusing on plant-based ingredients.
815,3550430254979047,Coralyn Adriani,6/23/2024,152663.53,Ear protection for shooting and industrial use.
816,3553473411124633,Valery Everton,6/9/2024,788275.09,Nutty and wholesome brown rice.
817,4041591969357,Maegan Graber,12/31/2024,47884.52,Adjustable shelving unit for home or garage storage.
818,30488979752848,Raddy Gabbatiss,8/6/2024,814924.34,Nutritious chia seeds great for smoothies
819,372301285577872,Weider Schuster,9/18/2024,710088.67,Set of baking sheets for effortless baking.
820,4903158346231489,Jeffie Moan,3/11/2025,402054.79,Delicious clusters of peanuts and chocolate for a sweet treat.
821,3566961749208461,Angelica Allworthy,10/24/2024,728936.17,Nutritious chia seeds great for smoothies
822,633110872653000700,Darell Lillico,1/10/2025,483476.07,Whole wheat wraps filled with spinach and feta cheese.
823,3543413077485475,Garrick Rushman,3/23/2025,686130.12,Oversized gaming mousepad with smooth surface.
824,3545932371079963,Marian Lumber,11/30/2024,850390.16,Lightweight and slim monitor ideal for dual-screen setups.
825,3589689985668683,Etta Tanser,3/27/2025,246447.22,Complete set of gardening tools for all your needs.
826,3578394371190748,Odilia Merring,11/15/2024,696307.87,"Freshly baked bagels, perfect for breakfast or snacks."
827,3586084924049745,Karel Duckfield,12/26/2024,887774.5,Complete set of gardening tools for all your needs.
828,5602231553865520,Lulita Blood,4/9/2025,89621.2,A perfect blend of pineapple and teriyaki for stir-fry.
829,6304803021429896,Samara Benian,6/16/2024,656267.91,A light and breezy top ideal for warm days.
830,6371330217030377,Glyn Curneen,3/18/2025,203287.9,Marinated chicken skewers infused with traditional tandoori spices.
831,5582495706177596,Anny Imbrey,2/23/2025,271286.61,Assorted cloths for cleaning electronics and delicate surfaces.
832,3580898908325250,Pip Trevain,5/3/2025,839366.16,Complete set of cooking utensils made from bamboo.
833,6387942043614109,Eran Paolillo,5/22/2024,565527.46,Energy-efficient infrared heater for home use.
834,5602226160359727,Sawyere Champain,2/9/2025,315147.51,Multi-function rice cooker for all types of rice recipes.
835,4041371958916585,Clive Rickcord,9/17/2024,929123.83,Compact hand mixer for easy baking.
836,3587632437247500,Kikelia Ronan,7/16/2024,431250.01,"Crisp and sweet Honeycrisp apples, freshly picked."
837,6709476156022392240,Tiertza Brombell,10/20/2024,226233.41,Space-saving shoe organizer for tight spaces.
838,374622210581731,Audie Linklater,5/8/2025,549731.48,"Plain white rice, a staple for any meal."
839,3565555460780913,Claudia Rearie,8/29/2024,789397.16,Low-carb vegetable for pasta alternatives.
840,201772145176856,Orazio Gerok,7/21/2024,979174.81,Sweet and tangy balsamic reduction for drizzling.
841,67092517197787170,Aloisia Puckinghorne,9/25/2024,202964.6,Soft and strong toilet paper for everyday use.
842,5602221915457793,Korella Iorio,9/7/2024,205910.83,Rechargeable screwdriver with multiple bits for DIY projects.
843,4508805156376171,Cornie Gosart,10/30/2024,52716.8,"A blend of roasted red peppers and spices, perfect for dipping."
844,4041373965854,Cordi Ferry,1/24/2025,169029.82,Control appliances remotely using your smartphone.
845,3552323425629179,Chick Zellick,2/22/2025,684564.21,"Crunchy chips made from blue corn, perfect for dipping."
846,4017951175165,Danice Duckers,8/2/2024,441484.81,Waterproof picnic blanket for outdoor fun.
847,67592413031539404,Lesley Chillistone,7/10/2024,946371.38,Durable training soccer ball for practice.
848,5326397624913964,Allix Manes,9/10/2024,715429.45,Space-saving collapsible bottle for outdoor activities.
849,36867706117249,Staford Willingale,11/25/2024,51949.18,"Trendy high-low tee with a relaxed fit, ideal for weekends."
850,50208339722086433,Teresita Robichon,6/15/2024,100804.07,Comfortable mouse pad designed to reduce wrist strain.
851,30211513428885,Isahella Golbourn,5/27/2024,135468.75,Compact campfire for grilling and warmth during camping trips.
852,6397799124215000,Tirrell Tuxsell,11/8/2024,874876.29,Ready-to-bake cinnamon roll dough for easy breakfasts.
853,5100134483073248,Florie Wattam,5/21/2024,768463.51,Durable and soft frisbee designed for dogs to play with.
854,3551453766085045,Harper De Roos,3/18/2025,61158.04,"A trendy fanny pack, perfect for hands-free outings."
855,3583351534380940,Violante Hollington,6/13/2024,50860.4,Stylish and spacious case for makeup and beauty products.
856,3588112262529297,Felike Hungerford,4/22/2025,651291.11,"Raw brown sugar, perfect for baking or sweetening drinks."
857,3550592702196142,Mylo Rounce,6/7/2024,902820.9,Rich almond butter encased in dark chocolate.
858,341763503072788,Alyda Maffia,3/25/2025,751904.17,Comfortable pet carrier for travel and vet visits.
859,201918360978746,Ansley Merkle,7/28/2024,563657.87,"A trendy fanny pack, perfect for hands-free outings."
860,201877268941851,Melli Kneebone,9/26/2024,709002.46,Nutty granola bars for healthy snacking.
861,3551476257089119,Eleanor Frankish,8/21/2024,163381.69,Flexible tray for easy-release ice cubes.
862,3573377421810493,Ronnica Wrigley,8/25/2024,395750.98,GPS collar that monitors your pet's location and activity level.
863,3531855687598275,Lyssa Bird,4/15/2025,95227.12,Multi-functional gloves for planting and digging without tools.
864,201529683098094,Moise Rubberts,7/10/2024,766033.87,Crispy roasted chickpeas seasoned to perfection
865,5048373359334822,Lucien Mussolini,11/7/2024,530756.13,"Crunchy peanuts coated in honey, perfect for snacking."
866,5002359579175255,Sadye Knevett,9/14/2024,569679.66,Hands-free waist pack for carrying essentials while walking your dog.
867,5893453103238576828,Seth Cobbing,9/6/2024,816809.88,Organized tackle box for fishing gear.
868,3560476310607856,Seward Batstone,4/8/2025,843248.22,"Heavy-duty rope suitable for boating, camping, and general use."
869,337941777314591,Andy Keach,2/21/2025,701367.86,"Trendy leggings with a unique graphic print, versatile for workouts and casual wear."
870,4905387213821159546,Berta Pawley,7/13/2024,343212.54,Quick and easy way to remove wrinkles from clothes.
871,5343352040436040,Binni Ruckledge,12/25/2024,401578.78,"Instant miso soup mix, just add hot water for a warm meal."
872,3560766868425010,Izabel Jochen,3/23/2025,240144.36,A seasoning blend of garlic and herbs to enhance any dish.
873,4041379841695,Amii Apfelmann,4/15/2025,259748.65,Traditional basil pesto made with extra virgin olive oil.
874,4903597454688156,Phebe Grahlman,3/19/2025,562746.46,All ingredients needed to make your own sushi
875,5100135486899612,Berte Foddy,3/26/2025,229281.33,Stainless steel travel mug that keeps drinks hot or cold.
876,3548469048438386,Dew Durrance,4/6/2025,908285.65,Automatic water fountain for pets with filtration.
877,201544238686590,Winny Alexsandrowicz,12/14/2024,889417.5,Sharp tailored blazer perfect for office wear and professional events.
878,30445632096260,Elsbeth Ferraraccio,1/12/2025,614605.48,Wi-Fi enabled thermostat that learns your habits.
879,3551718693175857,Briano Vasyutochkin,5/29/2024,485799.15,Savory bacon jerky coated with maple flavoring.
880,4911064201507137322,Callean Posten,10/17/2024,789743.43,Oven-roasted potatoes tossed in garlic and parmesan cheese seasoning.
881,3546207281763694,Yard Childerhouse,12/21/2024,877323.56,Natural elderberry syrup to boost immunity.
882,5602244421633301,Ches Legging,10/26/2024,904699.23,A flavorful sauce for stir-frying vegetables and meats.
883,5100148322556049,Helga Everist,2/25/2025,418855.47,Delicious mini donuts dusted with cinnamon sugar.
884,3538425617679232,Leda Haydon,12/17/2024,385662.33,"Soft, cuddly toy that interacts with children."
885,6706492692925148731,Inesita Rennox,3/23/2025,606279.92,Delicious veggie burgers loaded with grilled vegetables.
886,3564440465173797,Clementina Gundrey,7/17/2024,847892.14,Chewy granola bars with maple and cinnamon flavor.
887,374622389392555,Russell Beggan,7/21/2024,934595.69,Multi-level cat tree for play and scratching.
888,3550964978211964,Tasha Kissell,4/2/2025,661513.13,"Delicious soft cookies, dairy-free and egg-free, perfect for treats."
889,4041598615438377,Palmer Spadaro,2/27/2025,992805.86,BPA-free glass containers for safe food storage.
890,374288729611417,Bartolomeo Darbyshire,1/21/2025,968300.51,Frozen cauliflower rice blended with mixed vegetables and seasonings.
891,3554522968178415,Northrop Honsch,8/30/2024,639620.91,Maintain freshness and dispense cereal easily.
892,676198901061514160,Charin Stockow,4/28/2025,954897.22,UV light sanitizer for phones and small items.
893,3581996327282240,Romona Lathwood,8/28/2024,385306.17,Eco-friendly utensil set made from natural wood.
894,3529880921163359,Frederich Biggins,4/15/2025,40342.04,Portable solar charger for outdoor adventures.
895,372301614285684,Hillary Cunnah,11/15/2024,511150.84,"Rich and creamy ice cream, available in various flavors."
896,3572252577893224,Nickola Picheford,6/17/2024,863309.92,Soft comforter set for a cozy bedroom look.
897,5100179513455949,Hadrian Laville,5/11/2025,69959.59,Soft glow night light for children's rooms or bedside.
898,5602222743694425,Tabbie Assiter,12/18/2024,245647.51,All-natural skincare set for daily use.
899,3550243209192362,Julieta Scotsbrook,6/8/2024,769311.67,Fresh and juicy cherry tomatoes for salads and snacking.
900,3548131949168633,Livy Strutton,5/19/2024,688718.24,Comfortable and adjustable harness for dogs.
901,5602211757311802,Dorothee Bullin,8/7/2024,103923.88,Hearty chili made with premium ground beef and kidney beans.
902,5602217965228902,Lon Kettlesting,6/17/2024,814421.96,Creamy pistachio-flavored ice cream with real nuts.
903,6767776261187189038,Arther Bowring,12/18/2024,841614.84,Creamy vegan mac and cheese made with cashew cheese.
904,5475483646720063,Cole Leupoldt,12/6/2024,521857.8,"Expandable caddy for holding books, phones, and snacks while in the bath."
905,3556007625970527,Rochette Sherington,12/13/2024,320795.0,Connect your phone to the car's audio system via Bluetooth.
906,374283450266622,Glenn Sitford,4/13/2025,758581.58,"Frozen cauliflower bites coated in spicy buffalo sauce, ready to bake and enjoy as an appetizer."
907,4508767966023304,Elke Balwin,9/28/2024,675672.96,Large electric griddle for family meals.
908,3541452704061566,Elsbeth Vasiliu,10/5/2024,926278.64,Essential survival gear kit for emergencies.
909,3564013736325346,Alida Romain,6/25/2024,132238.58,Durable tablet designed for kids with parental controls.
910,5108757227742439,Elie Tring,3/15/2025,541101.2,Spreadable cream cheese with garlic and herbs.
911,3548082148408827,Nerita Elden,7/7/2024,537418.29,Cozy oversized sweater perfect for chilly days with a textured knit design.
912,5100149144183228,Marius Andresen,12/14/2024,650941.46,Unique handcrafted utensils for cooking and serving.
913,630405635569323999,Rennie MacKnocker,1/27/2025,128058.2,Soft and breathable pillowcase for body pillows.
914,5010122022544232,Dacia Ansteys,2/6/2025,42093.55,Flavorful sauce perfect for stir-frying vegetables and tofu.
915,3579965295333453,Franny Acomb,5/23/2024,632323.27,"Delicate ravioli filled with roasted butternut squash and spices, perfect with a sage butter sauce."
916,3548906160650397,Caddric Gosart,7/7/2024,331683.04,Digital scale for precise cooking measurements.
917,5002353964736920,Wright Hannaby,11/23/2024,412202.92,Compact blender that comes with travel cups for smoothies.
918,5100146937690229,Myrwyn Baylie,3/30/2025,583424.86,Versatile organic coconut oil for cooking and baking.
919,3546020713410101,Josee Tippings,5/25/2024,619547.92,"Gluten-free flour made from ground chickpeas, great for cooking."
920,3565942979734815,Kassie Caldecot,9/4/2024,662411.81,Jump rope that counts your jumps for tracking workouts.
921,3579237444985868,Twyla Earsman,6/14/2024,577740.42,"Shrimp marinated in a honey garlic sauce, ready to cook."
922,4405194150927436,Cariotta Cathery,5/15/2024,153899.07,Manual blender for smoothies and mixing ingredients on the go.
923,633110106422388124,Leanor Websdale,10/19/2024,498342.02,Laundry bags perfect for delicates and organizing clothes.
924,675940888748598224,Harper Rennock,3/23/2025,18092.71,A flavorful blend of rice with tropical pineapple and coconut flavors.
925,5456163778042956,Chaim Tarquinio,6/5/2024,98967.82,Set of three aromatic candles with various scents.
