id,nomor_rekening,nama_lengkap,tanggal_transaksi,jumlah_debit,keterangan
700,3560221824901688,Ingar Mennithorp,10/2/2024,171921.3,Delicious and tangy marinade for grilling or baking chicken.
701,3548834088322057,Nesta Paddingdon,10/24/2024,993557.92,"Crunchy granola with almonds and a hint of vanilla, perfect for breakfast."
702,3535628285744005,Leopold Burchmore,4/5/2025,901766.92,Portable chess set with magnetic pieces for travel.
703,3567630827709802,Morse Milmore,2/4/2025,262579.07,Multifunctional smartwatch for fitness tracking.
704,3580209544557894,Alyson Vaudrey,1/17/2025,7054.81,"Freshly cut carrot sticks, perfect for snacking."
705,5602222407466425,Cosmo Quincey,1/15/2025,492206.97,Powerful electric pressure washer for deep cleaning.
706,3559326100991734,Hendrick Postan,1/8/2025,610130.35,Hearty lentil soup for a quick meal.
707,6334390994251490255,Kenna Leckey,3/16/2025,531309.66,Handy dispenser for quick access to safety pins.
708,3576793258107307,Julina Bartalucci,1/21/2025,813813.98,"Hearty chili made with beans and vegetables, a savory meal option."
709,3531031771979439,Papagena Acuna,11/9/2024,436456.54,Assorted herbal tea bags for relaxation and wellness.
710,5602219579794386,Floris Greber,5/15/2024,180017.34,Variety pack of sticky notes in different colors and sizes.
711,3579942070922875,August Daniaud,7/2/2024,973853.49,Tablet for digital drawing and illustration work.
712,3537578102534964,Thomasine Iseton,4/5/2025,789600.78,"A natural sweetener made from coconut sap, a healthier alternative to sugar."
713,6395546677282636,Thoma Catlette,7/22/2024,699346.4,Crunchy granola with raisins and cinnamon for a delightful breakfast.
714,5641826770545624,Romain Carlile,8/21/2024,639614.51,"Crispy and chewy granola bars, perfect for on-the-go."
715,4508275337944166,Abbye Ffoulkes,12/25/2024,745992.14,Accurate stopwatch for timing events and workouts.
716,6374470432002111,Prudi Forshaw,7/30/2024,846370.18,All-in-one kit for making delicious chicken salad.
717,3587736167350887,Petronia Booley,7/2/2024,185281.73,"Fresh kale salad with a zesty lemon dressing, great as a side dish."
718,3575004770942119,Randie Duran,10/10/2024,387935.42,"No-bake energy balls made with oats, chocolate chips, and honey."
719,3588687298719947,Carlin Choake,4/14/2025,94893.96,Microwaveable heating pad for muscle pain relief and relaxation.
720,3573086211941422,Marcile Livezey,8/4/2024,248772.53,Wireless trackpad for enhanced laptop navigation.
721,3567848097600135,Madelena Kuscha,3/20/2025,975283.23,Eco-friendly bamboo holder for toothbrushes.
722,3589865804269958,Cece Hoston,5/20/2024,584076.92,Stylish watering can for plants with easy pouring nozzle.
723,5641821038635895,Rudyard Fonso,9/4/2024,395678.25,Tool for measuring perfect pasta portions every time.
724,3561409117607752,Harriett Izakof,5/22/2024,252009.31,"Trendy high-low tee with a relaxed fit, ideal for weekends."
725,3576733326691585,Gaby Brodnecke,5/28/2024,929275.39,"Lightweight, expandable hoses for easy handling."
726,3577551459258470,Madeline Blumire,3/24/2025,689826.66,"High-protein pasta made from black beans, gluten-free."
727,374283186050977,Jase Norgate,12/7/2024,363123.12,Lightweight and portable folding table for camping or picnics.
728,677150281773337356,Beck Moxstead,10/21/2024,971412.21,"A zesty salad with black beans, corn, and chipotle dressing."
729,3564454803855312,Levey Gittings,10/17/2024,827221.85,Lightweight hair dryer with multiple speed settings.
730,503813925147557019,Enrique Offell,7/26/2024,156234.01,Comfortable trainers with mesh inserts for breathability.
731,3539620794387059,Karia Townend,3/25/2025,834540.84,Educational tablet designed for preschool-age children.
732,3544996727189116,Moise Potten,7/24/2024,427472.37,Creamy hummus made with sweet peas and tahini.
733,5602238188842733375,Nadiya Vasiliu,3/17/2025,660325.12,Ready-to-bake cinnamon roll dough for easy breakfasts.
734,5100132789186326,Ema Rochford,5/17/2024,345940.77,Versatile folding table great for events or outdoor activities.
735,374622395605958,Lesya Eglin,3/8/2025,530229.04,HEPA air purifier for clean indoor air.
736,201548095176132,Jeth Holliar,5/11/2025,156364.72,Soft and breathable cotton sweatpants perfect for lounging or workouts.
737,3568152367032866,Maressa Ramelot,5/9/2025,824387.7,"Refreshing and tangy fermented tea, available in various flavors."
738,3581127180203517,Ryun Dyet,3/27/2025,294.98,Make delightful blueberry muffins at home with this easy mix.
739,3567874037221220,Levy Monget,4/18/2025,541860.16,Wax warmer for creating a soothing atmosphere with fragrances.
740,6384338972179714,Pammy Witherby,8/31/2024,873053.44,Creamy pumpkin soup with spices
741,4508965944240863,Tom Bang,2/23/2025,595058.45,"Frozen zucchini slices coated in parmesan cheese, perfect for baking or frying."
742,4017954750543,Ashlie Odda,1/24/2025,655636.64,Rich and flavorful pasta sauce made with ripe tomatoes and basil.
743,4508292485130308,Lindon Illsley,9/20/2024,381420.14,"Flavorful lentil soup, perfect for a quick meal."
744,633410092988291844,Caroline Alfuso,5/21/2024,185802.54,Special attachment for vacuum cleaners to remove pet hair easily.
745,3531110550554124,Thedric Tunnicliff,12/22/2024,585987.37,Creamy risotto infused with wild mushrooms.
746,30562570290638,Fanny Dalmon,10/10/2024,282547.43,Stylish scarves to accessorize any outfit.
747,3533125451961564,Doria Wannes,4/17/2025,936613.34,Rich and sweet paprika spice for seasoning.
748,6763093102368981,Tallie Thyer,10/27/2024,690966.26,UV sanitizer that kills germs on your smartphone.
749,5108757395444651,Leela Hartil,10/29/2024,375051.92,Delicious veggie burgers loaded with grilled vegetables.
750,4041590326989,Barthel Canepe,9/21/2024,918957.39,A high-quality protein powder perfect for smoothies and baking.
751,3562350545060835,Dinny Shreenan,4/8/2025,866819.56,"Healthy salad made with quinoa, almonds, and mixed greens, perfect for a light meal."
752,344797291794085,Lesley Tills,9/10/2024,689942.49,Smart robotic vacuum for automatic cleaning.
753,3561929065425915,Felecia Sandon,8/26/2024,725841.88,Compact and portable backpack for day trips and travel.
754,3549878949764345,Cele Itter,7/1/2024,734905.53,Complete tattoo kit for beginners and professionals.
755,201822299127674,Basia Arnason,7/28/2024,530160.21,Automatically cooks eggs to your desired level.
756,3545722111012907,Laney Roslen,9/12/2024,814496.05,"Durable canvas tote bag, perfect for everyday use."
757,5010121774435367,Herbie Carloni,4/1/2025,998091.13,Professional sharpening system for kitchen knives.
758,3541002878574728,Merry Ownsworth,9/13/2024,3162.88,Safe and easy-to-use nail clippers for pets.
759,4903081267235299,Glynnis Delwater,5/20/2024,503494.74,"Juicy pork tenderloin, great for roasting."
760,3580762889927841,Rianon Goford,3/22/2025,471428.28,Chic wrap jumpsuit that flatters the body and is perfect for any occasion.
761,5366344526335376,Selinda McGrae,7/24/2024,263195.49,Savory sardines packed in olive oil.
762,633379562369716832,Cacilia Lucchi,6/7/2024,980987.62,Compact digital camera with 20MP resolution.
763,5010120342516609,Arv Chell,11/16/2024,303657.46,DIY projector that magnifies your smartphone screen for movie nights.
764,6331108450814577095,Blinny Cobleigh,1/20/2025,210414.38,Wax warmer for creating a soothing atmosphere with fragrances.
765,5018569085800535149,Florie Medcalf,5/17/2024,305654.88,Frozen smoothie blend with berries for a quick and healthy breakfast.
766,3562636595432431,Camey Cudihy,12/16/2024,782004.88,Compact action camera for capturing adventures.
767,3561182447734402,Matthew Lemary,1/29/2025,457162.2,Fun book filled with puzzles and games for kids.
768,3565739138954643,Allyce Burchess,12/11/2024,586604.27,Classic marshmallow treats made with crispy rice.
769,3538034320966009,Bee Beeken,1/2/2025,992411.61,Spicy blue cheese with a hint of buffalo flavor.
770,490386834183282796,Artemus Jeanel,1/18/2025,465943.01,"Soft pita bread, perfect for sandwiches or dips."
771,372301109019127,Esma Meller,9/15/2024,895909.0,Solar-powered charger for smartphones and tablets.
772,3535158765800051,Duff Ablett,11/10/2024,904065.22,Adjustable grinders for fresh spices at the table.
773,3540924910478827,Keefer Foulser,10/9/2024,198726.48,Sweet and nutty filling for delicious homemade pecan pie.
774,3549400499063034,Walliw Gardiner,12/5/2024,237466.51,Wearable device to track fitness activities and heart rate.
775,30059208263640,Nickie Greenhalgh,8/26/2024,90331.22,Extra virgin olive oil infused with fresh basil.
776,4041598102085,Jilly Deporte,5/26/2024,966404.03,Delicious pasta shells filled with spinach and cheese
777,201490662860436,Templeton Gooder,10/17/2024,489603.03,Bottle with infuser for brewing loose-leaf tea on the go.
778,3563645443355248,Jaquelin MacMillan,6/26/2024,275497.09,Large electric griddle for family meals.
779,3532225357292303,Anselma Jimmison,8/27/2024,112596.86,Space-saving colander for rinsing fruits and vegetables.
780,5007663831879322,Barby Brinsford,9/28/2024,624799.54,Fun lunchbox for kids with a sturdy design.
781,5100146923198641,Gwendolyn Peerman,9/5/2024,875570.64,"Crunchy granola with almonds and a hint of vanilla, perfect for breakfast."
782,3550712098975152,Robin Ielden,7/11/2024,770968.14,Mild cheese great for sandwiches.
783,3543266427002196,Sidonia Foxley,8/23/2024,948883.72,Instant oatmeal cups with blueberries for an easy breakfast.
784,3531428754149792,Zackariah Hebblethwaite,8/9/2024,728309.95,"Bright and fragrant cilantro, great for garnishes."
785,3549834602873725,Poul Stuckford,7/15/2024,70420.55,Refreshing coconut water packed with electrolytes for hydration.
786,3564195184111250,Eileen Lowmass,11/4/2024,983870.79,"All-in-one meal kit including pasta, meatballs, and sauce for a quick dinner."
787,4917851850276882,Ermanno Duell,11/19/2024,732376.32,Comfortable wireless headphones designed for sleeping.
788,3559689517181573,Clevey Plowes,12/27/2024,338537.6,Heavy-duty chain lock for securing bicycles.
789,4917367988151772,Anjanette Baines,2/19/2025,259824.6,Unsweetened coconut flakes for baking and topping.
790,3575765490593461,Doro Pavett,12/25/2024,606677.12,Everyday flats that combine comfort and style.
791,4026017188399360,Lianna Luety,7/1/2024,18953.03,"Chic suede ankle booties, perfect for dressing up or down."
792,67633448934346284,Silvio MacAskie,1/25/2025,687721.13,Soft and chewy cookies made with creamy peanut butter.
793,201734943610627,Avivah Chataignier,10/8/2024,8130.56,A flavorful blend of rice with tropical pineapple and coconut flavors.
794,30043818665360,Kelsey Atterley,1/13/2025,781773.23,Retro instant camera for capturing and printing photos instantly.
795,3557570632364553,Candra Rowan,9/11/2024,871912.75,Stream HD video wirelessly from devices to TV.
796,377595661212617,Paxton Lomas,4/12/2025,633859.93,Cook rice and steam vegetables simultaneously for healthy meals.
797,3575767093326349,Zea Tommen,3/19/2025,422792.77,Delicious recipes focusing on plant-based ingredients.
798,3573830119170356,Roderich Christofor,1/28/2025,104826.91,Bluetooth-enabled key tracker to find lost items easily.
799,6762426607972500810,Luelle Finlow,3/21/2025,795115.78,Ready-to-eat chicken bowl with teriyaki sauce and rice.
800,3588988584942866,Debby Di Giorgio,6/22/2024,415094.22,Juicy and tender boneless chicken breasts.
801,6767518648926838698,Alanna Everton,6/23/2024,135799.18,High-quality headphones that block out external noise for immersive listening.
802,3544626271003252,Armin De Freitas,2/5/2025,40924.29,Vegan sushi filled with spicy vegetables and avocado.
803,3564687547678611,Alexina Philpault,3/8/2025,558414.89,Bell peppers stuffed with rice and vegetables
804,4881501520257,Modesty Creelman,9/19/2024,791876.0,Marinated beef strips in teriyaki sauce for easy grilling.
805,3553495092517132,Ellene Stoffler,10/19/2024,136438.95,Stylish black leather jacket featuring a zip-up front and multiple pockets.
806,3569373090058494,Nicola Allsep,6/16/2024,56044.61,Reusable straws that come with a cleaning brush.
807,3571922828160687,Mireielle Shankland,9/5/2024,316744.86,Bluetooth-enabled key tracker to find lost items easily.
808,3533007409102113,Mattheus Thornewell,4/9/2025,55861.11,"All-in-one meal kit including pasta, meatballs, and sauce for a quick dinner."
809,56022220961953775,Elisha Baudinot,6/2/2024,938213.06,Heat-sensitive mug that changes color when filled with hot liquid.
810,5602217403068340,Geri Whorf,1/11/2025,945496.99,Classic wooden puzzle game for kids and adults.
811,3551450518319938,North Jaquet,3/21/2025,451359.77,Smart robotic vacuum for automatic cleaning.
812,5582254280435999,Brigg Arnason,1/10/2025,666809.04,"Thin, flat pasta perfect for various sauces."
813,3565313042182574,Heindrick Leet,7/13/2024,192493.14,Set for making fondue at home.
814,3571260941437652,Richart Paula,11/22/2024,336123.09,Frozen smoothie blend with berries for a quick and healthy breakfast.
815,3580652844663955,Ganny McTurley,5/29/2024,306069.74,Stability ball for Pilates and yoga workouts.
816,0604099791295878,Erl Willsmore,11/8/2024,851222.77,Classic cereal made with whole grains and honey.
817,3582523821336527,Quintina Heenan,5/27/2024,743418.43,Bold combat boots that make a statement with any outfit.
818,4017952056890895,Zita Clardge,10/12/2024,803414.4,"Bright and fragrant cilantro, great for garnishes."
819,3585661905175044,Pebrook Labitt,7/20/2024,164112.66,Soft and cozy bathrobe perfect for relaxing at home.
820,6386849998778477,Angele Richfield,4/13/2025,872594.84,"Creamy dip made with caramelized onions, perfect for chips or veggies."
821,3542454603218213,Waiter Kneeshaw,9/8/2024,621810.36,Soft glow night light for children's rooms or bedside.
822,677132117898125081,Stacia Barrass,4/2/2025,486908.13,Love-themed molds for creating desserts and treats.
823,5602221634284619,Cate Eusden,4/25/2025,874749.26,Custom cutting board made from high-quality wood.
824,3556410582022219,Cecilio Whitcombe,9/15/2024,903079.92,Assorted collection of herbal teas for relaxation and wellness.
825,3582929396471625,Belia Gomar,5/31/2024,99071.54,Everything you need to build a festive gingerbread house.
826,4017957503630174,Killian Knowlton,2/7/2025,949337.05,Savory wraps with buffalo chicken and fresh vegetables.
827,3561818674242219,Frants Butchard,6/30/2024,730200.37,Set of two yoga blocks for increased stability and support.
828,3553580367824592,Laurens Dear,2/24/2025,700532.82,"Fruits dipped in rich chocolate, perfect for desserts."
829,3557645297058714,Gardiner Quennell,12/1/2024,138103.48,Creamy peanut butter with no added sugar or oils.
830,4026847049731041,Morgan McDill,9/1/2024,518810.67,Handheld sprayer designed for washing pets easily.
831,3553828155611485,Loni Baggot,3/23/2025,51498.95,"Continuous stream of fresh water for pets, promoting hydration."
832,374283834759102,Stillman Rattry,7/11/2024,837216.56,High-performance mechanical keyboard with customizable RGB.
833,3540212332816497,Georgiana Millsap,2/19/2025,93215.62,Bluetooth scale that tracks body composition through an app.
834,374288843910125,Pedro Tricker,1/18/2025,951686.41,Wireless earbuds designed for immersive sound experience.
835,3531228367648333,Lorinda Fugere,5/20/2024,915437.85,"Rich dark chocolate bars, perfect for a sweet treat."
836,5439774822193215,Dillon Vannoort,9/19/2024,478802.67,"Nutty flavored chia seeds, packed with nutrients."
837,3583195112105348,Bern Zimmer,6/30/2024,706193.96,Hanging bird feeder for backyard birds.
838,3587770289004106,Dallas Zaniolo,3/3/2025,207241.49,Creamy peach-flavored yogurt with real fruit.
839,5038987527709581,Phip Crus,3/5/2025,782782.21,Travel-friendly dog bowl that is collapsible for easy storage.
840,3563851855381561,Barbabas Archbould,4/21/2025,286580.36,Tidy storage solution for rechargeable batteries.
841,6333782687880006041,Antonin Viegas,8/9/2024,558924.88,"A ready-to-eat soup with coconut milk, spices, and vegetables."
842,060462642638597173,Nedda Rolling,3/26/2025,244181.31,"A fresh, flavorful basil pesto for pasta and more"
843,6304545177979840,Agnesse Spoure,10/14/2024,29850.38,"A delicious salad with quinoa, nuts, and cranberries."
844,3574415273211607,Brantley Nanni,7/14/2024,361346.1,Spicy salsa with chipotle and lime for a zesty kick.
845,5256274099737547,Reamonn Coston,6/15/2024,322929.54,Stylish and spacious case for makeup and beauty products.
846,3534825139584915,Philomena Boyle,7/17/2024,607617.07,Chewy bars made with peanut butter and chocolate chips.
847,3531000974950141,Michal Brookes,12/7/2024,38884.4,"Rich tomato soup flavored with fresh basil, ready to heat up."
848,374288060253415,Cherice Thams,9/10/2024,780762.42,"A fluffy pancake mix infused with maple and pecans, perfect for a hearty breakfast."
849,4844407694348979,Kristel Romaynes,1/1/2025,141412.69,Shower head designed for a strong spray and complete coverage.
850,3528806291185459,Allegra Halpine,11/9/2024,735032.35,Handheld vacuum cleaner for quick and easy cleaning.
851,6304664324654691,Dolph McKimm,12/31/2024,648477.61,Multi-port USB-C hub for connecting devices.
852,5198918143082869,Giselbert Griffiths,10/30/2024,444254.45,Rich and creamy chocolate fudge ice cream for dessert.
853,491180212592777654,Melisa Klimecki,4/3/2025,55633.18,Soft glow night light for children's rooms or bedside.
854,30141695181251,Kamillah Gland,2/5/2025,907883.94,"Pasta alternative made from sweet potatoes, gluten-free and rich in flavor."
855,30071040692514,Carlyn Node,7/8/2024,378423.04,Comprehensive first aid kit for home or travel emergencies.
856,6331107814383678058,Belicia Sansam,7/20/2024,644699.75,"Crispy chips made from taro root, a wonderful snack."
857,6709660710078713190,Craggy Fynn,7/12/2024,720856.67,Comfortable mouse pad designed to reduce wrist strain.
858,3549392119008533,Stacie Seely,2/23/2025,586710.28,"A mix of carrots, peas, and corn, easy to stir-fry."
859,6759928736886005,Adrea Deely,9/15/2024,545900.48,Salty pretzels filled with creamy peanut butter.
860,3574121314643853,Ariel Slainey,12/26/2024,598102.92,"Assorted herbal teas, perfect for a warm and relaxing drink."
861,3555488941198228,Ransell Rennebeck,3/19/2025,914699.41,Delicious veggie burger patties for grilling or frying.
862,372301958785273,Melonie Hallas,7/5/2024,873085.09,Crisp and delicious organic apples.
863,5602222392579120339,Davina Farrand,5/3/2025,179761.43,"Frozen zucchini slices coated in parmesan cheese, perfect for baking or frying."
864,3548453472073182,Robinette Brendel,9/1/2024,704093.41,"Ready-to-eat salad with kale, lemon, and cheese."
865,3550593734963533,Alis Frisch,11/28/2024,960745.1,Infuser for brewing loose-leaf herbal teas easily.
866,5535560227074552,Obadiah Shillabeare,6/11/2024,618224.94,Durable speaker designed for outdoor use with water resistance.
867,5048374546647910,Felicio McGerr,5/6/2025,794988.62,"Frozen onion rings, crispy and ready to bake."
868,633485055023274448,Ardelle Baumler,3/21/2025,151157.02,Professional sharpening system for kitchen knives.
869,36397756325393,Conchita Adel,6/24/2024,523173.68,Ergonomic footrest for easier pedicure treatment.
870,3540009783830682,Karisa Treffrey,4/9/2025,723398.56,"A refreshing drink mix that combines sweet raspberries and tart lemons, perfect for summer."
871,6761675547768436508,Fonsie Boulde,6/22/2024,982206.12,"Seasonal pumpkin ice cream, perfect for fall."
872,502008210895419481,Lalo Cram,2/23/2025,76603.74,Water-resistant activity tracker and smartwatch features.
873,5249656058625228,Barclay Cromblehome,6/30/2024,639847.75,Delicious dark chocolate with creamy nut butter inside.
874,3588950061262754,Katharina Gebbe,5/3/2025,745925.1,Creamy hummus made with sweet peas and tahini.
875,346416686538704,Gian Yushkov,7/18/2024,718184.07,A blend of spices that brings the taste of fall to your baked goods.
876,6334554798218443840,Vidovik Froom,2/9/2025,390376.57,"Creamy and rich vanilla ice cream, a classic dessert."
877,3544873850818813,Kathrine Bugs,6/23/2024,495005.77,Durable training soccer ball for practice.
878,3585235948857643,Kailey Allicock,2/18/2025,93885.25,Advanced electric toothbrush for effective cleaning.
879,564182367083659662,Adena Toulamain,10/6/2024,425616.85,Compostable plates suitable for various occasions.
880,30427675683238,Lynne Quartley,2/23/2025,96572.67,Crispy almonds coated with cinnamon and sugar for a sweet and crunchy snack.
881,30114222415781,Loralee Axford,3/31/2025,661365.04,"Freshly baked artisan bread, perfect for sandwiches or toasting."
882,3540689629289332,Cherrita Atterbury,2/23/2025,805440.69,Rotating spice rack with 20 spice jars.
883,3587811302028126,Terrel Triner,9/15/2024,122356.57,"Fresh organic spinach, great for salads or cooking."
884,3584945233002397,Persis Dibner,8/16/2024,285072.7,Refreshing juice blend made with various fresh fruits.
885,3570198592098517,Ty Sides,8/29/2024,507159.11,"A zesty salsa made with peaches and mangos, great for chips."
886,3537615427689527,Mikol Meenehan,10/4/2024,706056.35,Elegant classic pumps that add sophistication to any outfit.
887,4898774468352,Silas Francesc,5/17/2024,117731.97,Stream HD video wirelessly to your TV.
888,6759960501159263904,Domini Maplethorp,4/15/2025,884816.48,A rich sauce perfect for pasta or drizzling over vegetables.
889,5602245099217467,Pebrook Brayn,3/27/2025,187639.92,Rechargeable water flosser for dental hygiene.
890,4041377388137,Donnell Gutman,6/24/2024,640361.24,Silicone tea infuser for brewing loose leaf tea.
891,3558563678558880,Caitrin Diack,10/7/2024,261635.01,Powerful electric pressure washer for deep cleaning.
892,3571692068414264,Filberte Wisham,7/5/2024,689935.64,Complete station with supplies for kids' art projects.
893,3584766174911879,Perla Saffle,4/2/2025,438204.16,"A healthy oil extracted from avocados, ideal for frying and salads."
894,3549223257717256,Carmencita Buddles,6/29/2024,747326.67,Lint roller designed specifically for removing pet hair from furniture.
895,6761693352122194,Dene Barstowk,11/14/2024,534594.57,"A nutritious salad with kale, quinoa, and a zesty lemon dressing."
896,3576861948832830,Angela Wimbridge,9/14/2024,225172.12,Noodles tossed in a spicy Thai peanut sauce.
897,3536722312561521,Trstram Rule,9/30/2024,486756.65,Water bottle designed to infuse flavors from fruits.
898,3571605187068076,Ramsey Haggath,12/20/2024,892193.98,"Low-carb zucchini noodles, perfect for a healthy alternative to pasta."
899,3583140892237820,Jessie Praundl,5/19/2024,87254.64,Complete crafting kit for kids and adults.
900,201663344287372,Alecia Pulster,8/28/2024,326248.67,Set of brush pens for colorful and creative painting.
901,3566903484488619,Dorie Rawlyns,3/22/2025,370366.71,Spreadable cream cheese with garlic and herbs.
902,374288989954309,Kellia Tankard,12/27/2024,323930.69,"A complete meal kit containing breaded chicken breast, marinara sauce, and pasta, perfect for a quick dinner."
903,3585819159887744,Alena Hawkswood,1/30/2025,49895.59,Crunchy croutons with a blend of herbs for salads.
904,3556542087871680,Henri Camamill,9/2/2024,787447.38,"Spiralized zucchini, a healthy alternative to pasta."
905,3544261166679741,Tedie Winyard,10/6/2024,476187.24,"Healthy salad made with quinoa, almonds, and mixed greens, perfect for a light meal."
906,3543550057419634,Micheline Extance,9/7/2024,319569.89,Eco-friendly LED lights for festive decorations.
907,3546724141324947,Trixy Castro,3/3/2025,348695.42,"Floral and refreshing herbal tea, great hot or iced."
908,490388577476181096,Cassius Usmar,10/18/2024,883261.52,Natural elderberry syrup to boost immunity.
909,5341059683969128,Fonz de Guerre,4/28/2025,739208.78,"Rich and flavorful chicken broth, great for soups."
910,5100177618762615,Kala Maciejewski,7/1/2024,174740.15,Ear protection for shooting and industrial use.
911,3562341960677088,Elisabeth Peasnone,10/30/2024,328532.35,Creamy mayonnaise made with avocado oil for a healthier twist.
912,4017956080800309,Maiga Picard,4/16/2025,981549.89,Jump rope that counts your jumps for tracking workouts.
913,3566544052954986,Emeline Shevill,10/6/2024,902894.06,Eco-friendly soy candles with a variety of scents.
914,3530976709215838,Lidia Gourley,9/29/2024,436805.89,Ready-to-bake cookie dough packed with chocolate chips.
915,3569238515981762,Ewen Fortin,11/5/2024,867628.31,High-intensity flashlight with adjustable focus and brightness.
916,3571746116138042,Gian Jessope,9/11/2024,191236.57,Hearty chili made with premium ground beef and kidney beans.
917,30558861363902,Samaria Siely,4/29/2025,813498.07,Spacious duffle bag for weekend getaways.
918,4405684298990791,Jamil Bonellie,10/3/2024,844913.2,Compact hose reel to keep your garden tidy.
919,3589638478948250,Tandie Leffek,11/12/2024,527381.39,"Marinated shrimp in a garlic and lemon sauce, perfect for grilling."
920,3570558405107245,Nobe Towhey,2/9/2025,132931.57,Bright safety vest for outdoor visibility during any activity.
921,3548490338409465,Aileen Hollyer,12/10/2024,432502.76,Make delicious ice cream at home with this user-friendly machine.
922,3582649148715166,Launce Rignold,4/17/2025,260713.77,Gentle grooming gloves for shedding pets.
923,5100170211698526,Emanuele Roake,1/11/2025,932746.56,"A mix of nuts roasted with spicy seasonings, perfect for snacking."
924,5134985699293114,Miran Tankard,3/16/2025,725974.39,"A hearty soup filled with vegetables and herbs, perfect for a light meal."
925,3557262974861145,Laurent Garham,5/9/2025,580783.64,"Nutty flavored lentils, perfect for soups and salads."
926,4508907109815626,Aurel Hamlet,12/14/2024,144208.86,Easy meal kit for creamy fettuccine Alfredo.
927,3577052727888594,Rois Spry,11/18/2024,236799.15,Elegant tea set that includes an infuser for brewing.
928,3562558640608064,Ravid Brooksby,6/15/2024,884583.1,Burr coffee grinder for fresh ground coffee.
929,3565120378635244,Tanitansy Benbough,10/28/2024,434931.72,Rechargeable training collar for effective behavior training.
