id,nomor_rekening,nama_lengkap,tanggal_transaksi,jumlah_kredit,keterangan
234,3545273304012130,Wallis Segar,7/6/2024,631381.39,A delicious tart filled with fresh raspberry filling.
235,201772767925929,Ave Beany,4/18/2025,959034.99,Fun and educational puzzle set for kids.
236,30151369802801,Ceciley Anthoney,7/6/2024,520892.39,A bright and zesty dressing perfect for salads and tacos.
237,6396934554366863,Analiese Ferebee,11/26/2024,958291.62,Comfortable slide sandals for lounging by the pool.
238,5602243597885315,Cooper Arniz,10/14/2024,209473.61,Premium potting soil for indoor plants.
239,3528105927230080,Arlen Hayle,4/4/2025,976125.32,Soft glow night light for children's rooms or bedside.
240,3566551940622576,Anselma Coppins,5/20/2024,280009.59,Smooth and creamy smoothie made with peanut butter and banana.
241,4913272455728348,Erma Boyles,10/13/2024,383537.21,A rich pesto made with sun-dried tomatoes and pine nuts.
242,6388468575323116,Taber Chattaway,4/3/2025,777367.85,"Skillet that can fry, grill, and sauté with ease."
243,633433119091936305,Skippie Paddefield,2/20/2025,776759.66,Cozy throw blanket perfect for adding warmth to your home.
244,3544614687334693,North Antunes,1/12/2025,714009.31,Relaxing paint kit with pre-printed canvas for painting.
245,374288714237053,Jobina Husset,1/30/2025,51588.57,Classic leather photo album for keepsakes.
246,3537473349868070,Pennie Casale,10/28/2024,886964.64,Creamy chickpea dip infused with zesty garlic flavor.
247,670671611553574841,Lou Blanshard,9/6/2024,687571.38,UV sanitizer that kills germs on your smartphone.
248,6759210475157793,Alida Ferrers,7/28/2024,215668.3,"Light and crispy chips made from quinoa, ideal for dipping."
249,3552461073675191,Mordecai Girardey,6/21/2024,683297.04,Creamy macaroni and cheese baked to perfection.
250,3548072825461967,Doti Jahndel,3/3/2025,616989.57,Leak-proof bottles for travel-sized toiletries.
251,3538685061531557,Lori Tothe,6/19/2024,433245.15,A flavorful sauce for stir-frying vegetables and meats.
252,5007668779948260,Vickie Cobley,11/22/2024,563799.45,Heavy-duty rake with adjustable width for different gardening needs.
253,5641827307101311,Francene London,6/6/2024,80326.69,Rotating spice rack with 20 spice jars.
254,5513217521373794,Veronica Goldby,1/2/2025,94670.82,Polarized sunglasses with UV protection.
255,5252104042140016,Jared Chippindall,5/30/2024,681165.82,"Expandable caddy for holding books, phones, and snacks while in the bath."
256,3582319284021494,Merilee Midghall,5/4/2025,148113.01,Prepped vegetables and sauces for a quick Asian stir-fry meal.
257,30358449398417,Scarface Hayfield,11/1/2024,328562.85,An elegant jumpsuit that can be dressed up or down.
258,63042703876120962,Emmott Pow,3/24/2025,995523.23,"Wide range of flavored wings, perfect for parties or casual snacking."
259,5602240741037948749,Lazarus MacGiolla Pheadair,6/18/2024,706165.24,"A hearty soup made with lentils, coconut milk, and a blend of spices for a tropical flavor."
260,67617856920751962,Min Stirrup,3/24/2025,802090.81,"Durable, unbreakable wine glasses for outdoor use."
261,3555540372882553,Maurits Ridd,10/23/2024,734646.77,A flowy maxi dress perfect for both casual and semi-formal occasions.
262,6759036064698115,Jessie Fulstow,7/20/2024,69314.94,"A hearty soup made with lentils, coconut milk, and a blend of spices for a tropical flavor."
263,3538117019357604,Ronica Burnhard,1/11/2025,939975.68,Set of magnetic jars for convenient spice organization.
264,374288533145909,Clementius Cliss,8/23/2024,2000.14,Savory sauce for vegetable and meat stir-fries.
265,3573405142352659,Marylou Foakes,4/16/2025,736678.43,Soft and cozy bathrobe perfect for relaxing at home.
266,5641829805890234914,Ivett Aitken,11/30/2024,421278.6,Complete sculpting tools for artists.
267,3537850603557913,Jeannie Beldan,11/28/2024,623766.97,Strong magnetic holder for smartphones in cars.
268,5121426516920980,Latrena Clemetts,12/7/2024,866832.79,Control your lights remotely with a smartphone app.
269,5459089916531955,Kinnie Searchwell,7/6/2024,394477.09,"Ready-to-eat salad with quinoa and kale, drizzled with vinaigrette."
270,4041373980296291,Dory Luker,8/27/2024,728767.12,"Plain white rice, a staple for any meal."
271,201698748102215,Tracey Kiddye,4/28/2025,245153.77,HD streaming device for accessing popular services.
272,6759074599465076674,Donnamarie Bonett,6/18/2024,126316.28,Wi-Fi enabled plug for controlling devices from your smartphone.
273,3588407423908046,Ginnifer Hodcroft,2/9/2025,419858.52,Healthy chia pudding made with mango and coconut milk.
274,3532782287408714,Clerissa Kier,3/16/2025,930997.96,"Lightly salted rice cakes, perfect for a healthy snack."
275,633110054243263052,Branden Blench,2/24/2025,87552.77,"Pre-cooked vegetable fried rice, just heat and serve."
276,3537363229300577,Nathalia Zarfat,11/25/2024,291479.02,"Roasted pistachios, a healthy and tasty snack."
277,3570464229154366,Codi Wardhough,10/13/2024,908991.85,Crunchy granola clusters mixed with nuts and honey.
278,30300300316666,Corbie Dainty,6/22/2024,594445.21,Comfy pet bed with washable cover for easy cleaning.
279,5108751379119884,Grethel Stiller,12/15/2024,253847.19,Stream HD video wirelessly to your TV.
280,5602257748620355,Gav Blatcher,11/15/2024,740313.44,Automatic can opener for easy meal prep.
281,3555710964896580,Ara Berkeley,10/5/2024,910056.45,Creamy hummus made with sweet peas and tahini.
282,670682945755410819,Bevin Cawthry,11/20/2024,751515.48,A rich coconut curry sauce perfect for simmering vegetables or meats.
283,30209316810291,Desmund Masey,9/23/2024,195165.1,"Fluffy couscous that cooks in just minutes, perfect as a side."
284,4508065403045612,Fraser Kleinschmidt,12/23/2024,911585.59,Crunchy granola with pumpkin spice flavor.
285,36017800233852,Timmie Allon,1/13/2025,15349.4,Breathable mesh sports leggings for ultimate comfort.
286,4405333521736627,Anastassia Benediktsson,4/1/2025,630721.42,Healthy energy bites made with oats and natural sweeteners.
287,3534593470150965,Tybie Allderidge,8/8/2024,224502.0,Regulate water temperature for safe and comfortable showers.
288,3565642582603759,Dodie Goodwyn,1/14/2025,667119.23,Lightweight and portable paddle board for water sports.
289,3534328868482922,Dallas Gabbatt,12/23/2024,187878.47,Battery-operated motion sensor light for safety.
290,4913340308352119,Xaviera Aldred,4/19/2025,851404.11,Soft buns perfect for stuffing with your favorite hot dogs.
291,337941850528208,Bambi Gatecliffe,9/21/2024,966470.99,"Lightly salted rice cakes, perfect for a healthy snack."
292,560224934935530322,Jesse Goakes,3/28/2025,423896.69,Creamy tahini made from ground sesame seeds.
293,3587091797249913,Filbert Binch,7/13/2024,49202.37,Inspiring cookbook with healthy recipes.
294,6706140667819221576,Pepe Gerckens,4/4/2025,601522.17,Versatile folding table great for events or outdoor activities.
295,5100135952414334,Saundra Tyres,3/29/2025,204090.97,Frozen mix of colorful stir-fry veggies.
296,633427477753026395,Guntar Colecrough,2/16/2025,606345.74,Comfortable pet bed for small to medium-sized dogs.
297,5893553367576649724,Flossy Eakly,11/3/2024,951446.49,Durable backpack for hiking or travel.
298,3544511731458371,Effie Huyche,8/2/2024,662761.71,"Juicy peach slices in light syrup, in convenient cups."
299,3553857477829699,Curran Tallis,12/23/2024,38452.97,Crispy cauliflower bites tossed in spicy buffalo sauce.
300,5007660703400575,Zane Parsonage,6/10/2024,934748.24,Smooth Greek yogurt infused with vanilla bean flavor.
301,3555523318207572,Bastien Eakens,3/1/2025,325029.63,Versatile folding table great for events or outdoor activities.
302,201675924392562,Melitta Edginton,3/15/2025,871313.8,Soft foam blocks perfect for building and imaginative play.
303,6771044464289302826,Haydon Cracoe,8/1/2024,1095.95,Delicious veggie burgers loaded with grilled vegetables.
304,3530176874355887,Robbi Elies,5/20/2024,40890.2,A sweet and spicy sauce ideal for spring rolls or chicken nuggets.
305,490564655203011954,John Corteney,1/1/2025,555490.84,Eco-friendly string lights for outdoor decor.
306,4862211558569168,Lara Juszczyk,3/16/2025,302324.5,1080p wireless security camera with night vision.
307,3545612673292395,Meggy Maciejewski,3/31/2025,987561.48,Personalized wooden puzzles for children that encourage learning.
308,490507435997406128,Sander Geram,6/29/2024,8851.94,A warm and stylish puffer coat perfect for winter weather.
309,6762329136734678,Fulvia O'Sesnane,7/25/2024,207755.16,Refreshing sparkling water with cucumber and lime flavor.
310,3584403715268094,Rosie Everist,4/6/2025,906532.27,"A zesty salad with black beans, corn, and chipotle dressing."
311,3589893945097526,Conchita Gager,11/12/2024,378343.34,Large wall planner for organizing schedules.
312,501809539764862600,Deni D'Alessio,1/5/2025,644996.51,Rechargeable LED lantern ideal for camping and outdoor activities.
313,30114239972022,Emogene Fessier,3/27/2025,971308.95,Essential ingredient for baking and cooking.
314,6380258889631983,Kathryne Gosse,7/13/2024,845384.14,A tangy and spicy BBQ sauce that's perfect for grilling.
315,3540669484991164,Chickie Fairtlough,10/19/2024,995970.04,"Crunchy cacao nibs, great for adding to smoothies or baking."
316,3531235185631623,Karen Orpin,8/15/2024,885436.26,"Water-resistant jacket ideal for outdoor activities, featuring a packable design."
317,3572914963934827,Christoffer Hallowell,3/13/2025,286336.25,Citrusy lemons perfect for drinks and cooking.
318,3585799588675045,Martelle Sloper,5/12/2024,80821.84,"All-in-one meal kit including pasta, meatballs, and sauce for a quick dinner."
319,5010121812682871,Analise Kinder,9/1/2024,304327.92,Practical cargo pants with lots of pockets for functionality.
320,4405526750708726,Eachelle Dall,12/8/2024,28970.34,Complete kit for emergency situations including food and water.
321,564182582606344267,Tammara Strawbridge,1/29/2025,799718.61,A healthy vegan cheese alternative packed with nutrients and flavor.
322,3536300825870224,Carissa Rojel,1/25/2025,450871.02,Compact organizer for cosmetics during travel.
323,3588889835123142,Sarine Grutchfield,6/16/2024,315892.14,A mix of brined Mediterranean olives for snacking.
324,3566258213208394,Kareem O'Lenechan,5/9/2025,764591.37,Grilled chicken skewers glazed with teriyaki sauce.
325,560221752258802810,Mariette Willett,3/12/2025,26391.11,Complete fondue set for chocolate and cheese parties.
326,4026437078611700,Mylo Smallpeace,11/23/2024,154468.31,Compact electric pot for hot pot dining at home.
327,201695944201973,Bonnibelle Timbs,8/4/2024,782915.57,Reusable mat that prevents food from sticking to the grill.
328,56109609230943888,Martha Crippin,4/18/2025,617831.11,Passive noise reduction headphones for focus.
329,6383031031730095,Kiersten Rosterne,6/8/2024,276721.54,Prevent water damage with drip trays for potted plants.
330,3530675172257190,Idalina Peaden,9/21/2024,706338.71,"Pure and natural honey, great for sweetening."
331,3545229204939228,Netta Kief,8/5/2024,927196.12,"Sweet, chewy dried apricots, great for snacking or baking."
332,374622329816572,Jerrine Tytler,3/9/2025,329600.85,"Creamy goat cheese infused with herbs and garlic, perfect for spreading on crackers."
333,372091735733072,Lyman Auston,11/5/2024,603038.11,Supportive pillow that provides comfort while traveling.
334,3554726480756448,Torey Avrasin,8/14/2024,565919.95,"Tangy feta cheese, perfect for salads and sandwiches."
335,201953555451324,Patrizio Belfitt,4/26/2025,177281.99,A warm knitted scarf to keep you cozy in winter.
336,6759819694674923,Tildie Bazoge,6/20/2024,625824.54,"A mix of nuts roasted with spicy seasonings, perfect for snacking."
337,5602223776923970,Marsha Swyn,9/18/2024,874770.85,Love-themed molds for creating desserts and treats.
338,30194651967148,Aila Bertson,1/16/2025,837200.35,A crunchy blend of nuts and pretzels with a spicy kick.
339,6763038996948117587,Rollins Bazell,7/24/2024,638312.64,Easy setup tent perfect for camping and outdoor festivals.
340,5455769446853425,Xenia Caplin,4/6/2025,496417.53,Whole grain oats that are perfect for breakfast or baking.
341,3536404330269003,Townie Wainer,1/22/2025,719241.44,Eco-friendly phone case designed to decompose safely.
342,56022331983292132,Englebert Taig,9/13/2024,780700.65,"Shredded potatoes, perfect for breakfasts."
343,3537448921855992,Paulita Hanbidge,6/23/2024,454002.7,Sturdy mobile workbench with storage options.
344,6382671070610004,Paxon Sweetland,2/27/2025,532010.85,Water bottle that tracks your hydration levels.
345,5602235866194635,Letti Marrett,9/27/2024,824620.96,Stylish digital journaling app for notes and organizing tasks.
346,3579481537942572,Christoper Gwynne,1/2/2025,231406.42,Classic cereal made with whole grains and honey.
347,3542342667241694,Henrietta Ronchi,10/4/2024,230139.24,A blend of spices that brings the taste of fall to your baked goods.
348,3554626884734464,Jecho Antonovic,11/24/2024,967939.05,"Nutrient-rich broccoli, easy to add to any meal."
349,3538451192649341,Francesco Trythall,1/14/2025,629021.24,Spicy sauce made with chipotle peppers
350,376777688728962,Junia Follet,4/8/2025,415680.12,Wi-Fi enabled doorbell with HD camera and two-way audio.
351,5018735429961485,Normy Cresser,8/10/2024,199550.86,Hand-poured candles made of natural soy wax.
352,3546595783238755,Marjorie Smout,11/10/2024,593055.86,Protective gaiters to keep dirt and debris out of shoes during hikes.
353,6762060412332578,Roslyn Darell,4/15/2025,516894.14,Supportive pillow that provides comfort while traveling.
354,6397233081869138,Von Death,6/8/2024,19618.87,Crispy and delicious biscotti flavored with cranberry and almond.
355,3572011913291125,Nadine Merrick,8/29/2024,487714.55,"Crispy sweet potato fries, a delicious side dish."
356,4026879981902769,Fons Segge,9/11/2024,469736.1,Compact action camera for capturing adventures.
357,675945440138263939,Viole Lethley,11/15/2024,172191.87,Filters allergens and pollutants from the air for a healthier home.
358,5511879542626732,Ezmeralda Andreotti,4/17/2025,55635.11,Large inflatable pool for summer fun in your backyard.
359,4405099544971810,Sheffield Paolacci,8/30/2024,52906.9,"Nutty flavored chia seeds, packed with nutrients."
360,0604423163640414,Kalle Attlee,7/30/2024,808495.6,Fast and convenient air pump for inflating toys and furniture.
361,6333404249361816,Mara Ottee,11/26/2024,611061.3,Compact camp stove for outdoor cooking.
362,3532877114959580,Reube Van Baaren,1/9/2025,299039.22,Compostable plates suitable for various occasions.
363,6759825875659976073,Gracia O'Lynn,10/15/2024,82485.56,Gluten-free bread mix made with almond flour.
364,5020368739494330,Augusta Sagerson,9/14/2024,622935.59,Ergonomically designed neck pillow for comfortable travel.
365,6759199806389540,Prince Dutteridge,8/13/2024,131674.74,Convenient stroller for pets to enjoy outdoor walks.
366,3567815570615963,Daisi Stanmore,6/19/2024,324406.7,Personalize your calendar with photos and special dates.
367,3544846327213719,Cal Currer,4/6/2025,744111.09,Bell peppers stuffed with rice and vegetables
368,3532969361728378,Charley McInteer,12/13/2024,115504.04,"Sliced black olives, perfect for salads and pizzas."
369,3584610458572660,Jennifer Sellman,12/8/2024,258022.23,"High-density, non-slip yoga mat for stability and comfort."
370,3561887958201597,Celina Handaside,10/23/2024,589354.0,Universal mount for smartphones on motorcycles.
371,374283593707011,Cate Weond,6/16/2024,725659.97,"Savory pizza rolls filled with pepperoni and cheese, ready to bake and enjoy in minutes."
372,6706771958444046298,Purcell Elvidge,8/16/2024,285934.46,Eco-friendly charger with a built-in solar panel for outdoor use.
373,6767659368320068,Sutherland Shimony,10/28/2024,661967.81,Multi-functional grater for cheese and vegetables.
374,30337722715505,Georgeanne Persey,9/1/2024,307325.25,Compact air fryer for healthier cooking.
375,3572440436237804,Aurilia Sepey,6/15/2024,555663.67,Nutty-scented oil for stir-fry and marinades.
376,5007669434290866,Gates Trunchion,2/8/2025,935605.24,Eco-friendly sealer for protecting concrete surfaces.
377,3534907732425660,Benito Carroll,4/10/2025,260456.02,Crunchy crackers topped with real cheddar cheese flavor.
378,3576752605879083,Kenn Lamberts,12/1/2024,21577.61,"Frozen pizza rolls filled with vegetables and cheese, perfect for snacks."
379,5038140807674246,Aundrea Donisthorpe,12/11/2024,92928.97,Popcorn tossed with sweet or savory flavors for a tasty snack.
380,3556361591454564,Sile Hobgen,5/26/2024,653357.78,"A hearty soup made with lentils, coconut milk, and a blend of spices for a tropical flavor."
381,5602242564535440,Chrystel Guerrier,7/27/2024,394872.74,Modern LED table lamp with touch control.
382,337941004852280,Elisabetta Hugenin,6/5/2024,590141.9,Versatile multi-cooker for pressure cooking and slow cooking.
383,4917316493381853,Vivianna Keese,3/24/2025,427843.99,"Homemade jam made with blueberries and chia seeds, no added sugar."
384,3577848244778618,Kerrin Gavahan,11/16/2024,714766.11,Stabilizing gimbal for smooth video recording.
385,3589177074879916,Archie Skeech,5/8/2025,611937.84,Personal massager for muscle recovery.
386,3576862216385147,Gilberte Cyson,7/4/2024,23144.58,"Stylish leather ankle boots with a block heel, perfect for fall styling."
387,3530018256921508,Brigida Habbema,7/18/2024,582840.38,"Delicious and fully cooked sliced ham, ready to eat."
388,3544723536974276,Maxie Bothie,11/4/2024,789088.5,Bluetooth speakers with excellent sound quality.
389,633110508018420239,Fawnia Hallatt,3/11/2025,108581.64,"Fresh organic spinach, great for salads or cooking."
390,3581155105229796,Nevil Marjoram,4/30/2025,4499.8,Convenient dispenser for dog waste bags on walks.
391,67712766450353952,Eveline Yurinov,11/12/2024,361765.75,"Fluffy and delicious pancake mix, perfect for a gluten-free breakfast."
392,5020982417711375,Stavro Burges,9/26/2024,502267.56,Compact hose reel to keep your garden tidy.
393,4017952117059,Northrup McElory,9/3/2024,59400.36,Comfortable pillow with built-in massage features.
394,3546667614258151,Kenyon Wingeatt,9/19/2024,643515.35,Automatic watering devices for potted plants.
395,490527355066731691,Randie Lippiett,9/27/2024,292541.18,Yoga socks designed to provide better grip and stability.
396,5300538766502087,Claudianus Morgans,10/5/2024,830515.51,"Frozen pizza rolls stuffed with spinach and cheese, perfect for snacking."
397,3568242500896135,Luciana Arntzen,8/26/2024,504644.78,Fun fridge magnets to decorate your kitchen.
398,3537351328652667,Hilliard Crawforth,12/13/2024,935430.14,"Heavy-duty rope suitable for boating, camping, and general use."
399,4913655530462554,Rustin Westrip,1/2/2025,860085.42,Durable non-stick frying pan for easy cooking and cleaning.
400,4017955885377125,Corrina Jorgesen,10/24/2024,327721.31,Durable non-stick frying pan for easy cooking and cleaning.
401,3571293250324138,Susette Lusk,11/13/2024,522988.56,"A fresh, flavorful basil pesto for pasta and more"
402,5602256248312056173,Viviyan McCaughey,2/3/2025,533840.05,Popcorn tossed with sweet or savory flavors for a tasty snack.
403,201874816005693,Melony Dwyr,2/24/2025,460436.1,Mesh drying rack for preserving herbs and flowers.
404,3532113460989025,Jabez Dorsey,10/2/2024,561269.99,Comfortable and warm leggings perfect for colder weather.
405,3535106234982893,Hiram Emblen,12/9/2024,446213.68,Flavorful sauce perfect for stir-frying vegetables and tofu.
406,30322478382932,Natalya Reedshaw,1/22/2025,898867.4,"Deliciously crunchy sweet potato chips, seasoned to perfection."
407,67066474580700612,Emmott Daily,6/9/2024,410472.61,Non-toxic traps for catching household pests safely.
408,3586434725791344,Moshe Lindeboom,12/11/2024,853505.31,A healthy mix of assorted dried fruits and nuts for snacking.
409,5018803782930814305,Gwyn Neathway,8/20/2024,378141.46,Rich and creamy milk perfect for baking or desserts.
410,3528589271534595,Gerard Hainning,7/3/2024,690318.27,Retro instant camera for capturing and printing photos instantly.
411,3545748358601664,Tyrone Rosson,12/21/2024,287676.08,Comfortable and adjustable harness for dogs.
412,5602234022393900,Mahmud Stevings,8/10/2024,8750.34,Compact coffee grinder for fresh ground coffee beans.
413,3551886732789010,Yance Baruch,8/25/2024,678382.8,Fun gardening tools designed specifically for kids.
414,30588517958920,Caprice De Angelo,4/30/2025,857888.81,"Relaxed fit joggers made from soft fleece, ideal for lounging or workouts."
415,5610081263898463,Reed Benjamin,8/19/2024,378184.62,Sleek wireless charging pad for smartphones.
416,503827468090948640,Stinky Farmiloe,12/9/2024,220257.58,Fun gardening tools designed specifically for kids.
417,5602242697352549,Johnna Hammelberg,6/23/2024,665161.13,Nutritious bars packed with protein for energy
418,4041374705916320,Othelia Fewings,9/30/2024,744925.52,"Coffee blend infused with pumpkin spice, perfect for fall."
419,060462583346659345,Marcille Tinwell,4/30/2025,978132.7,Compact electronic drum kit for musicians of all levels.
420,3531695079774005,Natala Boak,6/6/2024,539361.07,Device that tracks soil moisture and provides care tips.
421,4903913922813112838,Debora Ancliffe,2/22/2025,20539.39,Light and breezy dress perfect for summer outings with a vibrant floral pattern.
422,3558972401818943,Damian Alf,6/17/2024,814155.91,"Frozen zucchini slices coated in parmesan cheese, perfect for baking or frying."
423,3554228550565585,Isis Leeson,3/30/2025,846805.2,Collapsible dish rack for kitchen countertop use.
424,5007667089213308,Killie Martinson,9/15/2024,354878.34,Creamy tahini made from ground sesame seeds.
425,3588295240366807,Jemimah Redwood,2/24/2025,718402.24,"Crunchy granola with oats, nuts, and honey."
426,3562509688319874,Lionel Klemps,9/23/2024,870830.57,Eco-friendly utensil set made from natural wood.
427,4041596158437434,Aile Grenville,8/25/2024,648910.95,Finely ground flour from dried coconut meat.
428,676772321061649201,Robin Petchey,1/18/2025,510633.91,"Sweet relish made from cucumbers, perfect for sandwiches."
429,5602216543123668,Eadie Iiannone,6/18/2024,31364.15,Set of resistance bands for strength training at home.
430,4903927694025168,Laney Cridlin,11/14/2024,433964.34,Ergonomic mouse designed for gamers with high DPI.
431,374283299765461,Antoinette Wordsley,3/24/2025,743735.53,"Crunchy peanuts coated in honey, perfect for snacking."
432,30002371835323,Georgette Grimbaldeston,5/15/2024,840997.41,Reusable silicone mats for non-stick baking.
433,560221300728876848,Tynan Barehead,5/29/2024,274616.07,Relaxing paint kit with pre-printed canvas for painting.
434,3543120516159591,Vannie Semour,12/17/2024,943678.26,"Crunchy, seasoned chickpeas for a wholesome snack."
435,3568822870227621,Levin Gain,11/18/2024,622886.06,Lightweight and moisture-wicking racerback tank for workouts.
436,4508086624346381,Yevette Bengle,11/28/2024,124566.72,Moisturizing body wash with natural ingredients.
437,6334925593119771,Karee Iczokvitz,1/26/2025,801573.54,Quick-cooking ramen for instant meals.
438,5610713078740064,Sylvia Hames,3/29/2025,680623.48,Healthy chia pudding made with mango and coconut milk.
439,3569323300298844,Nickola Grimsdith,6/18/2024,154120.03,"Creamy ranch dressing, perfect for salads and dips."
440,3557019335466034,Chaunce O'Loughnan,4/26/2025,380256.73,Soft cookies made with almond butter
441,5100175948483084,Lorilyn Duck,9/28/2024,124414.42,UV light sanitizer for phones and small items.
442,3561858300797756,Jeanna Gayne,1/18/2025,602306.28,A delightful mix of dried fruits for trail mix or snacks.
443,30077526383668,Nanci Pennini,1/15/2025,733813.9,A pre-packaged salad kit with noodles and Asian-style dressing.
444,5007663517886781,Harmony Guye,4/28/2025,81139.53,"Stylish leather ankle boots with a block heel, perfect for fall styling."
445,3540111101172498,Jenda Guisby,4/13/2025,652670.43,"Creamy vegan dressing made with cashews, perfect for salads."
446,3533507733629897,Skipp Ionnisian,6/15/2024,795007.03,"Quick oatmeal cups with banana and nut flavor, great for breakfast."
447,3562763042153566,Bertie Blaxlande,3/22/2025,692334.81,Freshly baked artisan bread with a crisp crust and soft center.
448,3555977631150861,Randie Oxburgh,2/9/2025,870858.82,A delicious chicken dish featuring honey and sesame flavors.
449,5100141262814023,Kat Lawes,8/28/2024,512676.22,"Rich coconut milk, great for cooking and baking."
450,201416078597262,Marthe Balbeck,12/12/2024,441316.97,Stylish cap to complete your athletic look.
451,3573902107124438,Brew Howen,1/5/2025,198173.24,A rich pesto made with sun-dried tomatoes and pine nuts.
452,3568224062277391,Caroline Colbron,8/24/2024,72219.72,Programmable pet feeder for scheduled meals.
453,56101905007220197,Terri Verbruggen,2/10/2025,896510.07,Delicious dark chocolate cups filled with creamy peanut butter.
454,3579686792501398,Chet Kilfether,9/8/2024,520369.28,A mix of frozen roasted vegetables for an easy side dish.
455,36663887332412,Hilary Slorach,7/5/2024,545264.39,Variety pack of craft supplies for kids' projects.
456,3556425592371414,Venita Rowcliffe,4/24/2025,78638.05,Energy-efficient lights to illuminate outdoor areas.
457,30506158200477,Cathee Silley,9/30/2024,475453.46,Authentic Indian curry sauce for quick meals.
458,3554749619628114,Ashlie Rump,4/22/2025,987136.69,"Spicy black bean burgers, great on the grill."
459,376885375017571,Clive Sainteau,12/13/2024,230548.51,A classic white button-up shirt for a polished appearance.
460,3572255483928208,Norbert Dinneges,10/18/2024,831508.89,"Crispy sweet potato fries, perfectly seasoned and baked to perfection."
461,201467325612560,Jolie Cressor,5/25/2024,617346.82,Professional-grade nail care set for manicures and pedicures.
462,5007662401487615,Caresa Harrisson,1/31/2025,849625.04,Hands-free waist pack for carrying essentials while walking your dog.
463,30422514459858,Herminia Blinder,3/4/2025,545909.61,Variety pack of sticky notes in different colors and sizes.
