id,nomor_rekening,nama_lengkap,tanggal_transaksi,jumlah_kredit,keterangan
697,6759749296523501,Jecho Christofe,11/1/2024,852890.29,A refreshing sparkling beverage with a bold blood orange flavor.
698,3577340316792974,Ashlee Found,5/17/2024,210776.39,"Crispy baked falafel balls, perfect for salads"
699,374069998909173,Lucais Northage,11/26/2024,79851.7,"Sweet dried raisins, perfect for snacks or baking."
700,3528390248201586,Dot Yablsley,1/31/2025,96596.66,Automatically cooks eggs to your desired level.
701,3543138250516230,Brnaby Nore,7/17/2024,879231.73,A timeless wardrobe staple crafted from soft cotton with a perfect fit.
702,5299863678634445,Dasha Iacovelli,4/12/2025,244015.55,Perfectly balanced sweet and tangy BBQ sauce for dipping or grilling.
703,5610868174794736,Ryley Tejero,9/23/2024,964480.92,"Natural pink salt, perfect for seasoning."
704,3549083502909888,Evvie O'Garmen,2/28/2025,824395.39,Durable baking sheet coated for easy food release.
705,201448572313854,Renado Screech,12/25/2024,638477.36,Effective brush for removing loose hair from pets.
706,3583626949884150,Dallas Pargeter,6/3/2024,938384.06,A mix of fresh vegetables for quick stir-fries.
707,3543918753233213,Cris McCleverty,4/14/2025,632348.29,Handheld vacuum cleaner for quick and easy cleaning.
708,6761529065188678,Winnifred Pitway,12/5/2024,203494.11,Whole grain oats that are perfect for breakfast or baking.
709,4041371054411549,Leonardo Beevor,4/26/2025,599187.42,Eco-friendly electric bike with a 30-mile range.
710,5482711352274771,Dulci Draysey,12/12/2024,458150.35,"Tender and juicy pork chops, perfect on the grill."
711,5602215202453937,Bailie McSparran,4/20/2025,552349.99,Soft and tasty gluten-free sandwich bread.
712,3554329554186475,Vally Assard,10/22/2024,455812.58,All-in-one kit for making delicious chicken salad.
713,3570036664349121,Paulette Risby,1/21/2025,226225.68,Educational robotics kit for building and programming.
714,493654351448250236,Laurene Corhard,2/16/2025,535833.73,Wireless microphone for singing and performances.
715,3572379943870758,Delaney Bazley,4/10/2025,229072.79,A convenient powder mix combining greens and fruits for smoothies.
716,3549098250117559,Mathilde Lomasna,2/8/2025,565342.5,Bluetooth speakers with excellent sound quality.
717,3589441666175012,Brittani Cosgreave,4/27/2025,117109.31,32GB USB flash drive with fast data transfer speeds.
718,3532398040282450,Josiah Cowdry,7/28/2024,802968.01,Elegant glass decanter for aerating wine.
719,67093041688552489,Steffi Bourhill,10/15/2024,670422.1,Multi-functional grater for cheese and vegetables.
720,6762944764785856252,Paxton Dykins,3/16/2025,858410.6,Natural air purifiers to absorb odors and moisture.
721,3587115280562886,Nestor Bonhill,11/21/2024,214206.23,"A sweet and tart jam, perfect on toast or in desserts."
722,5108756291611694,Dan Damiral,8/9/2024,690476.96,Compact air compressor for inflating tires and sports equipment.
723,374288996851845,Annalee Dyet,2/14/2025,783339.15,Vegetable spiralizer for healthy meals.
724,5558659697712303,Wendeline Rosengarten,12/7/2024,462176.19,"Healthy whole grain cereal, great for breakfast."
725,3549755455037128,Basil McGarel,10/24/2024,402044.3,"Artisan bread topped with olives, feta, and herbs, perfect for sharing."
726,30502446419714,Baudoin MacAdam,9/28/2024,605224.54,Rotating spice rack with 20 spice jars.
727,3556468507470186,Fletch Chretien,9/1/2024,362357.7,Advanced electric toothbrush for effective cleaning.
728,3573374915853543,Avictor Camin,3/8/2025,900790.19,Portable projector with 1080p resolution for movies.
729,30235916365220,Clair Gallyhaock,2/19/2025,738001.0,Protective gaiters to keep dirt and debris out of shoes during hikes.
730,6334231904253665021,Hill Amsden,11/22/2024,969153.34,Savory quiche loaded with spinach and cheese.
731,3539484509011896,Mommy Banyard,11/28/2024,812090.29,"A blend of dried fruits and nuts, great for snacking."
732,3533333339241395,Rickey Berks,5/10/2025,960918.66,Noise-cancelling Bluetooth headphones for immersive sound.
733,347641953494484,Nerte McNeil,12/31/2024,421364.97,Countertop compost bin for kitchen waste.
734,3581232455027292,Cindie Reeds,8/1/2024,45104.88,Versatile puff pastry for pies and pastries.
735,201845875028354,Garner Toplis,11/25/2024,395580.46,Delicious waffles infused with pumpkin and spices.
736,3575099232631284,Niels Challin,4/11/2025,456234.63,Sweet and tangy honey mustard dip for snacks.
737,5602211387548264369,Colene Doget,10/27/2024,564214.38,Set of three aromatic candles with various scents.
738,670681404594444689,Boy Sturgeon,10/14/2024,679566.01,Soft corner protectors to keep babies safe at home.
739,201819208172817,Gillan Meneer,7/29/2024,837653.7,Rechargeable hand warmer for cold weather comfort.
740,4913557865357013,Holt Wintour,8/11/2024,776976.53,"Juicy chicken breast stuffed with spinach and feta cheese, seasoned to perfection."
741,5010127072911082,Morton Streater,2/11/2025,908313.33,A comforting soup filled with chicken and noodles in broth.
742,3537477738891940,Darcey Ashcroft,7/18/2024,24357.24,A classic denim jacket that never goes out of style.
743,5602220037834566,Kalli Bugdell,8/24/2024,14400.45,DIY LED strip lights with remote control.
744,3572385355197747,Karena Demange,9/26/2024,413044.27,Training tool for reinforcing commands and behavior in dogs.
745,3588800075735248,Jourdain Acey,10/3/2024,793725.25,A pack of assorted nut and protein bars for a quick energy boost.
746,6398042289305111,Eadith Thurlow,11/26/2024,441143.34,Waterproof camera for capturing underwater adventures.
747,675924914794627103,Yehudi Gheraldi,6/22/2024,242141.07,Ergonomic footrest for easier pedicure treatment.
748,3541770714474978,Marcello Catanheira,3/20/2025,725128.3,Rechargeable hand warmer for cold weather comfort.
749,3530789511906761,Charita Stock,5/16/2024,691779.96,Add a pop of color with this stylish patterned knit scarf.
750,3557685311608979,Vernen Gwyther,6/7/2024,214736.27,Refreshing sparkling water with cucumber and lime flavor.
751,201520788019838,Ronalda Gash,6/10/2024,127481.6,Plant-based sausage links with spices and herbs.
752,6771019127226664,Westbrooke Lugg,12/14/2024,175559.16,A flavorful lentil curry cooked with vegetables and spices.
753,3566234732803387,Darb Priestland,11/15/2024,396006.06,64GB SD memory card for cameras and devices.
754,3574824130188074,Bibby Guilloneau,12/25/2024,791571.36,Creamy almond butter made from roasted almonds.
755,4026232260154225,Alvie Libermore,1/8/2025,694887.03,High-quality sketchbook for artists.
756,4917232836574890,Jere Prandini,6/20/2024,915679.48,Adjustable footrest for improved comfort while sitting.
757,372301957189162,Lora Clapton,7/28/2024,442553.86,Comfortable over-ear headphones with deep bass.
758,3546512156033887,Michal Vasechkin,1/24/2025,136719.87,Corn on the cob seasoned with chili and lime for a spicy kick.
759,3552495921046452,Kiersten Wardhaugh,12/30/2024,908860.28,A flavorful blend of rice with tropical pineapple and coconut flavors.
760,630486124959998423,Maye Mildenhall,7/1/2024,230872.16,"Delicate ravioli filled with roasted butternut squash and spices, perfect with a sage butter sauce."
761,5602235015340963399,Lauraine Shoebrook,11/25/2024,81603.52,Comfortable and adjustable harness for dogs.
762,3538315240158938,Clarance Armand,7/26/2024,503304.48,Adjustable shower head for a luxurious shower experience.
763,3568169653455791,Cheslie Darling,8/16/2024,502642.05,Fresh sliced bell peppers for salads or stir-fries.
764,0604376156772000,Ciel Langfat,10/26/2024,436854.49,Space-saving cup that folds flat for easy storage.
765,3560215858064314,Elia Rubinshtein,9/2/2024,343044.06,Sweet and nutty filling for delicious homemade pecan pie.
766,6334997024295122149,Lanita Petracek,4/2/2025,365231.06,Compact blender that comes with travel cups for smoothies.
767,5428969993210193,Ewan Stirton,6/21/2024,36863.08,Magnetic puzzle assembly board for kids.
768,5100146605979086,Teddie Scothron,7/13/2024,738529.75,Portable induction cooktop for quick heating.
769,3541540176173339,Phyllys Paff,6/23/2024,337225.12,Savory sausage links with a hint of maple flavor.
770,4017954903894,Ethelin Eytel,1/18/2025,565756.21,Elegant glass teapot for brewing loose tea.
771,3576121066420110,Suzann Lideard,8/10/2024,669083.98,Roasted chickpeas seasoned for a crunchy snack.
772,5512189487010994,Roobbie Abrahim,6/8/2024,953942.6,"Delicious and hearty black beans, great for soups or salads."
773,5010126492973722,Saxe Dimmer,3/25/2025,510659.1,"A mix of carrots, peas, and corn, easy to stir-fry."
774,372301735764963,Reginald Umpleby,10/19/2024,660360.82,Add a pop of color with this stylish patterned knit scarf.
775,3552069703695339,Winnie Riveles,7/2/2024,827469.65,Spicy sauce made with chipotle peppers
776,3582939313694076,Chad Larraway,9/14/2024,592787.36,Timeless analog watch with a leather strap.
777,6333083253136551,Ethelin Mealham,10/14/2024,839321.68,"Colorful veggie chips made from beets, carrots, and sweet potatoes."
778,30176600003984,Bing Gebuhr,12/27/2024,901231.33,"Rich and flavorful chicken broth, great for soups."
779,50388007068732876,Rosene Buxcy,9/21/2024,385460.67,Safety collar with flashing lights for pets during night walks.
780,560222320579559730,Truman Jasper,1/20/2025,549702.13,Hands-on experience with science and engineering projects.
781,3535543523268115,Zenia Patrono,9/15/2024,254870.14,Frozen smoothie pack with strawberries and bananas.
782,3561856364850412,Travis Tettersell,5/9/2025,578995.43,A seasonal creamer that adds pumpkin spice flavor to coffee or tea.
783,3582852729687909,Latrena Torbett,7/16/2024,705832.27,A delicious sauce perfect for stir-frying or glazing meats.
784,3582561650937239,Mattheus McKendo,4/17/2025,982218.08,Unique coffee brewing method for a flavorful experience.
785,560225548258436203,Humfrid Galler,9/23/2024,298947.16,Challenging puzzle game set for family entertainment.
786,3542018582636511,Ruthy Garret,6/25/2024,925830.18,Water bottle with built-in UV-C light for self-cleaning.
787,5020415319413872595,Dehlia Leys,11/24/2024,254262.81,Set of two yoga blocks for increased stability and support.
788,5602222571121863,Anjanette Lefwich,7/4/2024,544880.86,A rich coconut curry sauce perfect for simmering vegetables or meats.
789,3581214524304746,Britt Craske,4/14/2025,931097.08,Soft hamburger buns made with whole grains.
790,3537023919481356,Keir Ormiston,3/24/2025,835041.89,Fragrant fried rice with authentic Thai basil and veggies.
791,3587386791407123,Em Kleine,5/31/2024,448815.64,Savory sardines packed in olive oil.
792,3556223049536865,Garland Dumingo,8/23/2024,711574.31,"Non-stick griddle for pancakes, burgers, and more."
793,63047722242133017,Ede Poulson,12/20/2024,150578.14,"Crispy fries tossed in truffle oil and parmesan, a gourmet snack."
794,6398044476845750,Garret McGeever,10/9/2024,207961.38,Beautiful wall calendar for organizing your schedule.
795,201643898005867,Sammy Hitchens,5/22/2024,756536.47,"Rich and creamy dip made with real avocado, great for chips."
796,502000981860477013,Dawna Willoughley,12/20/2024,582318.2,Energy-efficient infrared heater for home use.
797,201971936351278,Florie Acock,5/22/2024,6270.36,"Easy-to-prepare rice with cilantro and lime flavors, great as a side."
798,3578926514805987,Jeniffer Davidde,12/31/2024,428175.46,Blender for smoothies with a portable cup.
799,3571094100764147,Letitia Parrett,5/17/2024,795059.45,DIY projector that magnifies your smartphone screen for movie nights.
800,3537574556289627,Karim Matussevich,9/15/2024,400075.76,Cozy wool sweater to keep you warm on chilly days.
801,3540126034726764,Chadd Gussie,5/30/2024,408285.91,Portable case to organize and protect jewelry on trips.
802,502059052631317589,Hillie Bohlens,2/14/2025,198412.22,Compostable plates suitable for various occasions.
803,5602224268103255593,Giorgia Beauchamp,12/19/2024,280512.22,A blend of spices that brings the taste of fall to your baked goods.
804,5002354217314804,Angelia Strephan,9/9/2024,673965.54,Artisan bread with caraway seeds for added flavor.
805,3535172983659801,Leela Sizeland,3/12/2025,214764.61,"A blend of nuts, seeds, and spices for a healthy snack."
806,374288063393473,Goldi Felmingham,7/23/2024,352176.73,"Pizza topped with barbecue chicken, cheese, and red onions."
807,5100170612889674,Isador Adamczewski,9/8/2024,688838.62,Water bottle designed to infuse flavors from fruits.
808,372301342451293,Irene Yoslowitz,2/15/2025,729908.78,Compact fire pit for campfires and gatherings.
809,5602230994015232,Ami Sudran,1/2/2025,850702.84,"A smoky barbecue sauce, ideal for grilling and dipping."
810,5602239455787205,Tally Mussettini,8/19/2024,301198.74,"Delicious pretzel bites with a sweet honey mustard flavor, perfect for dipping."
811,5300979994938208,Angelina Endean,11/3/2024,155442.71,High-quality voice recorder for lectures and meetings.
812,374283253209399,Stanislaw Dooher,5/3/2025,23512.94,Spreadable cream cheese with garlic and herbs.
813,3573528231277816,Luciano Philpotts,1/14/2025,830340.15,Stylish fruit basket for kitchen or dining room.
814,3578179491348494,Trixi Tallquist,10/25/2024,832792.06,7-in-1 multi-cooker for versatile cooking.
815,5610498318765705,Dudley Tatersale,10/3/2024,581970.91,Crispy breadsticks seasoned with herbs and garlic.
816,5602236305995012,Benedetto Biggins,7/15/2024,986861.85,Delicious veggie burger patties for grilling or frying.
817,676791207151444180,Wayne Bellson,2/9/2025,517484.3,Versatile canvas sneakers suitable for everyday wear with a comfortable fit.
818,4508938438557928,Roddy Cheke,4/3/2025,423112.01,Custom engraved ID tags for pets with your contact information.
819,6334643373874105464,Van Greening,3/12/2025,976551.15,Natural sweetener for baking and cooking.
820,3555727581870806,Marta Bruhnsen,10/14/2024,188464.43,BPA-free glass containers for safe food storage.
821,30501445112379,Conroy Duckers,10/18/2024,801311.06,"Decadent brownies made without gluten, rich and chocolatey."
822,201807187254334,Fredelia MacAllen,6/1/2024,696145.43,Soft corner protectors to keep babies safe at home.
823,4041379288284699,Janette Bellin,9/30/2024,529307.92,Crunchy granola made with organic oats
824,67631715031648909,Marabel Kochl,5/25/2024,172318.82,A blend of mixed nuts for snacking.
825,3587580581543770,Marquita Lawrenson,10/14/2024,410879.81,Advanced electric toothbrush for effective cleaning.
826,3531890164611507,Mohandis Davage,5/28/2024,886157.55,"Versatile canned black beans, ready to add to any dish."
827,3557673851585245,Carly Kropp,6/15/2024,142919.88,Savory sauce perfect for pasta or dipping.
828,6762264169280265656,Gracie Crosetti,5/25/2024,822216.91,"A hearty soup filled with vegetables and herbs, perfect for a light meal."
829,3572688249550090,Caroline Pietrzak,5/13/2024,751123.41,Comfortable carry for pets while hiking or traveling.
830,3570806933243747,Kevina O'Rudden,11/25/2024,810338.72,"Rich and creamy dip made with real avocado, great for chips."
831,3589736741490173,Katalin Pillans,1/10/2025,93519.32,Wi-Fi camera with motion detection for home security.
832,6759401860236348956,Jeanne Budget,12/28/2024,1724.75,Set with various resistance bands for workouts.
833,3580392138522647,Morganne Gaisford,1/30/2025,147837.69,"Firm tofu, a great plant-based protein option."
834,3573284897105442,Gayleen Humber,6/28/2024,119687.53,Pancake mix infused with seasonal pumpkin spice flavor.
835,3588970864510662,Willi Hearons,5/31/2024,121595.97,"A hearty soup made with lentils, coconut milk, and a blend of spices for a tropical flavor."
836,5155887678187875,Adrianne Roncelli,1/19/2025,955625.28,Warm oatmeal flavored with apple and cinnamon.
837,3537956526961528,Ricky Edsell,8/13/2024,783725.59,Seal food and maintain freshness longer.
838,6761978136448118,Dominga Tourville,12/19/2024,741809.92,Portable induction cooktop for quick heating.
839,201499375355469,Pincas Aggus,2/26/2025,126711.27,Sweetened sticky rice served with fresh mango and coconut sauce.
840,6767188977836564543,Rooney Densun,8/13/2024,136213.04,"Nutritious blend of wild rice and quinoa, perfect as a side dish."
841,201675981383678,Arthur Edwardson,5/19/2024,44426.42,A seasoning blend of garlic and herbs to enhance any dish.
842,3550620162607553,Wes Churchyard,4/17/2025,239190.27,"Savory hash made with sweet potatoes and kale, a perfect side dish."
843,3583510770636709,Bonni Eliot,1/17/2025,473904.58,"Fresh baby spinach leaves, great for salads and smoothies."
844,3530979427484157,Ivie Highwood,10/12/2024,222300.45,Automated cleaning robot for hassle-free home maintenance.
845,4905766186622035514,Ulrich Allain,5/12/2024,504309.98,Multi-port USB-C hub for connecting devices.
846,3544710516409530,Emelia Spickett,11/7/2024,422606.16,Wi-Fi enabled thermostat for energy-saving temperature control.
847,3578806831884107,Eugenia Pristnor,7/5/2024,534411.27,"Fluffy quinoa mixed with lemon zest and herbs, a perfect side."
848,677124017194117396,Rhiamon Lorey,10/21/2024,682030.2,No-bake energy bites made with peanut butter and oats.
849,6304729238633361387,Shay Wilkenson,2/13/2025,97377.53,Hearty chili made with premium ground beef and kidney beans.
850,6331102714609626,Donal Decort,5/28/2024,505066.11,Versatile multi-cooker for pressure cooking and slow cooking.
851,201907768154125,Mathew Timson,12/14/2024,36243.97,"A mix of strawberries, blueberries, and raspberries, great for smoothies or desserts."
852,3572210857650722,Laryssa Potier,5/13/2024,667757.88,Hard-shell case for protecting sunglasses.
853,3529078042325169,Haven Upston,4/20/2025,341322.3,A hearty soup made with organic lentils and vegetables.
854,3528123353130948,Yale Rastall,11/12/2024,264386.32,"Spicy black bean burgers, great on the grill."
855,370646616835759,Pammy Lansbury,12/31/2024,603360.77,Frozen vegetable primavera for quick meals.
856,372301862866441,Olimpia Beauly,1/24/2025,882806.51,Passive noise reduction headphones for focus.
857,372301223034010,Rudolph Brozek,1/8/2025,659644.54,"Tangy green salsa made with tomatillos, perfect for tacos."
858,4911364769515594,Irita Jellico,6/14/2024,824868.88,Durable training soccer ball for practice.
859,5048377552181948,Christophorus Blades,1/29/2025,450414.78,Chewy bars made with peanut butter and chocolate chips.
860,6304562841323404,Zabrina Marchand,9/20/2024,75636.44,Lightweight and portable chair for camping or events.
861,3539628344722113,Gabriela Kamen,8/22/2024,922413.09,Fun lunchbox for kids with a sturdy design.
862,3539062685368874,Pippa Avison,4/2/2025,276193.62,Rechargeable electric razor for a smooth shave.
863,3535723752204516,Cecilla Pietrowicz,5/21/2024,641734.33,Fresh mango salsa with a hint of lime for a zesty topping.
864,4405940743172587,Urson Snailham,8/19/2024,614157.71,Rechargeable LED camping lantern for outdoor use.
865,30348488432961,Nolan Di Angelo,10/2/2024,107989.01,Durable tablet designed for kids with parental controls.
866,3531492340257766,Selig Markel,5/15/2024,168638.83,Savory sausage links with a hint of maple flavor.
867,5514124229281338,Tyson Dunbobin,3/8/2025,113485.66,Savory teriyaki sauce for stir-frying veggies or meats.
868,3548195572989979,Byram Losemann,11/24/2024,592436.74,"Creamy yogurt made from almond milk, vegan-friendly."
869,3562299850446222,Carolynn Hearnshaw,10/11/2024,200407.16,Foldable chair equipped with a cooler pouch.
870,30444814341172,Rolando Saull,7/23/2024,433354.81,Cozy throw blanket perfect for adding warmth to your home.
871,4041374409689769,Trixy Dalliwater,5/2/2025,820753.64,"Complete kit with crayons, markers, and paper for young artists."
872,6375123039353234,Lev Collingridge,6/24/2024,362792.73,Adjustable LED desk light with brightness settings.
873,3584463844173680,Verene Waghorn,5/12/2024,221744.6,Adjustable dog collar with personalized tags.
874,4017950143639812,Gae Lodge,3/8/2025,808209.18,"A zesty salsa made with peaches and mangos, great for chips."
875,0604088947560677508,Kare Coursor,6/26/2024,966598.7,"Creamy yogurt made from almond milk, vegan-friendly."
876,3558606715890764,Abram Monnoyer,10/5/2024,565947.92,Wearable device to track fitness activities and heart rate.
877,560224734290808010,Sheri Skitteral,4/13/2025,395902.82,Set of soothing scented candles for relaxation and ambiance.
878,3543820933369943,Emmalee Noah,7/14/2024,692852.67,"Sweet and salty popcorn with sea salt and caramel, a tasty treat."
879,5100171274184461,Sawyere Dieton,12/17/2024,244625.05,Convenient and low-carb alternative to traditional rice.
880,5562587458761066,Jodi Gateley,9/4/2024,192562.96,Custom engraved ID tags for pets with your contact information.
881,4844290422508399,Constantia McCart,12/14/2024,189309.19,High-quality headphones that block out external noise for immersive listening.
882,3567348135765362,Rhea O'Brogane,2/1/2025,59292.43,Creamy mayonnaise made with avocado oil for a healthier twist.
883,3558195777307388,Milka Wychard,7/27/2024,568315.67,Durable 50-foot garden hose with nozzle.
884,5100172450349878,Phillie Kevern,1/14/2025,244374.07,Hearty minestrone soup loaded with vegetables and pasta.
885,3577587369742757,Maryann Fray,7/12/2024,566794.77,Classic leather photo album for keepsakes.
886,3555436328525877,Delcina Le Floch,10/9/2024,199386.68,Healthier way to make popcorn in the microwave without oil.
887,4175003890260156,Ofelia O'Hdirscoll,1/20/2025,612608.94,Delicious mini donuts dusted with cinnamon sugar.
888,6304812066555317,Joli Baglan,4/16/2025,234260.25,Adjustable grinders for fresh spices at the table.
889,3573930450012686,Isis Wasselin,1/8/2025,903335.37,Crisp and delicious organic apples.
890,201529227391633,Stephanus Tiery,9/22/2024,325253.99,Durable high-top leather boots for the stylish adventurer.
891,491163998959155218,Gallard Oughton,6/13/2024,281821.35,Comfortable headset with surround sound for immersive gaming.
892,50389527678698083,Emogene Trymme,3/8/2025,172631.2,Set of soothing scented candles for relaxation and ambiance.
893,3528600960773426,David Crow,7/12/2024,311423.84,Small fridge designed to keep skincare products cool and fresh.
894,3529381111364832,Cyb Lipgens,8/31/2024,562854.45,"Spicy jalapenos stuffed with cheese, ideal for appetizers."
895,5535881229650367,Rowan O'Donohue,7/6/2024,307754.39,Compact Bluetooth speaker with rich sound quality.
896,5007663723541022,Nana Fairbourne,12/15/2024,670626.29,Eco-friendly phone case designed to decompose safely.
897,5602236058139024,John Bedberry,3/24/2025,263475.46,"Freshly cut carrot sticks, perfect for snacking."
898,3535801431286250,Niven Donaghie,1/15/2025,313933.09,Personalized wooden puzzles for children that encourage learning.
899,3529131247395865,Tatiania Bitchener,12/24/2024,484542.28,"Refreshing coconut water, perfect for hydration."
900,4041374835312,Bev Mattersey,2/18/2025,869336.5,Fresh and crunchy baby carrots ready for snacking.
901,6767389026264116231,Joscelin Bengefield,1/4/2025,106537.15,Durable jump rope for cardio workouts.
902,3554346685159122,Allys Syversen,3/24/2025,879761.35,Wearable device to track fitness activities and heart rate.
903,343735513013497,Bevan Prettejohns,5/3/2025,183712.26,Compact charcoal grill perfect for tailgating.
904,3583180894825768,Derek Sinney,9/2/2024,270062.2,Airtight container to keep pet food fresh.
905,6390916889064814,Theodor Spight,8/17/2024,834853.0,Tempered glass screen protector for smartphones.
906,30252992953118,Gretal Ostler,5/7/2025,853403.2,Durable journal for nature observations and notes.
907,5007667366053039,Willi Crebo,2/6/2025,819498.15,"Crispy baked falafel balls, perfect for salads"
908,5602225331941204014,Holly Janosevic,3/29/2025,992201.76,Cozy throw blanket perfect for chilly evenings.
909,3554244521562221,Alfons Tenbrug,11/22/2024,518488.67,Tender ribs smothered in a honey barbecue sauce.
910,3586845132973391,Joella Tapsell,3/17/2025,190550.88,A cozy long cardigan designed for layering in any season.
911,0604296483799927306,Lemmie Messruther,10/31/2024,398997.24,Durable scoop for perfectly shaped ice cream servings.
912,3566279935828418,Katinka Ivins,8/4/2024,921175.55,Stylish bookends to keep books organized on shelves.
913,493666082584084586,Nikita Kleingrub,3/15/2025,455649.39,"A complete meal kit containing breaded chicken breast, marinara sauce, and pasta, perfect for a quick dinner."
914,3587969317673409,Heddi de Tocqueville,8/2/2024,981437.95,Polarized sunglasses with UV protection.
915,30564424608890,Anna-diana O'Geaney,11/16/2024,913154.23,A delicious tart filled with fresh raspberry filling.
916,3534842711294268,Damaris Della Scala,2/3/2025,958711.08,Crunchy and flavorful mix of oats and honey.
917,201758495555518,Kinsley MacCambridge,12/25/2024,816449.09,Natural energy bites packed with fruits and nuts for a perfect snack.
918,630414432553553305,Billie Gavaghan,6/2/2024,472870.16,No-bake energy bites made with peanut butter and oats.
919,3563922892695022,Eveline Prattin,6/4/2024,247129.44,Sweet and tangy honey mustard dip for snacks.
920,36790824781797,Doll Ovize,10/31/2024,504717.5,Convenient feeder that adjusts to your pet's height.
921,378987093521724,Heinrik Goodley,6/30/2024,424480.78,Comfortable hiking boots for outdoor adventures.
922,3578378945012470,Vergil Lobell,8/2/2024,841937.23,"A delicious creamy dip featuring spinach and artichokes, perfect for parties."
923,490527309066022585,Gare Lello,11/5/2024,787693.32,Stackable containers for organizing snacks and treats.
924,6706202111379133,Elissa Margerison,12/26/2024,976780.15,"Healthy whole grain cereal, great for breakfast."
925,3560776480766345,Winny Nears,5/20/2024,658923.91,Automatically cooks eggs to your desired level.
926,56022126660752865,Torin Wileman,11/10/2024,351768.41,"Hearty stew made with lentils and mixed vegetables, vegan-friendly."
927,3536177593144796,Torrey Southgate,3/9/2025,561823.1,Rechargeable screwdriver with multiple bits for DIY projects.
928,5418788980770395,Harriott Cabel,1/19/2025,209599.28,Personalized wooden puzzles for children that encourage learning.
