id,nomor_rekening,nama_lengkap,tanggal_transaksi,jumlah_kredit,keterangan
463,3547719665719471,Shayne Lardner,10/30/2024,364073.87,Sharp tailored blazer perfect for office wear and professional events.
464,374622303255730,Miner Thorneloe,5/21/2024,641153.34,"A mix of strawberries, blueberries, and raspberries."
465,3540580440825067,Keane Book,12/16/2024,290341.19,"Pure and natural honey, great for sweetening."
466,3578542643073965,Scotti Roz,2/8/2025,411472.05,Complete set to brew coffee with different methods.
467,3543085648251550,Prentiss Bridge,5/16/2024,733475.92,"Nutty flavored lentils, perfect for soups and salads."
468,3581680148956741,Ugo Dillicate,2/27/2025,351796.83,Delicious muffins filled with apples and a hint of cinnamon for breakfast.
469,5602221812087958,Malena Hazeltine,11/13/2024,426994.79,Foldable reclining camping chair with cup holder.
470,5602253681575490,Carmelita Swindell,4/21/2025,271101.74,Tender chicken coated in a sweet and savory honey garlic sauce.
471,374622123777871,Gregory Filippucci,10/18/2024,734212.79,"Chickpeas served with olives, feta, and hummus, a healthy meal."
472,5500816450399459,Shalne Creagh,5/28/2024,349166.73,"Continuous stream of fresh water for pets, promoting hydration."
473,6333325871511883,Goldina Damerell,7/12/2024,726451.19,"Creamy yogurt made with coconut and cashews, dairy-free."
474,3530557912022946,Bonnee Stickel,6/20/2024,287210.42,"Crunchy, toasted coconut chips for snacking."
475,3538408520787854,Ebony Mercy,9/8/2024,49605.39,A mix of tropical fruits for a refreshing snack or dessert.
476,6763043852771561,Jany Hannaby,3/7/2025,360389.22,"Essential cotton tank top, perfect for layering."
477,5100136979329901,Andromache Henriques,3/30/2025,891377.53,Breathable linen trousers perfect for hot weather.
478,3534673700102232,Kerrill Ayrton,7/20/2024,713591.62,"Baked kale chips seasoned for a healthy, crunchy snack."
479,3583320864846721,Morie Newick,12/1/2024,121539.3,"Creamy and rich vanilla ice cream, a classic dessert."
480,564182076581762841,Bourke Blomefield,6/3/2024,289691.74,Handheld sprayer designed for washing pets easily.
481,3571844953461799,Nichol Hefferon,11/11/2024,922959.64,Video baby monitor with night vision.
482,5100137858583691,Roseanne Brambley,3/5/2025,72106.4,Clear feeder that attaches to windows for bird watching.
483,5602226225357153,Griz Yakovliv,1/8/2025,357807.32,Cozy oversized sweater perfect for chilly days with a textured knit design.
484,3558171159390144,Britta Flannery,7/27/2024,839102.79,"Chilled noodles dressed in sesame sauce, ready to eat."
485,3583962754726008,Deerdre MacCague,10/3/2024,534911.71,Eco-friendly bamboo cutting board for food prep.
486,372301413777915,Bonnibelle Linwood,12/23/2024,920122.68,"Fresh and tart organic green apples, great for snacking or baking."
487,5048375978474251,Agretha Plenty,11/7/2024,382044.88,Refreshing sparkling water with lemon and lime flavor
488,3586641309573969,Carmina Lightbody,11/1/2024,314379.54,Natural honey sourced from wildflowers.
489,337941954651724,Dian Skerman,11/19/2024,202762.51,Non-stick and heat-resistant utensils for cooking.
490,3587727472357014,Drucill Gentsch,9/9/2024,922733.5,Compact blender that comes with travel cups for smoothies.
491,5349928601887962,Arther Mendes,5/22/2024,894584.75,Complete set for mixing cocktails at home.
492,374288432884343,Justen Muscat,7/27/2024,638471.72,"Crunchy chips made from blue corn, perfect for dipping."
493,3584613464924289,Tiphani McIlwrick,2/16/2025,806097.77,"Essential cotton tank top, perfect for layering."
494,3555130185941455,Leeanne Biskup,10/8/2024,370210.58,"A hearty salad with lentils, veggies, and curry dressing."
495,3561008290757101,Innis Tapper,1/19/2025,773301.29,Wi-Fi enabled doorbell with HD camera and two-way audio.
496,3565903410008821,Rolfe Stive,1/21/2025,297788.83,Practical organizer for keeping your home tidy and clutter-free.
497,5010124520497459,Vaughan Mars,4/9/2025,218137.51,Heavy-duty scissors for crafting and office use.
498,3562824714812382,Benedikt Monument,9/23/2024,118293.92,Comfortable pet carrier for travel and vet visits.
499,3566903479196029,Courtney Islep,7/15/2024,898932.02,Compact coffee grinder for fresh ground coffee beans.
500,3551557586891851,Kiley MacDowall,7/30/2024,462088.83,Wi-Fi enabled plug for controlling devices from your smartphone.
501,6304111975422671,Pearle Ciccone,1/12/2025,115490.27,Fresh greens and veggies for a quick Asian-inspired salad.
502,5602214769229038,Kylynn McGill,2/21/2025,513918.38,Rapid boil electric kettle with temperature control.
503,3564239299948998,Bourke Simunek,10/24/2024,629716.81,Fun and colorful gardening tools designed for children.
504,3557548999030199,Tammi Selway,9/23/2024,948520.69,Fun tourist magnets from around the world for your fridge.
505,6395727856761760,Lauri Fulks,5/30/2024,46540.88,"Nutty, crunchy pecans great for baking."
506,561062154477492087,Roarke Walasik,7/28/2024,642794.24,Versatile multi-cooker for pressure cooking and slow cooking.
507,4911413215798005,Zsazsa Moralas,11/1/2024,835125.17,Spreadable cream cheese blended with garlic and herbs.
508,3541051715495464,Odetta St Ledger,6/18/2024,573150.56,Essential kit for taking care of your pets' health emergencies.
509,67092141169337714,Fiorenze Clemenzi,3/30/2025,309619.49,Crispy pastry filled with seasoned vegetables.
510,6706398460115043,Tobin Ashpital,9/9/2024,704558.36,UV light sanitizer for phones and small items.
511,5473462974965948,Gratiana Aksell,5/3/2025,830592.11,Fresh sliced bell peppers for salads or stir-fries.
512,201572082079414,Guenevere Jeffcoat,8/13/2024,102241.7,"Creamy and rich vanilla ice cream, a classic dessert."
513,3583340995358677,Adler Keyte,4/20/2025,407802.33,Eco-friendly bamboo cutting board for food prep.
514,3570132261767920,Hershel Otson,11/14/2024,401579.6,Stylish scarves to accessorize any outfit.
515,3569650366540580,Falito Bunker,11/13/2024,606634.54,Delicious dark chocolate cups filled with creamy peanut butter.
516,5010129917942991,Roch Malan,9/28/2024,320622.07,A refreshing sparkling beverage with a bold blood orange flavor.
517,3583865237202358,Carlye Dennert,5/19/2024,874139.1,Lentils cooked in a coconut curry for a hearty meal.
518,5602231328908066529,Benedick Ludovico,9/7/2024,222180.52,Crispy almonds coated with cinnamon and sugar for a sweet and crunchy snack.
519,4917641519552660,Taffy Turbat,8/13/2024,102590.08,"Canned diced tomatoes, great base for sauces and soups."
520,6759612223900780,Locke Shippard,6/16/2024,825795.36,Healthy granola made with oats and honey.
521,3542405917997462,Modesty Haslam,7/18/2024,729585.75,Laundry bags perfect for delicates and organizing clothes.
522,3587473915658359,Maegan Justham,2/11/2025,956912.29,Convenient hooks that utilize door space for hanging items.
523,5404878759402340,Codi Tace,1/31/2025,481344.36,Crunchy granola full of peanut butter flavor and oats.
524,3540923794615405,Karoline Thome,11/20/2024,9524.1,Eco-friendly LED lights for festive decorations.
525,5602214277890941,Alexander Desesquelle,12/2/2024,680557.66,Double-sided art easel for painting and drawing.
526,3542178257860349,Bale Attrie,1/18/2025,622469.73,Sweet corn roasted to perfection for a delightful side.
527,3582505589678968,Joey Prydden,1/15/2025,273400.14,Portable coffee maker for rich brews on the go.
528,3567951963474492,Winnie Arthurs,9/1/2024,273296.63,Professional sharpening system for kitchen knives.
529,560223846857349401,Lawton Hudd,12/17/2024,899705.12,A delightful mix of dried fruits for trail mix or snacks.
530,3574137167581941,Costa Vittore,6/7/2024,525556.18,High-quality cutlery set for daily use or special occasions.
531,4917977434651165,Cammie Gairdner,11/25/2024,3781.14,Fun gardening tools designed specifically for kids.
532,3560515111110907,Jordan Ramel,6/14/2024,156490.29,Frozen mini meatballs that are great as a snack or in pasta dishes.
533,3534381563535239,Matelda Matchitt,12/3/2024,199273.74,Inspiring cookbook with healthy recipes.
534,5100142232161107,Abigael Brownfield,12/23/2024,661507.99,Frozen vegetable primavera for quick meals.
535,3580271767857609,Cammy Pesselt,3/9/2025,92031.98,"Trendy high-low tee with a relaxed fit, ideal for weekends."
536,3584486307744044,Alisha Palia,12/19/2024,583667.43,Rechargeable LED lantern ideal for camping and outdoor activities.
537,3554896168570229,Daffi Fincher,3/18/2025,431189.95,Compact waffle maker for perfect small waffles.
538,6395788195337167,Rorke Cunio,8/18/2024,719748.43,Soft comforter set for a cozy bedroom look.
539,3553663529009433,Emmy Jacquemot,2/19/2025,96716.9,"A tangy marinade for meats and veggies, packed with garlic flavor."
540,3569177952788803,Dalston Scarce,3/28/2025,692800.29,Unsweetened coconut flakes for baking and snacking.
541,5278418261224768,Angelina Rolling,3/16/2025,774556.64,Affordable fitness tracker with heart rate monitor.
542,3548232885261489,Anallese Hance,2/4/2025,705705.61,Reusable tote bags for shopping and eco-friendly living.
543,30424880975509,Wald Haye,7/25/2024,591891.52,Silicone tea infuser for brewing loose leaf tea.
544,3575933791164313,Clarine Feighney,8/25/2024,837120.35,Set of whisks in various sizes for cooking.
545,5893574028147696785,Giulietta Ryman,1/10/2025,154031.1,Nutritious snack bar made with almond butter and protein.
546,4911633595629802925,Holly Fennelow,1/24/2025,378344.97,A blend of dried herbs commonly used in Italian cooking.
547,3557921494386533,Inglis Lisle,9/27/2024,887210.79,"Frozen pizza rolls filled with vegetables and cheese, perfect for snacks."
548,3582093933243235,Isacco Winkle,12/27/2024,339654.72,Set of two yoga blocks for increased stability and support.
549,3589749463138565,Caterina Eringey,10/25/2024,473085.46,Manual pasta maker for creating fresh pasta at home.
550,3558159374970170,Erhart Bontein,10/22/2024,568117.33,Everything you need to make your own candles.
551,560223953938119165,Brewer Goodayle,7/28/2024,63055.32,"Creamy, sweet pie mix to make the perfect coconut cream pie."
552,3585454352779850,Rosco Husthwaite,10/24/2024,245533.25,Eco-friendly phone case designed to decompose safely.
553,5602230840838266,Flem Brusin,8/2/2024,763387.57,"Healthy salad made with chickpeas, vegetables, and a lemon dressing."
554,3549254626461573,Joycelin Lawrance,4/7/2025,659111.95,"Classic marinara sauce for pasta, pizza, or dipping."
555,30491964053552,Ferdinand Alberti,2/22/2025,554378.41,Trendy belt bag for hands-free carrying.
556,5002353359503448,Correy Iacovelli,8/14/2024,402057.78,"Rich and creamy dressing with garlic flavor, perfect for salads."
557,5394466636536126,Barth Natte,10/21/2024,752123.09,Bluetooth speakers with excellent sound quality.
558,4936169485630283,Jeremiah Birt,5/15/2024,687697.51,Chewy granola bars with maple and cinnamon flavor.
559,6382483877935075,Irena Luchelli,6/22/2024,540421.51,Travel-friendly dog bowl that is collapsible for easy storage.
560,3578658533101409,Horst Depper,4/18/2025,623233.15,DIY projector that magnifies your smartphone screen for movie nights.
561,3585435003184236,Felipa Billany,11/4/2024,676925.64,Healthy energy bites made with oats and natural sweeteners.
562,3582275213786096,Lloyd Tregust,5/29/2024,875733.68,Eco-friendly bags for picking up after your pet.
563,5475875152759197,Ronnie Goodge,7/24/2024,740277.04,Pancake mix infused with seasonal pumpkin spice flavor.
564,5573974002518688,Teddie Lantaph,8/15/2024,351031.42,Creamy Greek yogurt packed with protein and probiotics.
565,3535086105376419,Goldie Cassely,4/22/2025,314012.19,Crispy cauliflower bites tossed in spicy buffalo sauce.
566,6767283493377223253,Emilia Traske,5/8/2025,598496.29,Automated cleaning robot for hassle-free home maintenance.
567,201887634255308,Wat Lightollers,10/18/2024,768427.57,Powerful hand blender for soups and smoothies.
568,3550763396119134,Brendin Lafflin,5/6/2025,9642.1,Durable tablet designed for kids with parental controls.
569,5444168866217134,Giraldo De Domenico,9/9/2024,717279.86,"Organic rolled oats, great for breakfast or baking."
570,3572906727473241,Dolores Sunner,11/16/2024,25873.14,Organize your board games with this storage bin.
571,201668440218684,Everett Szimon,5/10/2025,221342.48,"Fluffy and delicious pancake mix, perfect for a gluten-free breakfast."
572,5178753573118006,Hugues Simunek,10/22/2024,763818.55,Easy-to-install lights to brighten kitchen cabinets and workspaces.
573,3577056940275323,Marcellina Lanigan,12/11/2024,49162.18,Compact alarm for personal safety and security.
574,3577768033979864,Luciano Burdett,9/25/2024,433594.88,Compact yoga mat that folds for easy storage and transport.
575,3566464413061571,Issy Darwent,2/21/2025,426977.63,Eco-friendly charger that uses solar energy for powering devices.
576,5602220467655978,Darell Stickford,7/3/2024,327464.17,"Fresh and zesty salsa, perfect for nachos."
577,5520262066368958,Rey Evesque,3/5/2025,351578.56,Large stir fry pan with non-stick surface.
578,4508846440529613,Danni Freckleton,2/18/2025,783383.22,Activity workbook for early learning and fun.
579,5610753548407142,Darwin Perello,3/4/2025,897359.77,Wi-Fi enabled thermostat that learns your habits.
580,3584571062237134,Hewitt Lindfors,10/18/2024,564731.93,A blend of dried herbs commonly used in Italian cooking.
581,5602254721084865,Inglis Burress,10/25/2024,424331.03,Compostable plates suitable for various occasions.
582,5007662434313762,Glyn Adrain,12/21/2024,773528.68,"High in protein, perfect for soups and stews."
583,6709259802850130326,Eyde Briztman,4/11/2025,157225.61,Challenging 1000-piece jigsaw puzzle for all ages.
584,56022268985666394,Denys Hobble,7/1/2024,387746.64,Assorted fruit-flavored gummy snacks that kids love.
585,3577028629744085,Pia Scutcheon,6/16/2024,544764.78,Durable scoop for perfectly shaped ice cream servings.
586,3583735518023932,Nickolai Oliphard,9/4/2024,164481.99,Whole grain oats that are perfect for breakfast or baking.
587,372364935519652,Gino Astley,1/4/2025,881271.6,A mix to create a delicious onion dip for parties or snacking.
588,4508152298842467,Ashlin Ible,7/3/2024,756596.27,A seasoning blend of garlic and herbs to enhance any dish.
589,5602241438764145,Yolanda Gaze,10/27/2024,953470.05,Quick-cooking ramen for instant meals.
590,5100131583524930,Elia Gai,5/29/2024,918061.0,A seasoning blend of garlic and herbs to enhance any dish.
591,50182596936141110,Geoff Moraleda,2/28/2025,150333.0,"Frozen berries blend perfect for smoothies, just add yogurt."
592,5108757722234916,Barbabas Bigley,11/1/2024,826056.07,"Customizable RGB LED light strip, perfect for mood lighting."
593,3542897978196432,Ashley Versey,11/7/2024,202682.91,A tangy sauce that combines lemon zest and basil for a refreshing flavor.
594,3536945750937644,Ardith Wisdom,4/27/2025,353233.42,Spacious duffle bag for weekend getaways.
595,201668080187876,Blinnie Yewdall,8/12/2024,975078.78,Durable boots designed for outdoor hiking and activities.
596,5002350393381971,Roana Coales,2/7/2025,723673.87,All-in-one art set for kids to unleash creativity.
597,3564708512995622,Vonny Chitson,6/28/2024,45585.66,Non-slip yoga mat for optimal grip and comfort.
598,3578694976571816,Masha Stringman,6/21/2024,788415.48,Durable baking sheet coated for easy food release.
599,3542387935707026,Nollie Sherland,11/22/2024,201389.71,High-quality voice recorder for lectures and meetings.
600,4844031992070471,Wallie Cookes,6/17/2024,883961.7,"A variety pack of classic, roasted red pepper, and garlic hummus."
601,372301841100714,Cyrille Senescall,7/16/2024,175806.02,"Creamy mayonnaise, perfect for salads and sandwiches."
602,3578424387855180,Ebonee Presnail,5/10/2025,976977.29,Rechargeable training collar for effective behavior training.
603,4903148828758329278,Hugo Gilchriest,5/22/2024,24768.59,Tripod with wireless remote for effortless photo-taking.
604,5602240734907093,Shellie Simonin,10/15/2024,939282.65,Complete kit for starting your own organic garden.
605,3586487785957742,Dwain Champ,11/28/2024,525827.37,Craft your own lip balms with this complete kit.
606,3561227147621316,Arlina Bushel,12/5/2024,329937.53,Adjustable tripod for smartphones and cameras.
607,3532897756794509,Leonidas M'Chirrie,8/29/2024,736731.47,Compact blender that comes with travel cups for smoothies.
608,060438478000651558,Woodie Bowker,5/27/2024,980564.6,"Wild-caught tuna in olive oil, perfect for salads."
609,3549523288473377,Way Rollitt,8/23/2024,490773.42,"Assorted herbal teas, perfect for a warm and relaxing drink."
610,5602246507456796,Tore Kulicke,12/12/2024,114755.93,Non-stick utensils for safe and easy cooking.
611,3588077806078590,Imojean Lidgerton,7/7/2024,874912.12,Electric foot massager for relaxation and relief.
612,5602254136327855899,Lucina Burdin,5/6/2025,496774.44,Chocolate coconut protein bars inspired by the classic candy bar.
613,5100148479478104,Ora Sheldrick,11/27/2024,937181.05,Fresh and crunchy baby carrots ready for snacking.
614,3574759040095177,Isidro Fay,9/24/2024,786452.0,Crunchy granola with chocolate and hazelnuts for breakfast.
615,560223137627719689,Glynn Reinhardt,12/13/2024,150411.75,"A whole free-range chicken, ready for roasting."
616,3543673250006626,Lenka Skepper,9/15/2024,335758.56,A mix of brined Mediterranean olives for snacking.
617,67627955441821193,Anette Egdal,11/18/2024,105863.95,Creamy yogurt made with coconut milk
618,201880395140116,Davidde Goodchild,11/23/2024,477459.49,"Crunchy, seasoned chickpeas for a wholesome snack."
619,5602233076654407,Niven Crotch,12/8/2024,57990.73,Complete cleaning kit for camera lenses.
620,4844998012987571,Petronille Rathborne,4/1/2025,37451.92,Complete crafting kit for kids and adults.
621,5388566791476980,Kerrill Benoiton,11/5/2024,132012.24,Rechargeable massage gun for relieving muscle soreness.
622,5602255054707204,Teodoor Achromov,8/22/2024,687973.97,Set of three aromatic candles with various scents.
623,6762056760116274,Alisa Van Merwe,8/17/2024,147901.53,"A rich marinade perfect for meats and vegetables, infused with Italian herbs and balsamic vinegar."
624,3528151809606880,Constancia Brackenridge,9/20/2024,787989.81,Lightweight fishing rod suitable for beginners.
625,3533119487762146,Niels Ironmonger,4/27/2025,575009.13,Crispy and crunchy snack made from assorted vegetables.
626,30306727069358,Jarrad Croft,10/23/2024,667860.85,Fresh organic cucumber perfect for salads or snacking.
627,503871063507657697,Sinclair Duce,3/10/2025,459018.52,Silicone oven mitts designed for safe cooking and baking.
628,50186444470156481,Susann Jansson,7/12/2024,415897.72,Sweet and nutty filling for delicious homemade pecan pie.
629,6304869108704600,Flynn Dadley,12/15/2024,729390.01,Eco-friendly LED lights for festive decorations.
630,3556266095536099,Trent McDoual,3/12/2025,552296.24,Protects car interior from sun damage and heat.
631,30187253963929,Celestyna Goullee,4/15/2025,895864.34,Tangy vinaigrette with orange and ginger flavors.
632,5100175033992007,Granger Duckerin,7/27/2024,271057.17,Popcorn tossed with sweet or savory flavors for a tasty snack.
633,201546551120644,Robby Golby,6/9/2024,46367.07,Instant oatmeal flavored with cranberries and orange zest for breakfast.
634,3531596130826067,Roxi Sartain,6/20/2024,741937.29,"Soft flannel shirt with a timeless plaid pattern, perfect for layering."
635,3575280812724091,Charissa Izakoff,9/9/2024,325506.15,All-natural skincare set for daily use.
636,4917440902471350,Saw Boolsen,6/21/2024,357763.95,Quick-boiling kettle for home and office use.
637,4041376939940810,Germaine Lonnon,3/13/2025,865410.53,A cozy cable knit beanie to keep your head warm in winter.
638,3578473681951229,Nobie Ickov,10/15/2024,543304.57,Effective roller for removing pet hair from furniture.
639,3586239584539001,Addy Delyth,5/18/2024,457813.21,Charming frame to showcase your favorite photos.
640,5002353808871438,Phaidra Chetwin,7/2/2024,75709.24,"Easy-to-prepare rice with cilantro and lime flavors, great as a side."
641,5893645907408364,Jere Floyd,12/23/2024,290105.9,"Fresh thyme, perfect for seasoning dishes."
642,5038001372250240907,Ash Dixon,4/12/2025,742523.92,Roasted almonds dipped in rich dark chocolate.
643,3554932493473092,Laural Smylie,2/5/2025,317358.45,Wearable diffuser for scenting your space and body.
644,3568385493035755,Domenico Bunce,9/8/2024,811116.44,Creamy yogurt blended with fresh pineapple and coconut pieces.
645,30545537189977,Dru Osbidston,3/2/2025,968838.84,"Artisan bread topped with olives, feta, and herbs, perfect for sharing."
646,5540718629114268,Rowena Piris,4/8/2025,599556.55,"Water-resistant jacket ideal for outdoor activities, featuring a packable design."
647,6331109160519605,Alec Baskerville,9/29/2024,815261.49,A stunning lace dress perfect for special occasions.
648,56105423689930741,Sibel Rottenbury,2/20/2025,54606.84,Quick oatmeal with various flavors
649,6761252690247567,Karlis Brundall,4/13/2025,699437.72,DIY LED strip lights with remote control.
650,3571878471693194,Marlie Bryceson,4/8/2025,225611.63,Fun fridge magnets to decorate your kitchen.
651,5100170886611440,Delphine Joslin,12/18/2024,226511.42,"Wild-caught salmon filets, perfect for grilling or baking."
652,5108753567418581,Celesta Ratnage,6/30/2024,732866.94,Indoor Wi-Fi camera for home security.
653,3530620143360145,Ardis Dripp,9/16/2024,389337.94,"A smoky barbecue sauce, ideal for grilling and dipping."
654,5602255540810471,Dael Kedge,10/10/2024,411717.06,"Smoothie mix combining peanut butter and banana, great for a quick breakfast."
655,5602228080750225,Randal Golsby,3/16/2025,633190.83,Mix to create a delicious chia seed pudding in just a few minutes.
656,5304584151026627,Ilario McGray,4/18/2025,149.11,Elegant glass decanter for aerating wine.
657,4175001640394572,Rafaellle Corneille,5/4/2025,922628.04,Wearable device to track fitness activities and heart rate.
658,5602238499487537280,Renell Kohlerman,6/8/2024,343758.76,A creamy and tangy dressing perfect for salads or as a dipping sauce.
659,3557762561078110,Bari Temporal,9/12/2024,562636.07,A rich curry paste for making authentic Thai green curry at home.
660,3577155633616940,Tiebold Lympany,5/31/2024,963144.85,Compact travel organizer for accessories and toiletries.
661,372301071913620,Aube Lechmere,2/28/2025,700285.87,Personalize your calendar with photos and special dates.
662,3528151153723307,Randi Wennam,5/9/2025,260753.92,Cook rice and steam vegetables simultaneously for healthy meals.
663,5197260849688157,Karrie Huffa,9/2/2024,816970.04,"A fresh, flavorful basil pesto for pasta and more"
664,3544930884729026,Tobe Slaymaker,3/10/2025,85624.08,Savory sausage links seasoned with Italian spices.
665,376473787551600,Julius Measor,5/23/2024,469099.55,"Expandable caddy for holding books, phones, and snacks while in the bath."
666,3585888657036377,Sabine Shilito,6/25/2024,754758.17,Classic chicken noodle soup with tender chicken and vegetables.
667,3544192871622587,Hamel Pover,9/3/2024,778345.75,Delicious noodles tossed in a sesamegarlic sauce.
668,5594362642215367,Isaac Toffoloni,4/7/2025,169418.29,Stylish tote to keep wine bottles chilled while traveling.
669,3586042576310773,Richart Rattenbury,1/11/2025,71632.65,Rich basil pesto sauce for pasta and more.
670,201935221714516,Demetris Yewdall,3/21/2025,188708.88,Ergonomically designed pillow with breathable bamboo cover.
671,3581568336780652,Eliot Grolmann,10/6/2024,691026.56,Easy-to-use tiebacks for curtains or drapes.
672,201653108234223,Chet Lanahan,3/11/2025,760055.91,Stainless steel measuring spoons set for cooking.
673,3533485456209173,Gale Elverston,5/12/2024,300605.86,"Frozen falafel balls made from chickpeas and herbs, perfect for quick meals or salads."
674,3568136506577055,Lenci Kleiner,5/10/2025,438382.58,Cordless electric screwdriver for home projects.
675,3569624275086142,Hale Nower,12/25/2024,696626.89,"Crispy mini pretzels, a great snack any time of day."
676,3546060183729333,Damaris Treble,10/9/2024,661007.34,Crunchy granola clusters mixed with nuts and honey.
677,201542174518991,Jojo Tsarovic,7/3/2024,793002.26,Convenient stroller for pets to enjoy outdoor walks.
678,58937622784854256,Jania Chastanet,5/10/2025,870315.98,"Unsweetened apple sauce, great for snacks or baking."
679,3546066626966952,Klara Morena,4/23/2025,532639.4,"Smooth and creamy, ideal for spreads or baking."
680,3552480489846261,Bette-ann Playle,9/25/2024,198367.02,Storage solutions for keeping your car tidy and organized.
681,337941182516921,Ailsun Kittless,2/16/2025,811596.65,Foldable mat for jigsaw puzzle assembly.
682,67591614237379328,Silvia Handy,3/2/2025,19013.86,Lightweight and moisture-wicking racerback tank for workouts.
683,3529615249532731,Cathlene Feben,9/21/2024,290614.38,Complete meal kit with everything needed to make beef stroganoff in under 30 minutes.
684,6763118759235610299,Rosalia Lynas,12/24/2024,766299.04,Yoga socks designed to provide better grip and stability.
685,3532906084697530,Jolynn Saphin,5/31/2024,98958.96,"Supportive sports bra designed for high-impact workouts, made with moisture-wicking fabric."
686,3545720139949126,Arnoldo London,7/22/2024,22737.87,Battery-operated air purifier for small spaces.
687,375922442260396,Gabriellia Bysouth,9/6/2024,224463.7,Creative building set for kids to spark imagination.
688,3573253631850092,Deeanne Garraway,10/20/2024,157153.97,"A mix of fresh vegetables with a savory stir-fry sauce, ready to cook."
689,5602234855722202770,Vallie Braker,1/19/2025,337901.68,Comprehensive emergency kit for roadside assistance.
690,3586571514260930,Lilyan Pashenkov,1/21/2025,768875.88,Non-stick and reusable mats for easy baking.
691,560224794462960932,Katine Kenion,8/18/2024,540617.37,"A mix of grilled vegetables, ready to heat for quick side dishes."
692,3544906501116334,May Hooban,10/7/2024,945449.63,"Fresh seedless red grapes, perfect for snacking."
693,3572544428457922,Rab Goldsberry,9/4/2024,646899.22,"Heavy-duty rope suitable for boating, camping, and general use."
