id,nomor_rekening,nama_lengkap,tanggal_transaksi,jumlah_kredit,keterangan
232,3580560433024598,Ansel Squier,2/7/2025,138621.62,Sanitary holder that ensures your toothbrush stays clean.
233,4917047186595232,Zebadiah Rookwell,12/11/2024,265330.91,Elegant chiffon blouse perfect for work or outings.
234,3570247420924400,Solomon Leigh,12/8/2024,109172.42,"A whole free-range chicken, ready for roasting."
235,3560831825634813,Kala Lory,5/24/2024,400007.13,Programmable pet feeder for scheduled meals.
236,4905738313931332,Verla Sanzio,4/23/2025,775316.23,A nourishing bowl of sweet potatoes and chickpeas with spices.
237,5486032523503469,Whitby Napolitano,7/10/2024,889085.25,Crunchy granola made with organic oats
238,3556076796198291,Vivie Bonsul,4/4/2025,488682.15,A hearty vegetable curry for a quick and satisfying meal.
239,5439344755108489,Dyana Sumption,9/18/2024,497852.24,Eco-friendly utensil set made from natural wood.
240,3574567323885515,Bartie Beauly,11/30/2024,782778.65,"Trendy leggings with a unique graphic print, versatile for workouts and casual wear."
241,3541998719476348,Federica Vitall,11/7/2024,213216.53,Complete grooming kit for dogs and cats.
242,3582994656696543,Dionne Bogies,12/25/2024,992580.26,Multi-level scratching post to keep your cat entertained.
243,201846806260926,Carla Bynert,9/11/2024,362602.95,Refreshing sorbet with a zesty lemon flavor.
244,201934662871190,Yurik McCaughren,12/23/2024,683220.12,"Classic marinara sauce for pasta, pizza, or dipping."
245,3558819798309376,Eugenio Nolin,9/2/2024,384142.93,Lightweight windbreaker for outdoor activities.
246,6331101633933000,Aprilette Mosley,5/23/2024,50935.51,Classic fit blue jeans with a slight stretch for comfort and durability.
247,5477786685684794,Berke Bedham,7/13/2024,165692.29,Beginner-friendly drone with HD camera.
248,3569782408294809,Tiffy Wathen,2/6/2025,872570.53,"Creamy yogurt with probiotics, available in various flavors."
249,3549489792774181,Krystalle Shrimptone,8/24/2024,391900.64,Oven-roasted potatoes tossed in garlic and parmesan cheese seasoning.
250,3573449466941150,Lucas Fee,6/4/2024,36735.13,Space-saving adjustable dumbbells for strength training.
251,501871059319111059,Evy Darridon,4/15/2025,358193.79,Color-changing 3D night light for kids' rooms.
252,201948405809382,Meg Fibbings,11/18/2024,529932.37,"Trendy high-low tee with a relaxed fit, ideal for weekends."
253,3588518742971737,Kirby Shark,3/24/2025,134204.08,Mixed fresh vegetables for stir-frying or roasting.
254,3552784500911925,Tracey Grafom,6/29/2024,542941.6,Convenient water bottle for pets on the go.
255,5602235015349569,Patti Whittet,3/3/2025,857098.18,Efficient juicer for fresh fruit and vegetable juices.
256,3541372185494633,Kain Spelman,10/29/2024,121471.5,Engaging kit with science experiments for children.
257,3582394636388008,Ruthie Bradtke,12/8/2024,185349.69,Quick-boiling kettle for home and office use.
258,3549037367949157,Gracia Reace,5/31/2024,989666.63,Elegant chiffon blouse perfect for work or outings.
259,5602257547673191,Lorianna Barlow,10/10/2024,336020.89,Crispy and sweet dried apple slices
260,3577072289857910,Isaiah Edwinson,4/21/2025,987334.78,Sweet and tangy honey mustard dip for snacks.
261,3535675869489051,Rosamund Labbati,3/13/2025,890529.14,"A mix of fresh vegetables with a savory stir-fry sauce, ready to cook."
262,5002354694373703,Em Pringle,2/10/2025,802594.33,Stainless steel travel mug with spill-proof lid.
263,5602222364987983,Rivy Stogill,7/25/2024,461230.5,Comfortable trainers with mesh inserts for breathability.
264,3554730161307026,Amanda Bletsor,2/4/2025,570445.3,Precision cooker for perfect sous vide cooking.
265,30565847760143,Melvin Leckey,11/27/2024,492380.42,Padded laptop sleeve for protection against scratches.
266,3564026253281601,Yorker Gyrgorcewicx,3/1/2025,654737.21,"Crispy chips made from taro root, a wonderful snack."
267,3552255686985330,Melody Deeprose,9/1/2024,637140.43,Delicious cookies packed with oats and raisins.
268,630471315975018322,Renee Idale,12/15/2024,871354.85,High-quality sketchbook for artists.
269,30408232141142,Smith Swadon,1/29/2025,280261.38,"Soft and comfortable robe, perfect for lounging at home."
270,6371931944978315,Peta Abys,8/30/2024,247654.78,"Tangy sour cream, perfect for dips and toppings."
271,4041594207458,Ricardo Haselwood,2/1/2025,431377.61,Control your lights remotely with a smartphone app.
272,3587843061879548,Carlin Huyhton,4/2/2025,698075.44,Training tool for reinforcing commands and behavior in dogs.
273,6334376282683981614,Kendell Adamsson,8/25/2024,415690.16,Fluffy pancakes with buttermilk flavor.
274,30554975803677,Bliss Budnik,2/8/2025,232919.31,Savory and chewy beef jerky with teriyaki flavor.
275,6759630738681505,Terrance Pillington,3/1/2025,201395.66,A rich curry paste for making authentic Thai green curry at home.
276,374622218870797,Pavlov Groven,11/9/2024,495408.12,"Sweet, chewy dried apricots, great for snacking or baking."
277,3548161442955400,Ardith Beckhouse,5/23/2024,660670.63,Advanced electric toothbrush for effective cleaning.
278,4041593344831,Nicolina Coleridge,5/15/2024,642486.64,Handy dispenser for quick access to safety pins.
279,6706636802457837315,Annnora O'Currane,7/2/2024,143188.26,Portable induction cooktop for quick heating.
280,3563396807370551,Leone Harrold,10/16/2024,49127.67,Professional-grade nail care set for manicures and pedicures.
281,3546328618407241,Howard Fortye,8/24/2024,326510.16,"Authentic Italian pasta, perfect for a classic meal."
282,3545926587737737,Mariquilla Calvie,11/13/2024,712340.77,Infuser for brewing loose-leaf herbal teas easily.
283,5010128781407404,Cthrine Obee,3/21/2025,288605.61,"Pasta tossed with fresh basil pesto, simple and delicious."
284,201500417195548,Marketa Machent,12/3/2024,648205.99,Delicious maple-flavored oatmeal for a quick breakfast.
285,201706890481426,Nial O'Farris,8/20/2024,819552.7,"Soft and pillowy gnocchi made from cauliflower, perfect with sauce."
286,30299851755001,Thaddeus Peterson,11/26/2024,714636.19,"Traditional Korean fermented vegetables, packed with flavor."
287,5100147635610253,Ronalda Sharrocks,6/13/2024,789499.17,Pulled jackfruit in a smoky BBQ sauce for a tasty vegan dish.
288,3563013895772313,Teodor Parnaby,9/19/2024,12172.37,Manual pasta maker for homemade pasta.
289,5100138163345545,Stephana Zorzin,1/24/2025,512836.42,"Coffee blend infused with pumpkin spice, perfect for fall."
290,372301401843646,Hermine Bohlens,11/28/2024,884901.43,Bright LED flashlight with adjustable beam.
291,201430984702858,Henrie True,7/23/2024,501361.55,Crispy and delicious biscotti flavored with cranberry and almond.
292,374622926006437,Andreas Pavis,9/23/2024,688929.0,Frozen mini meatballs that are great as a snack or in pasta dishes.
293,3575468832690729,Dasie Macrow,1/27/2025,527662.36,Eco-friendly string lights for outdoor decor.
294,3560276468164373,Jessica Borsi,6/21/2024,632689.84,A hearty vegetable curry for a quick and satisfying meal.
295,376439047801267,Barbey Chedgey,2/4/2025,490090.64,Stream HD video wirelessly from devices to TV.
296,5108757609844936,Nathanil Skydall,8/13/2024,36636.78,Variety pack of craft supplies for kids' projects.
297,3537684145874324,Tuck Watterson,12/2/2024,582186.44,A nutritious shake with rich chocolate and refreshing mint flavors.
298,6334319708656193225,Nadeen Hitcham,4/22/2025,410404.71,Durable gloves with built-in claws for digging and planting.
299,3573290957594276,Kennett Skivington,5/6/2025,119656.6,Freshly baked artisan bread with a crisp crust and soft center.
300,6377906719472458,Kelcie Gladbeck,3/5/2025,395854.25,Crisp and delicious organic apples.
301,3543523992214378,Brendon Glandfield,6/4/2024,12441.95,"Reusable wraps for food storage, replacing plastic wraps."
302,4175005731236733,Dorine Tibols,10/13/2024,167142.53,A blend of spices that brings the taste of fall to your baked goods.
303,201507684465215,Ransom Ripping,7/13/2024,556845.06,"Gluten-free tortillas made from almond flour, perfect for various wraps and meals."
304,3531345428031422,Ragnar Tomaschke,9/21/2024,542300.74,Keep bugs out while allowing fresh air in during summer.
305,374288500714885,Mathian Swinbourne,6/14/2024,121252.25,Countertop dishwasher for small kitchens.
306,6706963481376260,Kathy Jukes,11/10/2024,429885.48,Chewy granola bars made with honey and almonds.
307,3548502622971495,Cory Paynter,2/8/2025,717382.69,"Easy-to-prepare rice with cilantro and lime flavors, great as a side."
308,3589468018285058,Eugen Buckie,9/8/2024,684510.96,Vibrant watercolor paints that come with brushes and palettes.
309,378552181514823,Dotty Grinov,12/28/2024,295194.69,Durable scoop for perfectly shaped ice cream servings.
310,3561707365051544,Jasmine Chin,5/14/2024,288735.64,"Rich and creamy dip made with real avocado, great for chips."
311,4017957791241510,Darryl Brownsey,12/18/2024,665456.86,High-performance mechanical keyboard with customizable RGB.
312,6759504443606127015,Krystle Tunuy,1/11/2025,313346.73,Memory foam travel pillow for neck support.
313,3538728985913830,Sallee Kubasiewicz,1/18/2025,362501.22,Delicious veggie burger patties for grilling or frying.
314,5048374493906327,Jodi Hagley,7/17/2024,495080.58,"Freshly baked bagels, perfect for breakfast or snacks."
315,3563226955770437,Jedediah Sulland,11/14/2024,144808.75,Delicate green tea leaves for a refreshing beverage.
316,3585217180771062,Lil Lurriman,3/19/2025,409669.18,Space-saving cup that folds flat for easy storage.
317,3557865097369448,Nikolia Sweetman,4/23/2025,77081.24,Powerful hand blender for soups and smoothies.
318,337941734922080,Rafe Kilday,11/1/2024,404732.31,Everything you need to make melt-in-your-mouth cinnamon rolls at home.
319,3543001106195247,Rich Crake,4/13/2025,335262.72,Fresh and crunchy baby carrots ready for snacking.
320,3568565301387445,Glynn Parton,5/17/2024,418701.67,Hand-poured candles made of natural soy wax.
321,374288970416631,Amelina Sommerland,8/3/2024,270335.18,Seat belt attachment to keep dogs safe during car rides.
322,3575602110067115,Vyky Fetherstone,1/13/2025,151481.87,Adjustable weighted jump rope for workouts.
323,5481822880434166,Laney Barnhill,1/7/2025,343486.98,Eco-friendly charger with a built-in solar panel for outdoor use.
324,3558861809260404,Quinlan Wapples,3/4/2025,347411.54,Adjustable laptop stand for better ergonomics.
325,3538195393922839,Jewelle Kinmond,2/17/2025,911647.05,Rich and creamy almond milk with a hint of chocolate.
326,6395845256791326,Donna Exer,12/26/2024,243231.21,Compact waffle maker for perfect small waffles.
327,6759459289121592398,Torrance Batalini,7/22/2024,335851.99,Comprehensive first aid kit for home or travel emergencies.
328,4026419439709928,Melanie Gauntlett,11/1/2024,843283.1,Prepped vegetables and sauces for a quick Asian stir-fry meal.
329,3549652512162694,Crin Amber,7/12/2024,629476.05,Healthier way to make popcorn in the microwave without oil.
330,3576013682463691,Urban Bohlje,4/21/2025,130008.18,Craft your own lip balms with this complete kit.
331,3577839243694773,Vachel Klasen,6/16/2024,905244.13,Sweetened powder for refreshing lemonade.
332,3555723888165230,Stern Yukhnov,11/28/2024,404588.33,"Creamy goat cheese infused with herbs and garlic, perfect for spreading on crackers."
333,201687737827742,Murielle Gurner,5/19/2024,74820.1,Easy-to-set up tent designed for campers and hikers.
334,3556101370878223,Scarface Launder,2/14/2025,505791.36,"Plain white rice, a staple for any meal."
335,3561344231213882,Dre Morton,1/17/2025,511753.42,"Sweet and chewy dried mango slices, perfect for snacking."
336,63048572314512195,Lauraine Peare,11/7/2024,133448.63,Rechargeable LED camping lantern for outdoor use.
337,3588826063830626,Roldan Girodier,4/20/2025,188600.09,Soft and chewy bar packed with protein and cinnamon flavors.
338,30137879888315,Lorrin Grove,1/21/2025,204310.35,Delicious apple sauce with a hint of cinnamon
339,4175004401294023,Madge Rogier,12/29/2024,633328.72,Battery-operated motion sensor light for safety.
340,3545691573971738,Alaine Garroway,12/15/2024,111862.09,Marinated chicken breasts coated in a sweet honey mustard glaze.
341,4905985232939262683,Cece Creavin,2/21/2025,269682.64,"Creamy ranch dressing, perfect for salads and dips."
342,201775800387122,Arabella Gremane,1/5/2025,773843.27,Water bottle with built-in UV-C light for self-cleaning.
343,3532090791532924,Petunia Cane,4/22/2025,436309.84,Freshly roasted coffee beans with rich flavor.
344,6304118404139875,Lita Tejada,9/15/2024,463559.25,Engaging kit with science experiments for children.
345,3569311007370297,Burtie Benwell,8/1/2024,430055.07,Bell peppers stuffed with rice and vegetables
346,3568835596591757,Reese Downton,1/23/2025,954905.17,A hearty soup made with organic lentils and vegetables.
347,201928347539271,Florence MacTurlough,1/13/2025,955580.51,"A delicious creamy dip featuring spinach and artichokes, perfect for parties."
348,676351665684474036,Mia Watkiss,5/7/2025,874619.09,Tablet for digital drawing and illustration work.
349,374283962593745,Hebert Parzizek,1/10/2025,125725.53,Nutty flavor perfect for pesto and salads.
350,371296329644566,Tess Ainsley,8/9/2024,475947.57,"Creamy risotto made with mushrooms and herbs, perfect as a side dish or main course."
351,3582491833649099,Xerxes Ferrer,10/18/2024,501410.9,Stability ball for Pilates and yoga workouts.
352,3529530086056951,Vaughan Pasek,7/7/2024,822994.77,Smart robotic vacuum for automatic cleaning.
353,56022228065423256,Marylou Bruineman,7/5/2024,553203.82,Stainless steel travel mug that keeps drinks hot or cold.
354,3535978607562019,Gaylor Morican,10/18/2024,207371.71,Padded laptop sleeve for protection against scratches.
355,3568111935692973,Fremont Klambt,8/29/2024,801998.63,Compostable plates suitable for various occasions.
356,3563409816036426,Sonnie Monkeman,4/27/2025,620109.42,"Hearty stew made with lentils and mixed vegetables, vegan-friendly."
357,4936223996458108884,Dasi Kentish,3/5/2025,983086.93,Crisp and delicious organic apples.
358,633473394345761988,Ulrick Loveday,5/15/2024,923582.72,Plant-based sausage links with spices and herbs.
359,4582232669826783,Maiga Takkos,3/6/2025,570041.86,"Water-resistant jacket ideal for outdoor activities, featuring a packable design."
360,6759698842624313448,Rey Mielnik,7/29/2024,73027.95,"A flavorful garlic butter blend, perfect for cooking or baking."
361,201850883098928,Harriette Robbings,1/1/2025,989630.95,Chic slingback sandals for a relaxed summer vibe.
362,3531180173176704,Clim Syrett,12/1/2024,609814.09,Adjustable LED desk light with brightness settings.
363,4017958788258467,Raimund Beccera,2/8/2025,213488.61,Compact organizer for cosmetics during travel.
364,3544958027094131,Dari Clayfield,11/17/2024,787166.24,A warm and stylish puffer coat perfect for winter weather.
365,3580373918289698,Arlen Mandal,6/5/2024,525254.59,Powerful grinder for making sausage and burgers at home.
366,3565438246711298,Towny Yakubowicz,11/27/2024,84877.72,"Light and fluffy cream cheese, perfect for bagels or cooking."
367,4175004226599051,Wilton Jaycocks,8/11/2024,457564.12,A smoky blend of spices for grilling and roasting.
368,6374555822469126,Sydelle Gypson,5/11/2025,803332.3,Soft bagels flavored with cinnamon and raisins.
369,3561140236577812,Ilise Sconce,8/6/2024,894825.09,"Rich tomato soup flavored with fresh basil, ready to heat up."
370,5002356743388384,Tomaso Sandy,5/20/2024,549406.2,Complete set designed for children to learn gardening.
371,4017955953625,Ginger Shearwood,2/24/2025,483399.75,Fresh greens and veggies for a quick Asian-inspired salad.
372,561072260216391130,Paola Rankling,3/5/2025,325863.01,Complete set to brew coffee with different methods.
373,6706300507387276659,Anitra Clerke,10/1/2024,565108.49,"Fresh salsa made with tomatoes, onions, and cilantro."
374,3558074696415111,Denna Cunnell,11/5/2024,247948.42,"Sweet and salty kettle corn, perfect for snacking."
375,3568854815815897,Eloise Patkin,10/18/2024,804755.07,Water-resistant Bluetooth speaker for showers.
376,3589846531358652,Barr Horsey,1/14/2025,739345.42,Monitor and interact with your pet remotely with this camera.
377,6709813613800531318,Hugibert Blessed,9/8/2024,599560.63,Savory lentil chips with BBQ flavor
378,3571853682719146,Jessica Bethel,8/2/2024,535131.09,Oatmeal made with savory spices and vegetables.
379,6379599543993373,Ruperto d'Arcy,5/7/2025,336821.57,Beginner telescope for stargazing and exploring.
380,201741060304561,Francesco Battyll,8/10/2024,626829.53,Illuminated vanity mirror with adjustable brightness settings.
381,3547943114835155,Stacey Anthona,7/19/2024,918879.42,"A creamy blend of avocados and lime juice, great for spreads or dips."
382,3530444769373484,Zarla Planke,1/31/2025,746231.4,"Soft pretzel bites, perfect for dipping in mustard or cheese sauce."
383,36976262523904,Gordan Bicheno,1/6/2025,120781.22,A tangy sauce that combines lemon zest and basil for a refreshing flavor.
384,3565375145765258,Dickie Bauduccio,5/23/2024,299349.62,Savory sauce perfect for pasta or dipping.
385,675904358075443851,Addie Rodolico,12/9/2024,672837.63,Adjustable laptop stand for better ergonomics.
386,3537262116969363,Joanna Cottie,4/26/2025,193700.95,A soothing herbal tea made from ginger root.
387,36292472122069,Leone Culshaw,2/26/2025,57399.51,Eco-friendly string lights for outdoor decor.
388,3571663980586000,Karim Ballchin,8/3/2024,402226.93,Lightweight bike helmet with adjustable fit.
389,5121048018232167,Meade Edmondson,11/1/2024,479907.4,Delicious veggie burger patties for grilling or frying.
390,5602216180434752505,Sharl Heinrich,11/14/2024,355118.5,A versatile black dress that can be styled for any occasion.
391,5602212871055424,Mikel O'Mara,2/2/2025,752891.04,"Stylish two-tone windbreaker, perfect for active days."
392,5100133088074726,Shelton Surtees,11/25/2024,713062.95,Marinated chicken thighs with smoked paprika for a smoky flavor.
393,6761910067680492,Ara Horder,2/16/2025,443328.65,Creamy hummus made with sweet peas and tahini.
394,3533405944688291,Manfred Bessell,2/26/2025,154820.61,A mix of frozen roasted vegetables for an easy side dish.
395,3544405030953986,Cheri Lune,3/23/2025,470549.63,"A zesty marinade made with lemon juice and garlic, ideal for chicken or fish."
396,6378366089558445,Randee Copnar,8/22/2024,997033.73,Quote wall art to inspire and motivate.
397,5007663780154552,Katina Rutgers,1/12/2025,356892.66,Smooth and creamy smoothie made with peanut butter and banana.
398,337941583354708,Aland Mussalli,1/28/2025,693223.41,Convenient water bottle for pets on the go.
399,345119894189416,Bernardina Attwill,7/17/2024,353011.47,Complete tattoo kit for beginners and professionals.
400,4508360872600835,Albina Prall,1/20/2025,550054.71,Reusable suction cup hooks for hanging items.
401,63045157414627730,Aldon Fairhall,7/5/2024,325480.19,Dairy-free cheese alternative for your favorite dishes.
402,3585292807507868,Minda Anning,3/7/2025,689518.68,"Delicious and fully cooked sliced ham, ready to eat."
403,633110620086106267,Dougie Bernardy,9/3/2024,586119.07,High-quality matcha for making traditional tea or lattes.
404,372301066307614,Christoffer Bank,8/13/2024,204600.68,Stylish stand to hold your recipes while cooking.
405,5108750939195814,Lora Fielder,5/24/2024,465683.36,Adjustable grinders for fresh spices at the table.
406,3548907098660193,Tybalt Skelhorn,6/28/2024,539318.59,"Canned diced tomatoes, great base for sauces and soups."
407,6398123815388977,Onfre Badham,8/10/2024,917816.92,"Shredded potatoes, perfect for breakfasts."
408,3585909308199552,Odo Pym,8/18/2024,709376.43,Compostable plates suitable for various occasions.
409,3540996356150367,Johnna Cowans,2/16/2025,60109.9,A wholesome granola with bits of apple and a touch of cinnamon.
410,3538488959758139,Shana Knellen,1/19/2025,352795.43,Sweet corn roasted to perfection for a delightful side.
411,5402725898022848,Max Brabban,5/14/2024,802599.82,Mix to create a delicious chia seed pudding in just a few minutes.
412,5641820024897482109,Karry Cowdrey,9/4/2024,435705.11,Stylish and modern holder for storing wine bottles on walls.
413,374622952507449,Hayden Kalinovich,11/12/2024,482385.66,A refreshing salad made with quinoa and seasonal veggies.
414,3585003990640089,Dwain Heister,6/12/2024,123331.71,"Sweet and chewy taffy flavored like caramel apples, great for fall."
415,5641827311174437,Romeo Really,2/5/2025,663430.74,"Spicy jalapenos stuffed with cheese, ideal for appetizers."
416,3555762246543886,Prinz Choat,3/15/2025,430959.51,Complete kit to make your own flavored lip balms at home.
417,4026731946342583,Gilbertine Snartt,3/8/2025,443732.22,Ideal for creating custom designs on t-shirts and fabrics.
418,374622204576085,Lanette Storrock,2/14/2025,61695.5,"Organize travel documents, passport, and cards."
419,3569324159430447,Oralla Sanchiz,6/11/2024,396867.92,"Rich and creamy tomato basil soup, perfect with a grilled cheese."
420,6380092674349588,Gradeigh Ekell,4/23/2025,638617.7,"Creamy vanilla fudge, a sweet treat for all occasions."
421,3538965527193790,Sindee Broadway,2/12/2025,570702.32,Dairy-free cheese alternative for your favorite dishes.
422,6767501907934902642,Bill Rassmann,3/5/2025,118323.64,Marinated beef strips in teriyaki sauce for easy grilling.
423,3552695134158289,Dominik Iacomelli,1/23/2025,669751.86,Vegetable spiralizer for healthy meals.
424,374622780340278,Byrann Authers,11/22/2024,23444.0,"A blend of nuts, seeds, and spices for a healthy snack."
425,3567026546304050,Patty Assandri,4/29/2025,774746.06,Modern desk lamp that features a built-in USB charging port.
426,3564046415572127,Phillie Keefe,3/20/2025,997116.44,Handmade eco-friendly bowls made from real coconuts.
427,4991181749066,Travers Plester,12/17/2024,421144.18,Assorted indoor plants for home decor.
428,67612982755759774,Renie Bortoluzzi,11/12/2024,48171.79,"Decadent brownies made without gluten, rich and chocolatey."
429,201759365055746,Jacob Tinston,3/12/2025,364819.01,"Durable canvas tote bag, perfect for everyday use."
430,4917026518497069,Roseanne Lampert,10/7/2024,119076.88,A flavorful sauce made with coconut milk and spices.
431,3539405710251724,Vilhelmina Hissett,10/6/2024,779033.82,Set of two yoga blocks for increased stability and support.
432,4911018643057278,Delainey Woollam,3/3/2025,457688.99,"Sweet bread with cinnamon and raisins, great for breakfast or snacks."
433,3587658822303319,Davidde Querree,9/27/2024,855056.7,Thermos that tracks your water intake and temperature.
434,4405191333638229,Caro Walkington,5/1/2025,615777.96,Refreshing coconut water packed with electrolytes for hydration.
435,6709983208095818,Arlen Downing,10/7/2024,25613.24,Leak-proof cooler bag ideal for picnics and camping.
436,3536116831042008,Henriette Woehler,5/30/2024,250268.7,Crispy cauliflower bites tossed in spicy buffalo sauce.
437,3540339582300409,Sherlock Dries,2/20/2025,723947.33,A staple v-neck t-shirt that pairs well with anything.
438,4844737429642910,Michel Petrolli,4/22/2025,552805.11,Grilled chicken skewers glazed with teriyaki sauce.
439,3563882143092090,Bryant Bowmer,3/30/2025,358642.64,"Supportive sports bra designed for high-impact workouts, made with moisture-wicking fabric."
440,3534293770752038,Townsend Spillard,8/23/2024,330353.24,Complete set to brew coffee with different methods.
441,30477124091251,Carena Haslewood,3/25/2025,85127.49,Artisan bread with caraway seeds for added flavor.
442,378051927569290,Suzy Tavernor,6/1/2024,688922.46,"Moist, fluffy muffins packed with bananas and walnuts for a delightful breakfast or snack."
443,3572846966608703,Cinda Ricciardello,5/4/2025,808085.75,Soft buns perfect for stuffing with your favorite hot dogs.
444,3542088453607925,Nerita Empson,1/2/2025,106076.03,Stackable containers for organizing snacks and treats.
445,6388172211484668,Gunar Sorrie,4/1/2025,980851.88,Roasted almonds dipped in rich dark chocolate.
446,5641825436096458505,Olwen Tewkesberry,5/2/2025,818035.65,A fitted ribbed knit dress that hugs your curves perfectly.
447,4913304359637851,Carina Houlaghan,1/2/2025,800510.91,Compact waffle maker for perfect small waffles.
448,5575984419291389,Pascale Lusk,5/9/2025,616088.52,Ideal for creating custom designs on t-shirts and fabrics.
449,3579428578641480,Costanza Vakhlov,4/4/2025,321919.64,Protective gaiters to keep dirt and debris out of shoes during hikes.
450,374729094530005,Mireille Hannabuss,7/22/2024,597034.0,Bold combat boots that make a statement with any outfit.
451,4175005510057516,Nev Tapscott,9/3/2024,233720.95,Perfect dipping sauce or stir-fry addition for a sweet and tangy flavor.
452,5131651518400552,Harriett Masselin,6/18/2024,787392.03,"Frozen pizza rolls stuffed with spinach and cheese, perfect for snacking."
453,374622172017955,Celestyna Ormston,6/7/2024,104383.71,"Pasta alternative made from sweet potatoes, gluten-free and rich in flavor."
454,630419003829341976,Denna Braidford,2/5/2025,326572.67,"Tender sweet corn kernels, ready to eat or add to dishes."
455,4026546678859996,Shayla Albarez,3/8/2025,586894.24,Eco-friendly soy candles with a variety of scents.
456,3569564254029947,Noll Winkle,7/7/2024,490907.49,"Frozen pizza rolls filled with vegetables and cheese, perfect for snacks."
457,378370271004369,Upton Dubber,9/14/2024,452614.67,Comfortable camping mattress that inflates automatically.
458,633110101940755227,Sarge Melmore,2/8/2025,789630.56,Healthy granola made with oats and honey.
459,5610766291303979,Jolyn Seakin,8/15/2024,982867.14,Modern desk lamp that features a built-in USB charging port.
460,4041379558067,Frank Smieton,4/21/2025,542805.32,Gentle brush for removing loose fur from pets.
461,675961268530498269,Rea Klicher,3/14/2025,828638.93,Travel-friendly dog bowl that is collapsible for easy storage.
462,5293795989185368,Ebonee Mattam,12/22/2024,798495.79,Comfortable trainers with mesh inserts for breathability.
